상품이름,최저가
노드그린 파이오니어 메탈시계 가죽스트랩 세트,404600
노드그린 필로소퍼 메쉬스트랩 메탈시계,227800
노드그린 파이오니어 메쉬스트랩 메탈시계,295800
카시오 시계 수능시계 MQ-24-7B,7200
드레텍 스탑워치 T-186,6770
태그호이어 아쿠아레이서 다이버300 메탈시계 WAY101C BA0746,538100
카시오 손석희 앵커 시계 a168wa 외 A168WA,16450
해밀턴 오픈하트 재즈마스터 오픈 하트 메탈밴드 시계H32705141,800000
태그호이어 포뮬러1 쿼츠 남성시계 CAZ1011.BA0842,543100
카시오 여성 가죽시계 클래식 김혜수시계 여성시계 LTP 7E1 LTPV007L7E1,11000
조이덴 와치와인더 1구 2구 시계보관함,38240
엠포리오아르마니 아르마니 남성시계 AR11208,68000
지샥 DW-5600BB-1,58000
카시오 사각 텐피엠 가죽밴드 시계 LTP-V007L,14930
로즈몽 여성시계 RS45-05DT-MT,12800
엠포리오아르마니 EMPORIO 여성 메탈 손목시계 AR1764,87000
시티즌 프로마스터 드라이브 시계 PMD56-2951,458500
지샥 터프솔라 전자시계 G-5600E-1DR,82000
카시오 우레탄밴드 군대 군입대시계 커플시계 패션아이템 F91W F-91W-1,11630
드레텍 스탑워치 공시생 수험생 스톱워치 T-186 T-580,8900
카시오 스포츠전자손목시계 남성여성 F-91WM-7A,8000
순토 코어 올블랙 아웃도어시계 SS014279010,131790
카시오 다이버 시계 흑새치 남성용 MDV106-1A,58900
노드그린 네이티브 화이트다이얼 블랙레더 시계,168300
노드그린 유니카 로즈골드 여자손목시계,253300
노드그린 파이오니어 크로노그래프 남자시계,404600
해밀턴 카키 필드 메카니컬 다크 다이얼 카키 나토 스트랩 남성 시계 H69439931,456000
카시오 전자손목시계 진동알람 남자 군인 W-735H-1A,25790
영실업 여아 시크릿쥬쥬 보석시계 어린이날 여자장난감 완구,54960
카시오 무료각인 전자시계 군인시계 W-217H-1A,7000
카시오 여성가죽손목시계 여자남자 학생남성방수,12680
지샥 빅페이스 흑금 군인시계 GA-110GB-1A,12120
카시오 수능 학생 시계 수험생 손목,8200
카시오 청판 사각스퀘어 미니멀 시계 AQ-230GG-2A,30920
로즈몽 노스텔지아 메탈밴드 시계  NS-012SVR-MT6 NS-012RVR-MT6,294330
태그호이어 포뮬러 크로노그래프 시계 청판 포뮬러 1 CAZ101K,553100
카리아노 진품 게르마늄시계 금시계 커플시계,97230
지샥 나토밴드 전자시계 DW-5600BBN-1,77000
카시오 시계 빈티지디지털 A158WA-1DF A-158WA-1D,16530
라이프썸 듀얼 디지털 스톱워치 LFS-HA28,12000
카시오 수능시계 아날로그 MQ-24-7B3,4500
카시오 여성용 메탈시계 LTP-V007D-7E,15870
세이코 사파이어글라스 메탈시계 SUR309J1 SUR311J1 SUR633J1,145000
터치 전자시계 LED 손목 시계 스크린 실리콘 날짜 기능,3340
카시오 흑새치 다이버 시계 MDV106B-2AV,21970
해밀턴 카키 필드 오토 메탈 남성 시계 H70455133,617000
노드그린 네이티브 메쉬스트랩 손목시계,176800
노드그린 필로소퍼 링크스트랩 남자시계,282200
카리아노 진품 게르마늄 시계 메탈 남성 여성 금장 손목 cariano,99900
시계줄 카시오호환밴드 우레탄밴드 가죽줄 W-96H,3490
카시오 수능시계 에스크 시계 2 MQ-24-7B2,7910
미쉘에블랑 여성시계 17478/08,332890
스톤헨지 시계 S0236,174468
로이드 어썸스퀘어 소프트 클래식 스퀘어 가죽시계 LL2G20901XGR,53910
지샥 지코스모 지얄오크 정품보증서 쇼핑백 풀패키지 AS GA-2100-4ADR,82460
세이코알바 남성메탈시계 크로노그래프 AF8M71X,122800
살바토레페라가모 시계 SFIK00419,345310
카시오 여성 여자 손목시계 아날로그 가죽 빈티지 사각시계 LTP-V007L-9B,15230
1년AS 와치와인더 1구 2구 오토매틱 시계보관함 JBW097,46860
까르띠에 시계 탱크솔로 스몰 W5200013,3652000
까르띠에 탱크솔로 가죽밴드 시계  WSTA0028,3159520
세이코 오토매틱 다이버 메탈밴드 시계 SRPD51K1,259000
무소음 수험생 스터디 수능 공부 공시생 시험 타이머 초시계 스톱워치,4100
공부 타이머 타임 드렉텍 스탑 스톱 워치 스터디 디데이 드레텍 수험생 공시생 초시계,9500
로즈몽 여성시계 RS 62-04RM-MT,370800
챙겨줘 집사 시계거치대 우주인 대,4900
[ 타임즈 와치 ] 롤렉스 서브마리너 청판 콤비 41mm 새상품 2021년 백화점구입 116613,24500000
프레드릭콘스탄트 시계 FC-335MC4P6,1256100
메탈 시계 줄 줄이기 사이즈 조절기 교체 공구,530
