상품이름,최저가
스타벅스 쿨 라임 피지오 Tall 추석선물,5900
스타벅스 카페 아메리카노 Tall,4100
스타벅스 카페 아메리카노 톨 추석 선물,4100
스타벅스 DT 스탠리 스트로 보온병 591ml,14930
스타벅스 SS 에치드 텀블러 473ml,11780
스타벅스 SS 콩코드 사이렌 화이트 텀블러 591ml,27100
2021 스타벅스 가을 md 미니쿠퍼 텀블러 우드 트레이 오텀 트래블백 mini 컵홀더,25000
스타벅스 SS 그린 처비 핸들 텀블러 473ml,27500
스타벅스 SS 컨투어 워드마크 텀블러 355ml,23500
스타벅스 스탠리 텀블러/보온병 500ml/엘마, 2021 가을 md,33000
스타벅스 아이스 카페 아메리카노,3690
스타벅스 레마 텀블러 473ml,11870
스타벅스 SS 블랙 앤 골드 스탠리 보온병 500ml,34490
2021 스타벅스 텀블러 대용량 스텐 텀블러 레마 스트랩 에치드 7종 473ml 보온보냉,12900
2021 스타벅스 여름 md 샤넬 스페셜 에디션 다이어리 스벅 텀블러 보온병 한정판 가방,14900
[바로콘] 스타벅스 Gift 무료 음료 쿠폰 (전 사이즈) 기프티콘,5400
스타벅스 스탠리 텀블러 스테인리스 304 투고 빨대 보온병 머그 2021 한정판,20400
스타벅스 블랙 사이렌 콜드컵 473ml 591ml 710ml 북미 벤티사이즈,19000
스타벅스 달콤한 디저트 세트,8950
2021 스타벅스 텀블러 여름 md 미니 3차 머그컵 스탠리 리저브 랜턴 591ml SS,25000
2021 스타벅스 가을 md 텀블러 머그컵 보온병 더블월 토끼여우 한정판 가방 선물세트 추석,27000
스타벅스 엘마 텀블러  473ml,26600
스타벅스 리유저블 벤티 콜드컵 710ml 2개,10990
스타벅스 앱전용 e카드 5만원 교환권 추석선물,50000
스타벅스 부드러운 디저트 기프티콘 추석선물세트,12700
촉촉한 티라미수 세트,14100
스타벅스 컬러체인징 리유저블 콜드컵 710ml,10900
스타벅스 SS 루시 레터 슬리브 텀블러 355ml,20500
스타벅스 스텐 콜드컵 473ml,12300
스타벅스 [GIFT] 카페 아메리카노 Tall 무료 쿠폰,3500
스타벅스 부드러운 커플 디저트 세트,11300
시애틀 스타벅스 1호점 핸드클립 스타벅스컵 텀블러,48000
스타벅스 콜드컵 710ml, 벤티, 스터드, 지압텀, 휠라, 2021 가을 MD,15000
스타벅스 크러쉬 콜드컵 텀블러 473ml,12800
2021스타벅스 가을 md 텀블러 머그컵 중추절 토끼 여우,30000
스타벅스 사이렌 콜드컵,18780
스타벅스 오늘의커피 Tall,3600
스타벅스 투고 텀블러,500
스타벅스 스탠리 빨대 텀블러 DT 591ml,32700
스타벅스 리유저블 텀블러 컨페티 콜드컵 710ml 색종이 빨대텀블러 컬러체인지,6900
스타벅스 벤티 콜드컵 텀블러 (710ml),33900
스타벅스 블루 여름 md 텀블러 머그컵 미스틱 엘마 올슨 스탠리 2021 SS 콜드컵,25000
스타벅스 그린 그러데이션 사이렌 콜드컵 591ml,14390
[기프티콘] 스타벅스 카페라떼 Tall,4600
스타벅스 SS DW 그린 워드마크 투고 텀블러 591ml,36500
[기프팅] 스타벅스 부드러운 디저트 세트 (부드러운 생크림 카스텔라+아메리카노 Tall 2잔),12700
스타벅스 너만큼 완벽한 디저트 세트,20300
스타벅스 기분 좋은 디저트+커피 세트,13700
스타벅스 촉촉한 디저트 기프티콘 추석선물세트,14100
스타벅스 e-gift카드 3만원권,30000
스타벅스 스탠리 스트로 텀블러 DT 스벅 보온보냉 벤티 591ml,21910
스타벅스 시원한 아메리카노 커플 세트,7450
스타벅스 밀키웨이 사이렌 콜드컵,35900
북미 스타벅스 리유저블 텀블러(슬리브포함) 벤티 콜드 컵(세척솔 포함) 워터보틀 MD,11500
스타벅스 블루베리 마카롱,2440
[미국발송] 2021 북미 스타벅스 블랙 매트 지압 텀블러 MD 710ml,35000
시애틀 스타벅스 1호점 스벅 텀블러,48000
스타벅스 북미 리유저블 텀블러 그린사이렌 투명 콜드컵 아이스 그란데 473ml 빨대포함,4900
미국 스타벅스 콜드컵 핑크 그린 블랙 지압 콜드컵 텀블러,33000
2021 스타벅스 스프링 아이스 텀블러 핑크 보온병 대용량 빨대 스벅 콜드컵 리유저블 가을 md,29900
스타벅스 기분좋은 디저트 세트,12400
스타벅스 텀블러 해외판 모음 (SS 에치드, 콜드컵, 그라디언트),25000
2021 스타벅스 텀블러 벤티사이즈 봄 여름 머그 컵 리유저블 스탠리 스벅/블랙골드 md,27000
2021 스타벅스 봄 md 스벅 텀블러 리유저블 머그 콜드 컵 여름 벤티사이즈 벚꽃,33300
스타벅스 포레스트 미드나잇 콩코드 텀블러,49600
[바로콘] 스타벅스 Gift 무료 음료 쿠폰 (Tall 사이즈) 기프티콘,4800
스타벅스 스탠리 힙 플라스크 텀블러 네이비 스테인리스스틸 237ml,49900
스타벅스 리유저블 텀블러 473ml,3900
[기프티콘] 스타벅스 Happy Birthday Set,15100
스타벅스 아이스 자몽 허니 블랙 티,5300
스타벅스 하트 파이,3200
스타벅스 하루 한 컵 레드 기프티콘 추석선물,2600
스타벅스 아이스 자몽 허니 블랙 티 Tall,4900
스타벅스 스벅 텀블러 블랙 사이렌 콜드컵 그린 클래식 머그,14900
스타벅스 너만큼 완벽한 디저트 세트,18800
싱가포르 스타벅스 그린코어 에센셜 2021 (민트 사이렌) 여름 MD, 스테인리스 텀블러,35000
스타벅스 스탠리프렌치 빨대 텀블러   591ml,7300
스타벅스 APP전용 e카드 5만원 교환권,49900
스타벅스 시티 텀블러 서울 경주 광주 대구 대전 부산 인천 제주 외국인선물,17000
스타벅스 그린 팝핸들 콜드컵 473ml,12400
스타벅스 리유저블 텀블러 컬러체인징 콜드컵,12400
1+1 직장인 선물 스타벅스 리유저블 콜드컵 bpa프리 스벅 텀블러,14500
스타벅스 21 SS 블루 뉴턴 텀블러 355ml,47100
스타벅스 컬러체인징 리유저블 콜드컵세트 710ml 5p,38240
[MMS발송 E쿠폰] 스타벅스 음료 쿠폰 4종 보고 & 아메리카노 & 별 & 텀블러 쿠폰,3500
2021 샤넬 스타벅스 2021 md 명품 굿즈 텀블러 다이어리 스페셜에디션 선물 여친,24500
스타벅스 스토조 콜라보 접이식 실리콘 텀블러 473ml,25000
2021 스타벅스 여름 md 4차 3차 텀블러 트로이 보온병 밀키웨이 사이렌 콜드컵 목쿠션,25000
스타벅스 포레스트 그린 뉴포트 텀블러,35000
스타벅스 달콤한 싱글 디저트 세트,9590
포유아이엔씨 킵 빨대 텀블러 이중 리유저블 스테인리스 304,13630
스타벅스 미니쿠퍼 카드 텀블러 2021 MD MINI 스탠리 투고 마카롱 쿠키 컵홀더,29900
스타벅스 오늘의 커피 기프티콘 추석선물,3800
스타벅스 아이스 카페 아메리카노 톨 추석 선물,4100
스타벅스 아이스 카페모카 Tall 추석선물,5100
스타벅스 벚꽃길 스플래시 콜드컵 2021 체리블라썸 MD,29900
스타벅스 텀블러파우치세트 스벅 스테인리스 360ml텀블러,79200
스타벅스 서니 스트랩 워터보틀 500ml,19000
스타벅스 SS 블랙 헤리티지 오드리 텀블러 355ml,31000
2021 스타벅스 텀블러 벚꽃 md 스벅 봄 여름 리유저블 머그 컵 벤티사이즈 지압 콜드컵 2,25000
스타벅스 곰돌이 텀블러 라틴 아메리카 베어리 여름 md 빨대 콜드컵 한정판 (500ml),12900
이상민 텀블러 오슬로 1리터 보병 빨대 대용량 투썸 스타벅스 머그 보온병 손잡이 콜드컵,22900
스타벅스 애프터 눈 라떼 세트,8250
2021 북미 스타벅스 스테인리스 벤티 콜드컵,39900
스타벅스 사이렌 콜드컵,18900
스타벅스 투명 콜드컵 텀블러 473ml/710ml,14750
스타벅스 클래식 스콘,3160
스타벅스 Happy Birthday 세트,13300
스타벅스 SS 스탠리 리저브 아이슬란드 텀블러 473ml 아이슬랜드 스텐,35000
스타벅스 텀블러 레마 에치드 콜드컵 스탠리 써모스 보온병 대용량 빨대 보온보냉(473ml) 외 12종,11600
2021 스타벅스 컬러체인징 리유저블 X 귀여운 빨대마개 콜라보 세트 콜드컵 710ml,14900
스타벅스 미르 사이렌 민트 텀블러 591ml 선물,33000
스타벅스 부드러운 생크림 카스텔라,4320
스타벅스 카페 아메리카노,3650
[기프티콘] 스타벅스 간편한 한끼 세트,7100
스타벅스 하트 파이+카페 모카+카라멜 마키아또,13900
스타벅스 아이스 카페 아메리카노 Tall,4100
스타벅스 앱전용 e카드 5만원 교환권 추석선물,50000
스타벅스 텀블러 그린 코어 MD 210810 커피리프, 힐사이드, 머그, 워터보틀, 미르사이렌,13400
스타벅스텀블러 대용량 스벅텀블러 써모스원터치 보온보냉 스탠 30대아내생일선물,31900
스탠리 보온병 보틀 텀블러 (473ml / 709ml)+스타벅스 키링/단체주문/레이저각인,28400
스타벅스 데비, 오드리 텀블러/머그컵 414ml, 손잡이, 2021 md, 블랙, 여름 4차,25000
스타벅스 망고 패션후르츠 블렌디드 Tall,4500
스타벅스 하루 한 컵 레드,2540
[기프티콘] 스타벅스 딸기 딜라이트 요거트 블렌디드 Tall,6100
스타벅스오로라글라스 2021스타벅스텀블러 스벅머그컵 지암텀블러 한정판,41200
[365일문자전송]스타벅스 무료음료쿠폰 별쿠폰 텀블러쿠폰 벤티 톨사이즈,4730
스타벅스 SS 엘마 블랙 텀블러 473ml 2020 스텐 여름 벚꽃 여름 집들이선물,33000
스타벅스 마이애미 밀키웨이 콜드컵 2021 여름md,27990
스타벅스 스벅 스테인레스 에치드 대용량 텀블러,13500
스타벅스 텀블러 사이렌로고 리저브 한정판 매트블랙 스테인리스 빨대컵 600ml,19500
스타벅스 레드벨벳 크림치즈 케이크,5200
스타벅스 콩코드 텀블러 591ml 모음 (벤티콩, 2021스타벅스여름md),35000
스타벅스 스탠리 리저브 아이슬란드 텀블러 리저브md,29000
스타벅스 서머 포레스트 글라스 돔 콜드컵,24200
스타벅스대용량텀블러 스테인레스910ml 리미티드에디션 온보냉텀블러,9900
스타벅스 2021 여름 MD 2 서머 스탠리 아이슬란드 텀블러,43000
스타벅스/커피빈 미르 텀블러 473ml, 2021 가을 MD, 리저브, 휠라,35000
스타벅스 앱전용 e카드 3만원 교환권 추석선물,30000
스타벅스 달콤한 디저트 세트 추석선물,9800
스타벅스 추석 SS블랙 헤리티지 오드리 텀블러,31000
스타벅스 블루베리 쿠키 치즈 케이크,6620
스타벅스 21 제주 동백 레나 워터보틀 2021 제주MD 한정판,17000
대만 스타벅스 지압텀블러 스타벅스 텀블러 4종,29990
스타벅스 투명 콜드컵 24oz 더블월 코어 473ml 710ml,30500
1+1 2021 스타벅스 X 스탠리 DT 스텐 텀블러 MD 빨대컵 커플 직장인 답례품 생일 선물,44900
스타벅스 22주년 기념 트로이 텀블러,32300
시애틀 스타벅스 1호점 텀블러,58000
[문자전송]스타벅스 텀블러 쿠폰 벤티사이즈 무료음료쿠폰 모바일상품권 스벅 텀쿠 별쿠 선물,5400
스타벅스 콜드브루 리유저블 보틀 텀블러 500ml 쿨링 파우치 그린/민트,23000
북미 스타벅스 리유저블 핫컵 473ml 벤티 콜드컵 710ml,7300
스타벅스 SS 트로이 청담스타 블랙 텀블러 355ml,38900
스타벅스 텀블러 2021 여름 드림스타 블루 퍼플 보라 글라스 빨대 컵 스탠 스벅 별다방,68500
스타벅스 트위스트 밀키웨이 콜드컵,19000
스타벅스 콜드컵 591ml, 블랙 앤 골드 SS 밀키웨이 사이렌 2021 여름 벤티 텀블러 빨대컵,34000
스타벅스 따뜻한 아메리카노 커플세트,7300
스타벅스 커피리프 힐사이드 텀블러,24500
스타벅스 커피리프 슬리브 워터보틀,13000
스타벅스 이중진공 보온보냉 텀블러 15종 (591ml/473ml),34650
스타벅스 시티 투어 텀블러 355ml 서울 인천 경주 부산 제주,31000
스타벅스 마스카포네 티라미수 케이크,5660
스타벅스 하루 한 컵 레드,2600
[스타벅스]진심을 담은 카스텔라 세트(ICE),17700
[스타벅스]초콜릿 크림 칩 프라푸치노 기프티콘,5700
일본 스타벅스 텀블러 스테인리스 미니 보틀 라이트 237ml,49300
2020 스타벅스 텀블러 화이트 라인 발렌타인데이,47400
스타벅스 DT 스탠리 스트로 보온병 591ml,15000
스타벅스 디카페인 아이스 돌체 라떼 Tall,5660
서머 포레스트 칼리도스코프 스터드 콜드컵 스타벅스 홀로그램 MD,37800
스타벅스 SS 미르 사이렌 민트 텀블러 591ml 벤티,35000
스타벅스 매트 블랙 플랫 콜드컵 473ml,19000
스타벅스 콜드브루 Tall,4100
(미국직배송) 스타벅스 지압 텀블러 콜드컵 블링블링 블루 옴브레 블랙매트,35000
스타벅스 mini 미니 틴케이스, 스탠리 퀀쳐 투고 텀블러 DT 자동차 2021 MD,14500
스타벅스 강아지텀블러 콜드컵 아이스 투명 유리 텀블러 별다방 보틀 병 355ml,20000
스타벅스 For Your Lucky 7 Set,11000
스타벅스 스토조 STOJO 접이식 텀블러,38800
[기프티콘] 스타벅스 더블 에스프레소 칩 프라푸치노 Tall,6100
2020 스타벅스 콜드컵 정품 리유저블 텀블러 워터보틀 710ml 473ml,6900
스타벅스 환구단 트로이 텀블러,31960
스타벅스 스탠리 DT 스트로 아이보리 텀블러 대용량 보온보냉 (591ml),23900
스타벅스 SS 블랙 헤리티지 뉴턴 텀블러 355ml,99000
스타벅스 자바칩 프라푸치노 Tall,5850
스타벅스 쿨 라임 피지오 Tall,5300
[기프팅] 스타벅스 아이스 카페아메리카노 Tall,4100
[스타벅스]화이트초콜릿모카 프라푸치노 기프티콘,5700
[스타벅스]Happy Birthday 기프티콘,15100
2021 스타벅스 스탠리 한정판 텀블러 대형 빨대 스벅 머그컵 보온병 차량용,48700
스타벅스 7 레이어 가나슈 케이크,5640
스타벅스 SS DW 클래식 투고 텀블러 473ml,34000
스타벅스 디카페인 카페아메리카노,4150
스타벅스 스탠리 매트 타임리스 클래식 블랙 시리즈 [홍콩한정판] 홍콩 대만,43500
오슬로 대용량 미니 스텐 텀블러 빨대 손잡이 아이스 콜드컵 스타벅스 투썸 어린이 보온보냉,9900
스타벅스 미니쿠퍼 MINI 퀜처 (라임/블루) 텀블러, DW투고,84900
스타벅스 부드러운 디저트세트 부드러운 생크림 카스텔라+아메리카노 Tall 2잔,11500
스타벅스 SS 엘마 클래식 화이트 텀블러 355ml,53500
스타벅스 2021 SS 마레 스탠리 플라스크 237ml,45000
스타벅스 한정판 SS 실버/블랙 헤리티지 뉴턴 텀블러 355ml,36600
스타벅스 진심을 담은 카스텔라 세트,16000
선물포장선택 스타벅스 피크닉 베어리스타 피규어 콜드컵 2020 가을 MD,20900
스타벅스 미니 클래식 스콘,3840
[스마트상품권] 스타벅스 e-gift 기프트카드 모바일상품권 기프티콘,298900
스타벅스 SS 콩코드 사이렌 화이트 텀블러 591ml,27100
스타벅스 콜드브루 리유저블 쿨링 파우치 텀블러,39500
스타벅스 달달한 내 마음 세트,13340
스타벅스 마블 화이트 아이코닉 텀블러 473ml,17000
스타벅스선물세트 2021 추석 집들이 텀블러 커피세트 디카페인 생일 기념일,36000
[스타벅스]패션탱고티 레모네이드피지오 기프티콘,5400
[스타벅스] 파이크 플레이스 로스트 기프티콘,12800
[스타벅스]카라멜 프라푸치노 Tall 기프티콘,5600
아이스 스타벅스 돌체 라떼 Tall,5370
스타벅스 SS 엘마 블랙 텀블러 473ml,27500
스타벅스 하트파이,3130
스타벅스 2021 md 샤넬 명품 굳즈 텀블러 다이어리 스페셜에디션 선물 여친,13500
스타벅스 벚꽃길 케셀 텀블러 2021 체리블라썸 MD,36860
스타벅스 SS 마블 화이트 오페라 텀블러 473ml,33000
스타벅스 정글 샤인 콜드컵,32900
[기프티쇼] 스타벅스 카페라떼 Tall,4600
스타벅스 리유저블 그린 콜드컵, 민트 핫컵, 사이렌 스토퍼, 케틀, 2021 MD,8500
2021 스타벅스 써머조이 버터 스터드 콜드컵, 스벅 서머 컬러체인징 콜드컵 세트,29990
스타벅스 시원한 카페라떼 커플세트,8300
스타벅스 2020 코리아 트로이 텀블러,29960
스타벅스 유기농 말차로 만든 크림 프라푸치노 Tall,6040
스타벅스 JMZ 그린 사이렌 보온병 350ml 아기 물병,40000
스타벅스 디카페인 아이스 카페 아메리카노,4100
[기프티콘] 스타벅스 유기농 말차로 만든 크림 프라푸치노,6300
스타벅스 처비 핸들 텀블러 473ml (그린, 핑크, 뉴이어 퍼플, 메리 택 일),36000
스타벅스 스탠리 텀블러 2021 대용량 591ml DT 네이비 민트 아이보리,31900
[기프티쇼] 스타벅스 카페모카 Tall,5100
스타벅스 스탠리 텀블러 스테인리스 304 투고 빨대 쿨러 아이스박스 한정판,37400
