제목,링크,내용
이 동네에 살고 싶게 만드는 연남동 카페 맥코이 <b>커피</b>,https://blog.naver.com/sunjuic?Redirect=Log&logNo=222497200111,이 동네에 살고 싶게 만드는 연남동 카페 맥코이 커피 우리 동네가 연남동이라면 얼마나 좋을까 살고 디저트 메뉴도 있었지만 우린 가볍게 커피 한 잔씩만 주문했다 난 맥코이 커피에 왔으니 맥코이 커피를 
[카페뮤제오 티백<b>커피</b>]맛과 간편함 둘다 잡은 티백<b>커피</b>,https://blog.naver.com/caffemuseo?Redirect=Log&logNo=222501505185,바쁜시간 커피 한 잔 하고싶은 분 야외에서 커피 한 잔 하고싶은 분 간편하게 커피 한 잔 하고 싶은 분 이런분들 주목하세요 넣고 붓고 흔들고 기다리면 끝 맛과 간편함 둘다 잡은 카페뮤제오의 
천안 아산 카페 / 분위기 맛집 디저트 맛집 사네 <b>커피</b>,https://blog.naver.com/jhself0224?Redirect=Log&logNo=222479908203, 천안 아산 카페  분위기 맛집 디저트 맛집 사네 커피 안녕하세요 봄이와입니다 오늘은 얼마 전 다녀온 천안 아산 카페 사네 커피를 소개해 드리려고 해요 예전부터 너무 가고 싶었던 카페인데 집에서는 좀 
원두 코리아 라떼아트 챔피언십 공식원두 웨이브온 블랜드 <b>커피</b>,https://blog.naver.com/patience07?Redirect=Log&logNo=222501066355,아침에 눈뜨자마자 커피를 잔 하신다는 어쭈냥 커피한잔 마셔야 정신이 차려지다보니 항상 모닝커피는 빼먹지 않고 마시고 있어요 아침에 마시는 커피는 주로 라떼를 마십니다 거창하게 이름붙이면 
블루투스 <b>커피</b> 추출 온도 측정 장치,https://blog.naver.com/indend007?Redirect=Log&logNo=222493487994,에스프레소는 커피 추출 중에서도 좀 더 수치화 데이터화 하기 쉬운 분야로 다양한 추출 압력과 온도 추출 유량 등이 측정되고 커피에 미치는 영향성이 고려되어 왔습니다 하지만 조금만 더 들여다보면 
아인슈페너 만들기 류수영 달고나 <b>커피</b> 만드는법 (달고나라떼),https://blog.naver.com/kimhy004?Redirect=Log&logNo=222452639444,한때 달고나 커피 만드는법이 핫했었는데 한동안 저도 열심히 만들어 먹다가 그동안 잊고 있었는데 밖에서 사 먹는 것 부럽지 않더란 아인슈페너는 아메리카노에 휘핑크림을 듬뿍 올린 커피를 
선릉카페 브루<b>커피</b> 테헤란점,https://blog.naver.com/minja777711?Redirect=Log&logNo=222493056779,선릉역과 삼성역 중간에 위치한 커피 향기 가득한 이곳 커피 맛집  에 들어갔다 모든 인테리어가 올블랙이고 커피바를 중심으로 코시국에 맞게 자리가 띄엄 띄엄 분위기가 압도적이고 조용하고 
명절선물추천 리틀스<b>커피</b> 프리미엄 선물세트 #영국명품<b>커피</b>,https://blog.naver.com/charla1005?Redirect=Log&logNo=222499080046,영국명품커피 리틀스커피 프리미엄 선물세트 명절선물추천  영한 감각의 센스넘치는 명절선물을 고민하다가 영국명품커피 리틀스커피 의 프리미엄 커피선물세트를 알게되었어요 감각적인 커피 
홈카페 편의점 <b>커피</b>, 맥심 티오피 플라워 피니시,https://blog.naver.com/foresten?Redirect=Log&logNo=222484209898,  홈카페 편의점 커피 추천 맥심 티오피 플라워 피니시  국내 최초 꽃 향이 나는 프리미엄 커피  어딜가든 책상 있는 곳에서 노트북 펼쳐두고 일하는 게 직업인 인인데요 평소에는 콘센트가 잘 되어 
눈에띄는 <b>커피</b>창업 이유가 있다,https://blog.naver.com/white_0200?Redirect=Log&logNo=222483695131,일반인들도 커피창업에 대해 열린 마음으로 도전하고 있는데요 경기 침체의 시대적인 흐름에 따라 감성커피에 주목하고 있습니다 깔끔하면서도 정돈된 분위기는 매장 내에서 메뉴를 주문하는 소비자의 
서촌 디저트 카페 스노브 보헤미안 박이추<b>커피</b>,https://blog.naver.com/mimibus74?Redirect=Log&logNo=222496863880,박이추커피 로 들어갔습니다 대문을 떼버린 입구 이곳 대문엔 초록이나 파랑색 등 철문이 있었을 실내는 주로 디저트와 커피를 주문하는 곳이구요 양옥을 개조한 카페라 실외 마당이 있었는데 
<b>커피</b>원두 <b>커피</b>창고 이든블랜드,https://blog.naver.com/lucy038?Redirect=Log&logNo=222493108886,가성비 폭우 쏟아지는 훌륭한 커피원두라며 추천받은 커피창고의 이든 블랜드 볶자마자 보내주는  커피원두가 단돈 만천원 세일 전 가격인 만원이어도 고마운데 오랜만에 산미 없는 고소한 원두로 
치보카피시보 미니로 한정판 <b>커피</b>캡슐 시나몬롤 라떼 해먹기,https://blog.naver.com/eksqkrdl?Redirect=Log&logNo=222498100585,안에 커피캡슐 다 쓰고 받는 통에는 대략 캡슐이 개정도 최대로 들어가서 버릴 때 좀 귀찮고 지저분하게 관리되는 면이 있지만 그래도 자취하면서 이렇게 작은 커피머신을 사용하는게 좋은 것 같아서 
4조가능)) 코펜 더블레이스 악마 <b>커피</b>잔 #1036,https://blog.naver.com/bonbonliebe?Redirect=Log&logNo=222501136918,코펜 더블레이스 악마 커피잔  잔 지름   높이   소서지름   덴마크산 퍼스트 핸드메이드 년소서나머지는 모두 년에 제조된 미사용 진열만한 깨끗한 컨디션으로 색감 민트급 
세종시빵집 연희동, 빵과 <b>커피</b>가 다 맛있는 베이커리카페,https://blog.naver.com/kjjoa01?Redirect=Log&logNo=222476077550,세종시로 드라이브 갔다가 빵이랑 커피 마시고 싶어서 세종시빵집 찾아 연희동으로 가봤어요 나성동 베이커리카페여서 커피도 맛있겠더라구요 다른 손님 커피내리는 향이 빵 냄새와 더불어커피를 안 
프리미엄 <b>커피</b>머신, 렌탈로 즐기는 방법! 웰스 유라 <b>커피</b>머신,https://blog.naver.com/hli2127?Redirect=Log&logNo=222505123818,맛있는 커피를 만들기 위해 필요한 요소는 무엇일까요 좋은 원두 적절한 장비 숙련된 추출 솜씨 등은 물의 신선도 무기물 함량 산알칼리 농도에 따라서도 커피 맛이 달라질 수 있죠 그래서 수질 관리가 
[제이엠<b>커피</b>로스터스 JM Coffee Roasters] 부산 기장... ,https://blog.naver.com/mardukas?Redirect=Log&logNo=222442185062,커피도 로스팅하고 빵은 굽는지 가져오는지 잘은 모르겠음 아무튼 종류는 다양합니다 층의 모습 층에 좀 더 넉넉한 공간이 있어서 자리를 잡았습니다 앙버터빵하고 퀸 아망 하나씩 솔직히 커피 
추석선물세트 추천/엘카페 <b>커피</b> 원두선물세트,https://blog.naver.com/som-ci?Redirect=Log&logNo=222493802841,지난번 엘카페의 드립백커피를 아주 만족스럽게 먹었는데요 그 제품이 너무 좋아서 추석선물세트를 많잖아요 커피는 워낙 즐기는 분들이 많기도 하고 집에서 직접 만들어 홈카페처럼 마시는 분들도 많기 
류수영 아인슈페너 만들기 편스토랑 믹스<b>커피</b> 달고나아인슈페너,https://blog.naver.com/tkmh1982?Redirect=Log&logNo=222452173582,믹스커피 달고나아인슈페너 오늘도 푹푹 찌는 찜통더위에 힘드시죠 저도 푹푹 찌는 무더운 날씨에 온몸이 땀으로 범벅이 되도록 아침부터 바쁜 하루를 시작했는데요 그나마 잠시 쉴 수 있었던 건 시원한 커피 
#황학동 카페_ 톡톡튀는 원써드 <b>커피</b>,https://blog.naver.com/euirime?Redirect=Log&logNo=222494313355,넓어서 커피 양도 적지는 않은 편 만족 ㅎㅎ 산미있는거 너무 좋다 인더매스에서 마시던 그 맛 커피도 넘 좋고 요 아이 더블 패션에이드 와 층지어진 색깔도 너무 예쁘고 로즈마리도 올라가서 더 예쁘네요 
<b>커피</b>바리스타학과 준비과정 어렵지 않았죠,https://blog.naver.com/ys892015?Redirect=Log&logNo=222473113749,제가 초등학교를 졸업할 무렵 할아버지께서는 은퇴 후 커피로 제의 삶을 준비하셨습니다 그 당시 커피 관련 드라마가 인기를 끌고 있기도 했고 워낙 사람 만나는 걸 좋아하셨던 지라 그간 직접 카페를 차리는 
잠이 오지 않는 날 출근길 <b>커피</b> 빨다☕,https://blog.naver.com/kbk12356?Redirect=Log&logNo=222494157911,마음이 뒤숭숭하고 오만 잡생각을 다하고 겨우 잠들었네요 위 사진은 오늘 출근할때 몽롱해서 편의점에 경유해서 커피 한잔 빨고 갔습니다 이 회사 다니고 출근 하다가 커피 마시고 가는건 처음 
밴쿠버 카페, <b>커피</b> 맛집 Timbertrain Coffee + 쿠키도 진짜... ,https://blog.naver.com/domoto777?Redirect=Log&logNo=222497969484,밴쿠버 커피 카페 맛집   안녕하세요 캐나다 밴쿠버에서 거주 중인 고모늘보라고 해요 저는 커피에 특히 아이스 라떼에 매우 진심이에요 토론토에서는    와  
해리단길카페 트루먼<b>커피</b> 직접 고르는 재미 독특하고 재밌다,https://blog.naver.com/plus_chu?Redirect=Log&logNo=222498275478,해리단길카페 트루먼커피 요즘 해운대 해리단길 카페 도장깨기 중 집 바로 뒤에 있다보니 딱히 오늘 방문한 트루먼커피는 입구에 사진찍는 사람이 여러팀 보이길래 궁금해서 들어간 곳이에요 주소 부산시 
메가<b>커피</b> 창업비용 합리적인 최신 인수정보,https://blog.naver.com/jknew1?Redirect=Log&logNo=222493768772,메가커피 창업비용 합리적인 최신 인수정보 저렴하면서도 맛이 뛰어난 가성비 음료로 고객을 사로잡은 메가커피 이제는 소비자뿐만 아니라 창업자분들께도 커피프랜차이즈 시장에서 최선의 선택지가 
&quot;<b>커피</b> 한 잔이 되기까지 하나 하나 전부&quot; - <b>커피</b>스펠,https://blog.naver.com/coffeefair11?Redirect=Log&logNo=222493753722,커박이에요  대구에는 요즘 비 소식이 잦은데요 오늘 아침엔 비가 아주 그냥 낭만적으로 내리더라고요 커피생각이 어찌나 나던지 커피생각이 간절한 오늘 소개해 드릴 여섯 번째 참가사는 한 잔의 
[둔산동 카페] 전문가의 손길로 탄생되는 맛있는 <b>커피</b>, '벨라... ,https://blog.naver.com/first_seogu?Redirect=Log&logNo=222500924671,불어오는 시원한 바람 속에서 가을 향을 맡으며 커피를 찾게 되는데요 직접 엄선한 원두를 이용하여 맛 좋은 커피를 내기 위해 노력하고 있는 둔산동카페 벨라떼아뜨로 를 찾았습니다 둔산동의 대전시청 
해운대 장산 카페 고물상 향긋한 <b>커피</b>가 좋아,https://blog.naver.com/eunji3231?Redirect=Log&logNo=222492884281,커피가 맛있어서 테이크아웃을 하고 싶었는데 일회용 사용을 줄이기 위함인 것 같다 한 분 정도의 그래서 엄마랑 마음놓고 커피 타임 푸릇한 식물들도 있고요 벽을 보고 나란히 앉을 수 있는 테이블도 
망리단길 카페 빵과 <b>커피</b>, 공간까지 완벽해,https://blog.naver.com/dusl1984?Redirect=Log&logNo=222501257085,낮에는 커피를 팔고 저녁에는 병맥주가 어우러질 수 있는 매력적인 공간이랍니다 카페 내부는 음료는 커피류로 주문했어요 아이스 돌체와 카페라떼에요 날은 비교적 선선해졌지만 아직 낮으로는 더워 
부산대 샐러드카페 나우잇 (feat. <b>커피</b>없음주의),https://blog.naver.com/rever_moi?Redirect=Log&logNo=222498056084,아 아쉬운건 커피가 없음 오렌지 쥬스도 없음 건강한 주스가 종류별로 있는 것 같았는데 개인적으로 카페라고 부르기에는 커피가 없어서 감점  그래서 우리는 결국 스벅가서 아메 한잔하고 
[약수역 카페 오버트서울]-통창이 인상적이였던 <b>커피</b>맛... ,https://blog.naver.com/brandy923?Redirect=Log&logNo=222506241174,편하게 커피마시고 왔습니다 해가 엄청났던 날이였는데 오버트서울의 특징이 통창유리였어요 담아나온 커피 플레인크림라떼이구요 생크림이 듬뿍뜨거운커피와 같이 먹으면 비엔나커피맛이예요 맛있게 
동대입구 카페, 동대입구 맛집 @ <b>커피</b>파운드 장충,https://blog.naver.com/surin0920?Redirect=Log&logNo=222491237167,커피파운드 장충 주소 서울 중구 장충단로  전화  영업 평일    토요일    일요일 휴무 주차 매장 앞 주차 가능 관련 해시태그 커피파운드 커피파운드장충 약수카페 
재미삼아 보는 한국 <b>커피</b> 전문점 실적,https://blog.naver.com/tosoha1?Redirect=Log&logNo=222448196834, 위의 동영상은 년까지 국내 커피전문점 매장수 메가커피 제일 위의 표의 점포수 표에서 보면 작년에도 가장 출점이 많았던 메가커피 요즘 가장 핫하게 
믹스<b>커피</b> 아인슈페너 달고나<b>커피</b> 진하게 즐겨요,https://blog.naver.com/hitomi1228?Redirect=Log&logNo=222463252973,편스토랑에서 본 믹스커피 아인슈페너 이 여름에 달달함을 보충해줄 수 있을 것 같아서 저도 만들어 먹어보았어요  잔 분량  믹스커피 개 따듯한물  우유  얼음 시나몬가루 약간 하하 믹스커피가 
전북대 <b>커피</b> 맛집은 길커; 길 위의 <b>커피</b>,https://blog.naver.com/hiroaya?Redirect=Log&logNo=222493587474,전북대에서 제가 애정하는 카페 중 한 곳 길 위의 커피 줄여서 길커라고 부르곤 해요 긴 휴가를 커피 홍차 허브티 녹차라떼 그리고 더 간단하게는 메뉴판 볼 필요 없이 취향에 따라 추천받기 원두가 
[<b>커피</b>] 분당 오리역 근처, 메가<b>커피</b>보다 저렴한 테이크아웃... ,https://blog.naver.com/cpath?Redirect=Log&logNo=222502820402,  원 할인 아메리카노 원 아이스라떼 원 메가커피를 개인적으로 애정해요 짙은 샷 많은 양 가성비 커피를 사랑할 수 밖에 없는 것이 브랜드 커피 가격의  가격 밖에 되지 않으니까요 
[부여 카페] 구옥에서 즐기는 <b>커피</b> 맛집, 수월옥,https://blog.naver.com/skgus1231?Redirect=Log&logNo=222492918685,부여 카페 구옥에서 즐기는 커피 맛집 수월옥 부여카페 검색하면 많이 보였던 부여카페 수월옥 이런곳에 카페가 싶은 곳에 위치했다 ㅋㅋ 왼쪽 집에서 주문하고 오른쪽 집에서 커피를 마시는 특이한 구조 
성수카페 포배럴<b>커피</b> 샌프란시스코 3대<b>커피</b>,https://blog.naver.com/bona98?Redirect=Log&logNo=222486787775,성수카페 성수핫플이 워낙 많기는 하지만 이날은 인친님을 만나서 포배럴커피에 다녀왔어요 포배럴커피는요 샌프란시스코 대 커피 중의 하나래요 이미 우리나라에 들어와 있는 블루보틀 리추얼커피 그리고 
온 세상 <b>커피</b> 맛집을 돌아다니는 작가가 있다!? 김예슬작가 인터뷰,https://blog.naver.com/caffemuseo?Redirect=Log&logNo=222485806101,커피 박물관인 카페뮤제오에서커피를 사랑하는 예술가들의 이야기를 모아보기로 했어요 그렇게 진행하게 된 카페뮤제오  아티스트 프로젝트 카뮤 한잔할래요 카페뮤제오의 커피를 한 잔 마시면서 
컴포즈<b>커피</b> 메뉴 헤이즐넛라떼 추천합니다!,https://blog.naver.com/maize210?Redirect=Log&logNo=222494392691,컴포즈커피 메뉴 헤이즐넛라떼 추천합니다 제가 요즘 헤이즐넛라떼에 빠져서 이곳저곳에서 마셔보고 있는데요 역시나 컴포즈커피도 헤이즐넛라떼가 꽤 마실만하더라구요ㅋㅋㅋㅋㅋ 컴포즈커피 메뉴가 
말렌카 케이크 체코 디저트 &amp; 감성<b>커피</b> 믹스의 만남,https://blog.naver.com/kskr3105?Redirect=Log&logNo=222500538229,옆 동네에 있는 대학교 앞에 갔다가 감성커피에서 구입한 밀크 믹스 커피와 함께 먹었는데 꽤 괜찮은 조합이었어요 단거  단 거 ㅋㅋ 당충전이 제대로 된다고 할까요 ㅋ 카페에서 먹을 땐 접시에 받쳐서 
고운동 카페 호라이즌에서 <b>커피</b>~,https://blog.naver.com/nsgogo3?Redirect=Log&logNo=222490386757,고운동에 점심 먹으러 갔다가 커피 한잔이 생각나서 카페호라이즌으로 가보았어요 주변에 다른 커피숍이 없어서 찾아보니까 발견을 하게 되었는데요 지하에 있다는 점이 놀랍긴 했는데 블로그보니 인테리어 
Waveon Blending 가성비 좋은 카페 라떼 블렌딩 원두 <b>커피</b> 추천,https://blog.naver.com/dolmory9?Redirect=Log&logNo=222503047435,에스프레소 베이에이션용 가성비 좋은 카페 라떼 원두 커피 추천  가격  원 원 웨이브온 커피     구입처의 커핑 노트  견과류의 단맛 다크 초콜릿의 
[용산구/ 이태원] <b>커피</b> &amp; 베이커리 '훔볼트',https://blog.naver.com/wishadream?Redirect=Log&logNo=222495174459,대 때는 커피 하루 세 잔도 가능했었는데 늙었는지 요샌 반 잔만 마셔도 가슴이 떨린다 음료랑 샌드위치도 있고  드립 커피도 판매 중 원두도 판매 중  수박주스  원 시원한 수박주스 
《강동구 카페》 편안하고 맛있는 숨은 카페, 파이오니어 <b>커피</b>,https://blog.naver.com/sharkskins?Redirect=Log&logNo=222465988637,커피나무 유전학과 생리학을 바탕으로 커피를 큐레이션 하는 파이오니어 커피 강동구청 근처에 위치해있다 매번 강동구청 카페로는 몽타주만 가서 언젠가 한번은 꼭 가보고 싶었는데 드디어 가보게 
초가을날 오후의 <b>커피</b>타임과 로렌조올리브오일,https://blog.naver.com/ppsus?Redirect=Log&logNo=222493922936,엘리게이터파이에 커피 한 잔 부산 간 건 아니구요 오후 티타임에 디저트로 맛보라며 손님께서 가져 오셨네요 덕분에 이렇게 부산 빵맛을 보게 됩니다 핸드드립으로 커피와 부드럽고 달달한 무화과 
베트남 <b>커피</b> 한 잔 마시고...다시 마라톤,https://blog.naver.com/roadjisang?Redirect=Log&logNo=222501192445,날씨가 더울 때는 달그락 커피 아이스 아메리카노가 당기고 날씨가 서늘해지면 이런 달콤한 믹스 커피가 당긴다 내가 베트남 여행 시 종종 즐겼던 쭝위엔 커피 쓰고 달고 진하다 커피 한 잔 마시고 속 
(sold)-로스트란드 썬본 <b>커피</b>컵,https://blog.naver.com/jybbd85?Redirect=Log&logNo=222502450015,  로스트란드 썬본 커피컵 보여드려요 심플 하면서도 컬러풀한 썬본이에요 조모두 큰사용감 보이지 않고 깨끗하고 참 예쁜 컨디션 유지하고 있어요 스톤웨어보다는 가볍고 
한국<b>커피</b>머신산업연구원 진주교육장,https://blog.naver.com/sfantera?Redirect=Log&logNo=222491333170,안녕하세요 한국커피머신산업연구원 차기동 입니다 저와의 인연은 국가대표 컵테이스팅 선수에 나갔을때 부터 시작되었습니다 커피머신엔지니어에 관심이 있고 배우고자 저를 찾아와 주셨습니다 그후로 
분리배출 OX 퀴즈 풀고 시원한 <b>커피</b> 마시자,https://blog.naver.com/prmapo77?Redirect=Log&logNo=222386285086,이벤트 기간 월 일토  월 일토 경품 이상 정답자 명 커피 잔 그 외 모든 참여자 명 커피잔 당첨자 발표 월 일금 개별통보 이벤트 참여하러가기  퀴즈에 
웨이브온 블랜딩 <b>커피</b>원두  고소한 라떼맛에  빠지다,https://blog.naver.com/100vs100328?Redirect=Log&logNo=222497327215,웨이브온 블랜딩 커피원두 라떼맛 드디어 음청 기대했는데 역시  라떼맛이 아주 웨이브온 블랜딩 커피원두는 중배전 풀시티 로스팅에 브라질  에티오피아  과테말라  참 괸찮은 
나의 <b>커피</b>생활 : 바리스타2급 자격증을 위한 시작,https://blog.naver.com/dldlsdozz?Redirect=Log&logNo=222498221479,가서 커피 한잔 하는게 즐겁다고 공부를 할 필요가 있나 싶기도 하고 비용부담도 만만치 않아서 그저 있대요 커피를 좋아하는 편이고 매일 마시고  카페를 가는것도 좋아하지만 이렇게 설명을 듣고 보니 
휴대용 전동<b>커피</b>그라인더, 모닝<b>커피</b> 한잔으로 감성캠핑 완성~!,https://blog.naver.com/bonniegets?Redirect=Log&logNo=222497767995,휴대용  무선 커피 전동 그라인더 캠핑을 시작하게 되면서 떠올린 그림 중 하나가 바로 아침에 마시는 모닝커피였다 원래도 주말마다 집에서 커피를 내려서 마시는데 캠핑가서 자연속에서 마시는 
신세계로 뉴페이스, 유라 전자동<b>커피</b>머신(jura x6) 도착,https://blog.naver.com/mnjhappylife?Redirect=Log&logNo=222491573989,갑작스런 날씨 변호로 기분도 가라 앉을 때 커피나 차 한잔 마시며 여유를 가지면 도움이 되는데요 과자에 꼭 필요한 커피 직원들의 에너지를 채워줄 커피를 위해 뉴페이스가 나타났습니다 이름하여 유라 
신상 편의점<b>커피</b> 티오피 플라워 피니시로 홈카페,https://blog.naver.com/lovemw3?Redirect=Log&logNo=222494024582,신상 편의점커피 티오피 플라워 피니시로 홈카페 우리가 매일 아침 잠을 깨려고 혹은 식사 후에 꼭 찾는 음료가 있죠 바로 커피입니다 아마 지구상에서 가장 사랑받는 음료가 아닐까 싶어요 저 역시 하루에 
꿀찰빵(쑥, 계피<b>커피</b>),https://blog.naver.com/wiznike?Redirect=Log&logNo=222493312690,  인스턴트커피가루  토핑용 건과일 견과류 적당량 도 분 굽기 강력쌀가루가 없어서 강력분 쑥가루 넣은 반죽 계피가루  인스턴트커피가루 반죽은 좀 적게 담아야 넘치지 않고 이쁘게 
(연신내)컴포즈 <b>커피</b> - 아이스<b>커피</b>와 와플, 다 먹어도 4,000원.,https://blog.naver.com/suziesuzie?Redirect=Log&logNo=222503038720,연신내 컴포즈 커피 엄청 저렴합니다 생긴지 오래되지는 않았지만 가성비 덕분에 많은 사람들이 이용하지요 요즘 여기 와플 먹으러가요 이렇게 다해도 원 아이스아메리카노 원 특별한 맛은 
들안길곤충농장 사슴벌레, 프로나운 <b>커피</b>랩 카페, 랑잠,https://blog.naver.com/kitten825?Redirect=Log&logNo=222498286876,지금은 무조건 포장만 됨 치아바타로 빵 선택해서 두개 사서 바로 근처 프로나운 커피랩에서 커피한잔   또또가 마실게 없던 ㅋㅋ   커피는 디카페인으로 주문했는데 첫맛은 좋았다  분위기도 괜찮고 
디카페인 콜드브루, 제이클레프 <b>커피</b>로 콜드브루라떼 만들기,https://blog.naver.com/leesaelom?Redirect=Log&logNo=222498268043,디카페인 콜드브루 제이클레프 커피  디카페인 콜드브루 임산부커피 안녕하세요 로미예요 다들 커피 좋아하시나요 저는 일 잔까지 가능한 커피러버인데요 카페투어를 하는 것도 너무 좋아하고 집에는 
쿠키 맛집 아차산 푸쉬<b>커피</b> X 디그디그 액티비티 팝업하우스... ,https://blog.naver.com/dlwnsrms89?Redirect=Log&logNo=222499392323,푸쉬커피에서 내일부터 일간 팝업스토어를 운영하게되었다 쏴리질러 한정판 쿠키도 직접 팔고 커피도 팔고 디그디그 굿즈티셔츠 모자 손수건 양말 바지 등 도 같이 팔기로 함잘 팔리겠쥬 
우도주막 웰컴티 <b>커피</b>대신 마시기 좋은 티퍼런스 퍼플티,https://blog.naver.com/minhae9191?Redirect=Log&logNo=222502658391,우도주막 웰컴티 커피대신 마시기 좋은 티퍼런스 퍼플티 글사진 미네쿠 우도주막 티퍼런스 퍼플티 우도주막웰컴티 커피대신 안녕하세요  오늘은 커피대신 마시기 좋은 차 티퍼런스 퍼플티 리뷰를 
공간갑(힙지로 핫플 카페! <b>커피</b>&amp;빙수&amp;민트케이크 다 만족 추천!)*,https://blog.naver.com/graceofs?Redirect=Log&logNo=222505956485,커피대표 플랫고소티 크렘브륄레라떼 플랫고소티   크렘브륄레라떼   아아  민초바스크  백설기빙수  주문완료 드릉드릉 나왔다 이뻥 커피 
가정용 <b>커피</b>머신 만족한 사용 후기,https://blog.naver.com/esswan103?Redirect=Log&logNo=222463097171,한 달에 커피값만 거의 만원 정도 큰 지출항목이다 어쩔 수 없이 나가야 하는 것 제외하고 집에서 먹을 수 있는건 가급적 집에서 해결해보자는 마음으로 가정용 커피머신을 집으로 들였다 카페 출근 
1950s poole 빈티지 <b>커피</b>컵세트,https://blog.naver.com/youwednesday?Redirect=Log&logNo=222490211901, 년대에 만들어진 풀의 커피컵세트입니다 풀은 년 건축용 도자기장식이나 포근하고 맑은 기분을 전해주는 제품으로 향긋한 코코아 한잔 또는 뜨거운 커피를 위한잔으로 
김천 오봉저수지 카페 오봉리 OBR. <b>커피</b> 맛있음♥,https://blog.naver.com/boru130?Redirect=Log&logNo=222494594226,저희는 아무생각 없이 매장 뒤에 주차하고 커피 테익아웃해서 나오다가 봤는데 가게 뒷편은 커피만 잔 주문하고 기다렸어요ㅋㅋ 커피 기다리는 동안 카페 내부 구경하기 이렇게 큰창이 나있어서 건너편 
