제목,링크,내용
정동길카페 / 라운드앤드, <b>커피</b> 디저트 맛집,https://blog.naver.com/miyaism?Redirect=Log&logNo=222504299861,정동길카페  라운드앤드 커피 디저트 맛집 파란 하늘과 녹색 나무들 너무나 예쁜 정동길  걷기만 왜냐면 빵이랑 커피가 진짜 너무 맛있었기 때문이닷  맛있는데 건강하기까지한 빵이었어   
강릉 중앙시장 선물 <b>커피</b>빵 엄지척!,https://blog.naver.com/woaiheejun?Redirect=Log&logNo=222469523700,강릉 중앙시장 선물 커피빵 엄지척 며칠 전 친구가 아이들을 데리고 강릉에 간다길래 오랜만에 옆쪽에는 커피빵을 파는 강릉당이 있었답니다 민트색의 간판에 카페에서 봤음직한 조명이 장착되어있어 
부산 기장 카페 가볼만한곳 공극샌드<b>커피</b>,https://blog.naver.com/80sunjin?Redirect=Log&logNo=222505758052,공극샌드커피 지난번까지 다른 카페에 주로 갔었는데 이번엔 새로운 곳에 한번 가보자며 ㅎㅎ 노란 파라솔이 인상깊었던 분위기 좋은 카페  부산 기장 카페 가볼만한곳 공극샌드커피 글사진 이름부터 
가정용<b>커피</b>머신기, 드립&amp;캡슐 2 IN 1 라이녹스,https://blog.naver.com/lubkhaki?Redirect=Log&logNo=222501712503,가정용커피머신기 라이녹스 현대인답게 하루에 보통 잔의 커피를 마시고 있다 그렇다 보니 당연히 몇 번이나 가정용커피머신기 구입을 고려했더랬다 하지만 예전엔 일주일에 보통 번 외출을 했기 
풍미깊었던 제주도 <b>커피</b> 맛집,https://blog.naver.com/hloveh01?Redirect=Log&logNo=222485445083,얼마 전 친구와 제주도로 놀러 갔다가 에서 유명세를 탄 제주도 커피 맛집을 찾았다 신선한 식재료로 곧장 제주도 커피 맛집의 메뉴판을 살펴보기 시작했다 각종 디저트는 몰론이고 음료도 다양했다 
부산 달맞이고개 카페 : 복합문화공간 라이프<b>커피</b>앤티,https://blog.naver.com/teddysuyeon?Redirect=Log&logNo=222504414183,부산 달맞이고개 카페 라이프커피앤티  글사진  션니블로그 안녕하세요 션니에오 오랜만에 라이프커피앤티 비아인키노란 가구를 중심으로 책과 커피 여백과 컬러 등 삶을 구성하는 요소들을 
케냐AA 드립백 <b>커피</b> 향도 맛도 얼죽아에게 굿!,https://blog.naver.com/sticky4?Redirect=Log&logNo=222505915822,섬유유연제 구매하면서 제가 평소 좋아하던 케냐 원두가 담긴 드립백 커피도 판매하길래 사봤는데요 저렴한 가격에 비해 맛과 향이 특히 좋은 것 같아 추천해볼까 해여 바로 여기커피 드립백인데요 상자에 
<b>커피</b>바리스타학과 입학을 위한 과정,https://blog.naver.com/japancorp?Redirect=Log&logNo=222505106359,이처럼 커피에 대해 재미난 말들이 참 많은데요 아무래도 요즘은 주변에 카페도 많고 다양한 커피음료가 많은 만큼 커피를 좋아하는 인구가 더더욱 늘어나고 있기 때문이 아닐까해요 저 또한 커피를 워낙 
일산 가성비 좋은 포트캔<b>커피</b> (Ft. 폭탄카스테라),https://blog.naver.com/kh750?Redirect=Log&logNo=222490783098,일산 가성비 좋은 포트캔커피  폭탄카스테라 일산 라페스타 쪽에 갔다가 오픈 이벤트를ㅇ하고 있어서 무조건 들어가게 되었던 포트캔커피 라페스타점 인데요 이날하고 다음날까지 스페셜티커피 를 
호환 캡슐 추천! 친환경 다회용 <b>커피</b>캡슐 사용기,https://blog.naver.com/kecoprumy?Redirect=Log&logNo=222490219157,홈카페에 빠질 수 없는 커피 저는 커피 캡슐을 통해 에스프레소를 추출하는 커피 머신을 사용하고 있는데요 제조사에 따라 다르지만 대부분의 커피 캡슐은 비닐 커피 플라스틱 등의 여러 소재로 
전기 <b>커피</b>포트 온도조절까지 혁명템,https://blog.naver.com/juyoung4025?Redirect=Log&logNo=222498278557,제가 첫째때는 딱히 아는게 없어서 분유도 전기 커피포트를 이용해서 타서 먹이고는 했었거든요 사실 첫째때는 전기 커피포트 이용해서 물을 끓인 후에 식혀서 분유를 타다 보니까 생각보다 손이 많이 가고 
<b>커피</b> 바리스타 2급 자격증 2회차 수업날,https://blog.naver.com/dldlsdozz?Redirect=Log&logNo=222502488293,향긋한 커피향이 가득가득 레벨링이 잘된 원두는 맞춰진 시간안에 정량이 정확하게 추출이 된다고 선생님은 커피일을 오래 하셔서 이미 손목이 많이 좋지 않다고 하신다 카페에 가서 커피 빨리 주세요 왜 제 
을지로 힙한 카페 호랑이<b>커피</b>,https://blog.naver.com/ddubabi?Redirect=Log&logNo=222504919107,을지로를 돌아다니다 보면 호랑이 그림이 그려진 커피를 들고 다니는 분들을 심심치 않게 발견할 수 있어요 바로 대림상가에서 제일 핫한 카페라고 해도 과언이 아닌 호랑이커피인데요 오랜만에 나들이를 
바리스타 자격증 가지고 <b>커피</b> 마시기,https://blog.naver.com/gbsp0305?Redirect=Log&logNo=222489336445,평소에도 커피에 굉장히 관심이 많고 즐겨 마시던 저는 다양한 카페를 돌아다니는 취미도 있었어요 각 매장마다 취급하는 원두가 다르고 추출방식이 다르기 때문에 당연히 커피 한 잔을 먹더라도 다른 느낌이 
연남동 펠른, <b>커피</b> 페어링 코스로 특별한 하루 선물 받기 :D,https://blog.naver.com/snflgg?Redirect=Log&logNo=222504806385,안녕하세요 동그리 입니다  이번 포스팅은 연남동에 자리한 커피 페어링 코스를 맛볼 수 있는 곳 코스로 커피 오마카세 커피 페어링 코스로 알려진 곳이더라구요 예약시간보다 분 정도 일찍 
테라로사 세종점 : <b>커피</b>향이 좋은 어진동 카페,https://blog.naver.com/heo1028?Redirect=Log&logNo=222503946909,어진동 카페  테라로사 세종점 오늘도 어김없이 하루를 커피로 시작 어진동 카페 테라로사 세종점은 곳과 커피를 마시는 곳이 있당 굿즈를 보면 매번 비슷해도 구경해야행ㅋㅋㅋㅋㅋ 굿즈 진열 공간에는 
홈카페 원두<b>커피</b> 산미좋은 레이크<b>커피</b> 핑크!!,https://blog.naver.com/patience07?Redirect=Log&logNo=222498764034,이런 날씨에는 커피가 훅 땡기게 마련이잖아요 여름에는 얼음 동동 띄워서 물처럼 호로록 마셔댔다면 가을에는 말입니다 뜨끈한 커피를 홀짝거리믄서 창밖도 함 보고 하믄서 분위기를 잡게 되는 그런 
선정릉 스위스워터<b>커피</b> 아메리카노,라떼,https://blog.naver.com/yunji0203?Redirect=Log&logNo=222500078421,전부터 오며가며 많이 봐서 꼭 가봐야지 했는데 드디어 ㅋㅋ 방문해본 곳 스위스 워터 커피 삼성동 많더라 커피콩들 꽤나 넓고 유니트한 가구들 유럽감성같은 느낌 원두에 따라 글라인더도 다르게 
업소용 <b>커피</b>머신 추천 필터까지 완벽하게 장착,https://blog.naver.com/white_0200?Redirect=Log&logNo=222490414837,커피줄루와 함께 한다면 더 뜻깊은 날들을 만들 수 있을 거라고 생각하는데요 이번에는 경남지식인재개발원에서 반자동 커피 머신인 시모넬리를 대 설치하고 왔답니다 지금부터 그 현장으로 함께 가볼까요 
대구 갤러리 미술품과 함께하는 <b>커피</b>,https://blog.naver.com/wingzero5?Redirect=Log&logNo=222498963940,예쁜 전시품도 보고 맛있는 커피도 마실 수 있어서 정말 좋았던 시간이었어요 이번에 다녀온 대구 넓고 큰 통유리창 너머로 예쁜 풍경이 펼쳐져 있어서 커피를 마시며 여유로운 시간을 보내기에 딱 적합한 
전참시 세븐 아보카도<b>커피</b> 만들기 아보카도 요리 먹는법,https://blog.naver.com/mijinkim80?Redirect=Log&logNo=222488948340,색다르고 맛있는 궁합 전참시 아보카도커피 저도 먹어봤습니다 먹어보니 세상 잘 어울리는 최강 궁합이네요 하루종일 든든하기까지 제 스타일이었어요 전참시 세븐 아보카도커피가 핫하군요 궁금해서 저도 
강릉 테라로사 본점, 유명한 <b>커피</b>가 나도 궁금해,https://blog.naver.com/ali7548?Redirect=Log&logNo=222503038137,바다 산 장치 그리고 커피 등등 그 중에서도 강릉 커피문화를 시작했다는 강릉 테라로사 본점을 다녀와봤어요 입구부터 뭔가 웅장한 느낌 커피 공장이자 커피 박물관이란 느낌이 확 왔어요 테라로사 
각 나라별 <b>커피</b> 원두의 종류와 특징에 대해 알아보세요!,https://blog.naver.com/nhicblog?Redirect=Log&logNo=222491621518,요즘 집에서 보내는 시간이 늘면서 핸드드립이나 커피 머신을 이용해 직접 커피 원두를 내려 먹는 사람들이 늘고 있다 커피 원두에는 항산화 성분인 클로로젠산 성분이 들어 있어 체지방 분해를 돕고 지방 
청도 로카<b>커피</b> : 백일홍, 해바라기 &amp; 폭포,https://blog.naver.com/blueblublue?Redirect=Log&logNo=222468977576,청도 로카커피 카페 폭포와 백일홍 그리고 해바라기 게다가 산속에 둘러싸여서 숲속 카페 컨셉에 아주 충실하더라 로카커피  경상북도 청도에 위치한 카페  영업시간  월금 시시  토 시시  일 
<b>커피</b>선물세트 도로시<b>커피</b>팩토리 블랜딩<b>커피</b> 딱이야,https://blog.naver.com/ariel_0402?Redirect=Log&logNo=222498224302,커피선물세트 도로시커피팩토리 블랜딩커피 결혼하고나서 거실에 메인으로 홈카페 차리고 최소 하루에 한 잔은 커피 마시며 지내는 인 캡슐커피머신부터 모카포트 드립장비 등등 하나씩 모으다보니 이제는 
필립스 라떼고, 전자동<b>커피</b>머신 고민중이라면 클릭하세요 :),https://blog.naver.com/deathdeal23?Redirect=Log&logNo=222504400629,집에 있는 시간이 늘어나고 카페에서 커피를 즐기지 못하는 시간이 길어지다보니ㅎ 가정용 커피머신을 하나 장만하고 싶어졌어요 저희집은 식구가 많아서 버튼만 누르면 커피가 나오는 편리하고 사용이 
용인 흥덕 카페 추천 디어<b>커피</b> DEER COFFEE,https://blog.naver.com/love11048?Redirect=Log&logNo=222505332762,디어커피    용인 기흥 흥덕로 카페 광교 근처 카페추천 안녕하세요 토리예요 주말에 아이들과 광교 아쿠아플라넷 갔다가 차로분정도 이동하여 용인 기흥구 흥덕 디어커피 카페에 다녀왔어요 
방탄<b>커피</b> mct오일 챙겨먹는 이유!,https://blog.naver.com/rim85?Redirect=Log&logNo=222488899841,여러분 혹시 방탄커피라고 들어보셨나요 얼마 전 프로그램에서 개그맨 부부가 식사 후 칼로리 소비를 위해 방탄커피를 만들어 먹는 것이 화제가 됐죠 다이어트에 민감한 연예인들 사이에서도 핫할 만큼 
<b>커피</b>숟가락 감성 가득 분위기에 취해요!,https://blog.naver.com/anny68?Redirect=Log&logNo=222474957690,안녕하세요 민스맘이에요 집에서 과일을 먹거나 간단한 디저트 혹은 카페 음료를 만들 때 가장 유용하게 쓰는 건 바로 커피숟가락  티스푼이라 생각해요 가만히 놔두면 가라앉는 과일주스나 커피 차를 
<b>커피</b>전동그라인더 무선이라 편한 마리슈타이거,https://blog.naver.com/peony_blossom?Redirect=Log&logNo=222505470243,커피전동그라인더 무선 그라인더라서 휴대성 좋은 마리슈타이거 루미 살랑살랑 시원한 바람이 불어오는 요즘 피크닉이든 캠핑이든 떠나고 싶어지는 마음이 한가득인 요즘 카페인은 끊을 수 없지  커피는 
호두강정 레시피 기태영 믹스<b>커피</b> 호두강정 초간단 디저트,https://blog.naver.com/tkmh1982?Redirect=Log&logNo=222497477569,호두강정 레시피 기태영 믹스커피 호두강정 초간단 디저트 남편이 일찍 퇴근하는 편이라 저녁을 일찍 씨가 커피믹스로 호두강정을 만드는 걸 보고는 커피믹스를 넣어 커피 맛이 나는 호두 강정의 맛도 
챠스빈<b>커피</b>로 아메리카노&amp;카페라떼 만들기 콜드브루 <b>커피</b> 추천,https://blog.naver.com/impok1004?Redirect=Log&logNo=222501211124,커피 다들 좋아하시죠 주는사랑이 오늘은 콜드브루 커피 추천도 할겸 챠스빈커피로 손쉽게 아이스아메리카노 아이스 카페라떼 만들기 올려봅니다 제가 엄청 애정하는 아이스라떼와 울 옆지기가 좋아하는 
세븐 아보카도<b>커피</b> 최애하는 아보카도 먹는법 원픽될 듯~,https://blog.naver.com/psy9133?Redirect=Log&logNo=222500304903,세븐 아보카도커피 최애하는 아보카도 먹는법 원픽될 듯 개인적으로 몇해전부터 이 맛을 차츰차츰 하고 말았던 아보카도커피를 오늘 맛봤답니다 세상에나 아보카도 좋아한다면 이 맛은 꼭 
교동카페, '헤이트<b>커피</b>(HAYT)'  라떼맛집/대구감성카페네~,https://blog.naver.com/yule2908298?Redirect=Log&logNo=222503521618,교동카페 헤이트커피 라떼맛집대구감성카페네 안녕하세요 딩입니다 아시져 주말마다 커피나들이 가는거 ㅋㅋㅋㅋㅋㅋㅋㅋ 오늘도 어김없이 커피 찾아 삼만리 하고 왔는데 가는 곳 마다 사람이 
[ REVIEW ] 캠핑 핸드 드립 <b>커피</b> 세트 ( feat. Tory store ),https://blog.naver.com/yanghy11_?Redirect=Log&logNo=222504017540,아침에 상쾌한 공기를 마시며 커피를 들고 싶었다 그렇게 마주하게 된 나의 첫 커피 장비 국내 제작 핸드 드립 커피 세트 나와 커피는 뗄 수 없는 연분의 관계 해서 이번에 고상하게 커피도 내려 먹자고 
과천 카페 : 비필리아 <b>커피</b> (B philia coffee),https://blog.naver.com/squidance?Redirect=Log&logNo=222500868267,비가 추적추적 내렸던 주말 여유롭게 커피마시는 시간을 보내고 싶어 찾아갔던 과천의 카페 비필리아 커피  건물 층에 주차가 가능하고 카페 방문 고객이 이용 가능한 자리가 따로 지정되어 
집에서 더치<b>커피</b> 내리기~~,https://blog.naver.com/andongdek927?Redirect=Log&logNo=222505416409,요즘은 더치커피만 마시고 있다 냉장고에서 꺼내서 물만 타면 되니 넘 간편 그래서 질렀다 ㅎㅎ 더치커피메이커 더치커피기구 먼지가 들어갈 수 없는 일체 밀폐형 구조로 각종 외부 오염으로부터 안전 
용산 카페, 용산역 <b>커피</b> 폰트<b>커피</b> PONT + 현선이네,https://blog.naver.com/mitsru79?Redirect=Log&logNo=222502843181,용산 카페 폰트커피 걷다가 갑자기 예쁜 곳이 나와서 어머 여기는 뭐야이쁘다 했더니 언니가 여기를 화사하고 싱그런 생화가 반겨주는 폰트커피 근처에 카페가 드문 드문 있긴 했는데 여기가 단연 
[광주] 동명동카페, <b>커피</b>가 맛있는 곳 TDA.G,https://blog.naver.com/howlheeeun?Redirect=Log&logNo=222503930667,커피는 저렇게 있는 것중에 고르면 됩니다 커피 종류가 이렇게 됩니다  일반 블랙 커피 주문하면 원두 종류를 고를 수가 있어요  제가 방문한 날에는 가지 원두 중 하나를 고를 수가 있었어요 오른쪽 에 있는 
세븐 아보카도<b>커피</b> 만들기 이렇게 만들면 되죠,https://blog.naver.com/naettee?Redirect=Log&logNo=222492827413,아보카도커피를 만들어보았어요 방송에서도 얘기가 나왔지만 원래는 제주도에 이걸로 유명한 카페가 있어요 그걸 먹어보고 세븐의 여자친구 이다해가 만들어줬다고 하더라고요 커피 덕후인 제가 
일산 밤리단길 카페 조바티<b>커피</b> 가죽공방(Ft. 브라운치즈크로플),https://blog.naver.com/kh750?Redirect=Log&logNo=222498692036,일산 밤리단길 카페 조바티커피 가죽공방 브라운치즈크로플 주말에 고양 스타필드 근처에서 점심 먹고 귀가하다가 커피 마시려고 들렀던 일산밤리단길카페 조바티커피 요즘 밤리단길이 핫해서 새로운 
제주 카페 <b>커피</b>가 맛있는 유동 <b>커피</b>,https://blog.naver.com/armanino2?Redirect=Log&logNo=222500967221, 서귀포 이중섭 거리 근처에 있는 카페 유동커피 외관은 어느 동네나 있을 법한 흔한 분위기지만 커피가 유명한 곳이라 도민들도 자주 찾는 커피 맛집이에요 저도 이 근처 올 일 있으면 꼭 들리게 
이제는 마음편하게, 오픈 축하드립니다. - 전포동 맨프롬<b>커피</b>.,https://blog.naver.com/c4548?Redirect=Log&logNo=222504287592,해운대에 있던 맨프롬커피가 전포동으로 옮겨왔다 서면에서 시작으로 한양 진출했다가 해운대로 다시 왔던 맨프롬커피 다시 지금 전포동에 단독 건물을 올려 제대로 둥지를 틀었다 모르긴 몰라도 
마산 코프 <b>커피</b>,https://blog.naver.com/ani1828?Redirect=Log&logNo=222501376853,마산 석전동 카페 코프 커피    년 만에 코프 커피를 다시 찾았다 못 보던 사이 공간이 많이 바뀌어 한층 더 멋있어졌다 달콤하고 고소한 빵 냄새는 여전히 먹음직스럽다 여기 있는 거 전부 다 
9.12 대전 _ 유성 봉명동 카페 &lt;루즈<b>커피</b>&gt;,https://blog.naver.com/jean7457?Redirect=Log&logNo=222504167867,오늘 우리의 목표는 구름커피 어느 블로그에서 보고는 넘나 사랑스러워서 찜해둔 것이었다 솜사탕 구름커피를 만날 수 있는 카페는 대전시 유성구 봉명동에 위치한 루즈커피 우리 집에서 차로 분 거리도 
수원 <b>커피</b> 맛집 남다른 퀼리티의 디저트들,https://blog.naver.com/dusl1984?Redirect=Log&logNo=222462789077,오늘은 빵을 좋아하는 친구와 함께 수원 커피 맛집에 다녀왔어요 수원에 있어 가기 전까지 많은 고민이 수원 커피 맛집은 나혜석 거리 초입에서 걸어 들어오시면 투썸이 보이실 거예요 그 매장 옆옆 건물  
사무실 <b>커피</b>머신 제대로 뽕뽑으며 사용하자!,https://blog.naver.com/dhkdql779?Redirect=Log&logNo=222505637829,사무실커피머신 전자동커피머신 원두커피머신 커피머신추천 커피머신렌탈 블리스 브라운백커피 저희 회사는 명 남짓의 작은 스타트업이에요  매 분기마다 멤버들과 함께 이야기하면서 회사에 
[서울 성북구 하월곡동] 폴드 <b>커피</b> pold coffee,https://blog.naver.com/shellfish47?Redirect=Log&logNo=222498731414,성북 하월곡동 미아사거리 애견 동반 카페 폴드 커피   무더웠던 월의 어느 날 미아사거리에 있는 카페 폴드 커피에 갔다 폴드 커피의 외벽에는 덱스터와 디디가 그려져 있다 여기서 잠깐 덱스터 
<b>커피</b> 향이 가득한 가정식주택 #카페_랑께,https://blog.naver.com/suncheonsi?Redirect=Log&logNo=222493868653,있으니 커피와 곁들여 드시면 좋을 것 같아요 화장실은 카운터 옆에 위치해 있으며 시설이 깨끗하고 관리가 잘 되어 있어요 고소한 커피 향과 따뜻한 감성이 잘 어울리는 카페 랑께에서 이번 주말엔 
《합정 카페》 아늑하고 맛있는 그 곳, 커넥츠 <b>커피</b>,https://blog.naver.com/sharkskins?Redirect=Log&logNo=222501661720,스폐셜티 커피 열풍이 불기 전부터 항상 망원연남돠 더불어 예술 쪽 씬은 컸던걸로 기억한다 나만큼 커피를 애정하는 친구와 찾아간 합정 어디를 갈까 하다 찾은 곳이 바로 이 곳이다 커넥츠커피 보기만 
경복궁 광화문 맛있는 <b>커피</b>집 :: 내자동<b>커피</b>,https://blog.naver.com/cinei77?Redirect=Log&logNo=222503631152,맛있는 커피 사러 간다고 해서 따라나섰네요 정말 백만년만에 가보는 경복궁 근처 내자동 커피에 다녀왔어요 여긴 년전 오픈한곳인데 직접 원두도 바리스타님이 볶다보니 맛있어서 원두 주문해서 먹고 
강릉 여행 갈만한곳 강릉항 안목해변 강릉 <b>커피</b>거리(카페),https://blog.naver.com/ydl1?Redirect=Log&logNo=222496237228,강릉 여행에서 갈만한곳을 손꼽을 때 빠지지 않는 한국 관광의 별 강릉 커피거리가 있는 안목해변으로 강릉 커피거리 강원도 강릉시 창해로번길  년부터 회 연속 한국관광 선에 선정된 
싸다김밥에서 김밥 말고 돈까스 테이크아웃 포장 + <b>커피</b>조이,https://blog.naver.com/ehseo358?Redirect=Log&logNo=222504388417,가능하다면 소스를 좀 더 부탁 드려볼까해요ㅎㅎ 요새 빠져있는 과자 커피조이 돈까스 먹고 후식은 아니었지만 최근에 제가 자주 먹는 과자 도 같이 소개해봅니다 인도네시아 과자 커피조이 인데요 
[유라 <b>커피</b>머신 이벤트] 유라 Z10 (Jura Z10) TV 광고... ,https://blog.naver.com/hli2127?Redirect=Log&logNo=222485488692,커피머신 유라   을 이제  광고로도 만나보실 수 있습니다  유라   광고 방영을 기념해 알라카르테 블로그에서 특별한 이벤트를 준비했는데요 아래의 광고 영상과 유라 커피머신의 
연천 가볼 만한 곳, 한탄강관광지 구석기<b>커피</b>농장,https://blog.naver.com/iyc21net?Redirect=Log&logNo=222504331856,오늘 소개해 드릴 곳은 한탄강관광지에서 커피나무를 보실 수 있는 구석기커피농장입니다 진짜 커피나무를 키우는 곳 구석기커피농장 연천 마을 여행을 즐기는 필자가 오랜만에 한탄강유원지 나들이에 
캡슐<b>커피</b>머신 일리 illy 원두 정기배송 런칭 이벤트,https://blog.naver.com/y22052205?Redirect=Log&logNo=222505925623,   커피를 안 마시던 제가 육아를 시작하면서부터 매일같이 하루도 빠짐없이 커피를 마시게 되었어요 뭔가 커피 한 잔 마시고 나면 힘이 샘솟는 거 같다고나 할까요 정신도 차려지는 거 같고 
<b>커피</b>컵 재활용 달의주기 그림자놀이 도안공유,https://blog.naver.com/jammioe?Redirect=Log&logNo=222491478697,얼마전에 커피 포장해서 집에서 마셨는데 컵 버리기가 아까워서 나중에 뭐라도 만들겠다며 보관했는데 어제 재활용 만들기를 해봤어요 커피컵 재활용 한 달의주기 그림자 놀이랍니다 제 블로그에서 자주 
맥심<b>커피</b>믹스 신상 슈프림골드 박서준<b>커피</b> ♡,https://blog.naver.com/carura84?Redirect=Log&logNo=222505048003,맥심커피믹스 ㅋㅋㅋ 제가 제일 애정하는 화이트골드와 모카골드 그리고 맥심디카페인까지 요 맥심커피믹스를 발견 뭐야   온화하면서 차분한 색감 오렌지빛의 맥심 슈프림골드가 신상으로 
[제주시]<b>커피</b>템플,https://blog.naver.com/ilovebbs?Redirect=Log&logNo=222504129506,메뉴판중 드립커피만 찍었네요 니카라과와 온두라스 주문 야외 테이블도 제법 많습니다 딸내미는 우리는 커피에 집중 온두라스도 좋은데 니카라과를 마시다가 마시니 좀 러스틱한듯합니다 그래도 둘다 
CU 씨유 폴바셋 돌체라떼 편의점 <b>커피</b> 추천,https://blog.naver.com/asdffggg2?Redirect=Log&logNo=222503557985, 씨유 폴바셋 돌체라떼 편의점 커피 추천 폴바셋 커피가 이젠 편의점에도 달콤한 연유가 들어간 돌체라떼가 폴바셋에서 나왔더라고요 믿고 마시는 라떼 폴바셋 라떼 궁금해서 사봤어요 가격은 원 
[진주카페] 분위기 좋은 진주 카페 / 차분히<b>커피</b>part2,https://blog.naver.com/bhg20247?Redirect=Log&logNo=222504740333,차분히커피 경남 진주시 진양호로  차분히커피  하연옥에서 냉면을 먹고 진주사는 여자친구 친구의 추천으로 방문한 카페 차분히커피 파트 파트라고 하는걸 보니 본점이 있는걸까 
세븐 아보카도<b>커피</b>, 와 이런맛이라고?,https://blog.naver.com/kkalgid1?Redirect=Log&logNo=222492091130,세븐  아보카도커피 만들기 캬 이런맛이라고  글  사진  에이치라떼 아보카도가 와 맛있다 아보카도커피를 보고 상상이 안갔어요 아보카도를 좋아한다곤 하지만 커피랑 잘어울릴까 싶을까 
아보카도<b>커피</b> 이 조합 아주 칭찬해~ 아보카도 요리 먹는법!,https://blog.naver.com/baby0817?Redirect=Log&logNo=222489053635,아보카도커피 이 조합 아주 칭찬해 아보카도 요리 먹는법 제가 또 한때 엄청 좋아했던 세븐이 오랜만에 뭔가 해서 보니 아보카도커피 입니다 이 두가지 조합이 은근 상상은 갑니다 부드럽고 풍미가 좋은 
카페박스 <b>커피</b> 구독으로 홈 카페 즐겨요:),https://blog.naver.com/ks541017?Redirect=Log&logNo=222505193628,저는 커피를 정말 좋아해요 집에서 매일 핸드드립으로 커피를 내려 마시는데 남편하고 둘이 커피를 마시다 보니 원두도 금방 떨어지게 돼요 매번 원두를 사러 가기도 번거로워서 원두 구독 서비스를 
강릉기념품 드립백 <b>커피</b>콩빵, 정말 맛있어요,https://blog.naver.com/reginayun?Redirect=Log&logNo=222505068030,강릉갈 때 사오기 좋은 강릉기념품 내가 먹기에도 선물하기에도 좋은 강릉당 커피콩빵 강릉이 커피로 유명해서 그런지 커피가 들어간 강릉기념품 들이 많이 나오는거 같다 직접 년 동안 연구한 레시피로 
