제목,링크,내용
멋진 수공예 도자기, 무조건 <b>커피</b>잔세트! 인천송도 노라덕,https://blog.naver.com/noraduck?Redirect=Log&logNo=222493653245,실용성과 고급스러움을 동시에 커피잔 세트 이번 추석선물로 제격 오늘은 선물로 가장 많은 추천을 찻잔세트 커피잔 잔받침 세트라 가성비도 좋은 선물입니다 잔은 지름   높이   용량은 약 
&lt;스너그로스터리/광명 철산&gt;-여기 <b>커피</b> 잘하네!,http://purplebeat.egloos.com/4201371,뭐 결론부터 말하면 여기 커피 잘한다 카페에는 두 가지 부류가 있는데 인스타 프렌들리한 감성커피파와 커피에 진심인 감성커피 의 부류 여기는 후자라고 할 수 있을 듯 둘 다 좋다 데이트땐 전자 가고 
야당 케일리팜키친, 오알<b>커피</b>,https://blog.naver.com/bom_mmm?Redirect=Log&logNo=222478437608,신랑이랑 가봤던 오알커피 친구들도 데려갔다 층에 올라가면 삐그덕거리는 바닥인데도 아 이거 쓰는데 커피 마시고 싶네 바스크 치즈케이크는 언니가 시켜서 먹던데 나는 안 먹어서 몰라 맛 점심 너무 
대전 신세계 백화점 Art&amp;Science 카페:) 태양<b>커피</b> 아인슈페너... ,https://blog.naver.com/bluenote0415?Redirect=Log&logNo=222495676281,이날은 층 태양커피 아인슈패너 먹으러 간건데 리틀버틀러 슈패너버틀러도 먹고 싶어서 곳 다 태양커피 먹으러 층으로 고고 여긴 층 여자 화장실 파우더룸도 겁나 고급지다 ㅋㅋㅋㅋㅋㅋㅋㅋㅋ 
컴포즈<b>커피</b> 메뉴 아메리카노와 크로플 가격,https://blog.naver.com/asdffggg2?Redirect=Log&logNo=222477624717,컴포즈커피 메뉴 아메리카노와 크로플 가격 어제 저는 코로나 백신 차까지 접종 완료 했어요 차 컴포즈커피에서 아아와 크로플을 사 들고는 룰루랄라했죠  백신 접종 후 커피 마시면 가슴이 두근거리는 
[대구]SOUNDS COFFEE CLASSIC(사운즈 <b>커피</b> 클래식),https://blog.naver.com/dnr6578?Redirect=Log&logNo=222456491906,아침에 돼지국밥을 먹고 커피 한 잔 하러 찾은 대구역 근처의 사운즈 커피 클래식 대구 삼덕동에서 영업 중인 사운즈 커피의 두 번째 지점입니다 찾아보니 최근에 범어동에 세 번째 지점도 낸 듯 영업시간이 
홈카페 달달한 기분전환 맥심 슈프림골드  홈<b>커피</b>,https://blog.naver.com/yium797979?Redirect=Log&logNo=222473838587,아이스커피세요 그렇담 어른이 다됐군요 ㅎㅎ 밥먹고 나서 입가심으로 달달한게 땡길때 축축 쳐지는 기분을 업 시키고 싶을때 기타등등 현대인들에게 소소한 행복을 선사해주는 그 이름 커피 특히나 
혜화동 골목 안 작은 한옥카페, 명륜1가 혜화<b>커피</b>,https://blog.naver.com/xkstjd?Redirect=Log&logNo=222473504566,명륜동 골목 안 작은 한옥카페인 혜화커피 근처에 세차장을 이용하는지라 오며 가며 보다가 차 에스프레소 핸드드립 콜드브루 등 커피메뉴도 제대로 갖추어져 있었어요 저는 아인슈페너를 주문했는데요 
세계 사람들은 어떻게 <b>커피</b>를 마십니까?,https://blog.naver.com/kimcg3519?Redirect=Log&logNo=222494083277,전 세계 수백만 명의 사람들이 한 잔의 커피로 하루를 시작하지만 각 나라마다 고유한 커피 문화가 있습니다 전 세계 대부분의 국가에서 아침 일과는 비슷합니다 일어나서 세수하고 커피 한 잔 드세요 이 
플랜잇 핸드드립세트 고급스러운 드립<b>커피</b> 내리기,https://blog.naver.com/peony_blossom?Redirect=Log&logNo=222474954360,커피향 한가득 핸드드립커피 내리기 행복한 시간의 기록  플랜잇 핸드드립세트 정말 마음에 들어요 맛있는 커피 행복해  물욕 한가득 인생을 사는 중인 피오니 ㅅ 집에 벌써 커피머신은 여러개 
침산동카페 대구핸즈<b>커피</b> 성북교점,https://blog.naver.com/onepiece0109?Redirect=Log&logNo=222481454724,침산동카페 대구핸즈커피 핸즈커피 성북교점 영업시간 평일    주말     금 토 공휴일 전일  주차공간  전용 주차장 있음  매장 내 이용 시 시간 테이크아웃 분  인테리어  층 
시흥카페_부천카페_감성카페 릴리프<b>커피</b>(relief coffee),https://blog.naver.com/tmdgml043?Redirect=Log&logNo=222486119287,네이버지도에 저장해놓은 릴리프커피를 급 다녀왔다 아마도 인스타에서 보고 분위기가 좋아 저장해둔 카페였던 것 같다 릴리프커피 부산 시흥 감성카페  월금    주말 및 공휴일    
망원카페｜합정카페 : 무슈부부<b>커피</b>스탠드 [COFFEE STAND],https://blog.naver.com/doss91?Redirect=Log&logNo=222477922675,망원카페합정카페  무슈부부커피스탠드       당분간 월요일 휴무  무슈부부 커피스탠드 인스타그램에서 볼때마다 너무 가고싶어서 저장해놓았던 무슈부부커피스탠드 외관이 너무 
오상욱 <b>커피</b>머신 반가워 필립스,https://blog.naver.com/misssin6023?Redirect=Log&logNo=222481048717,오상욱 커피머신 반가워 필립스 요즘 기안 왕따설 도를 넘은 마감샤워때문에 나혼자산다가 논란이 바로 커피머신 ㅎㅎㅎㅎㅎㅎㅎ 전 오상욱 선수가 박스 들었을때 바로 어 저거 싶었어요 
그윽한 <b>커피</b> 한잔 하실래요? 성수동 ROASTERY CAFE,https://blog.naver.com/hsgstory?Redirect=Log&logNo=222473258186,특히나 개인적인 감성과 취향을 저격할만한 카페들이 많아진다는 건 커피소비자의 입장에서 행복하기만합니다 바쁘게 돌아가는 일상 속 커피 한 잔이 주는 여유로움은 누구에게나 꿀맛같은 휴식을 선사하죠 
영국 홍차브랜드 위타드(Whittard)의 '달고나<b>커피</b>' 레시피,https://blog.naver.com/estel0701?Redirect=Log&logNo=222479904412,품질좋은 커피도 함께 취급하고 있지요 해러즈 위타드 포트넘앤메이슨 등등 대부분의 홍차 브랜드들은 홍차만큼 다양한 커피를 취급하는데요 매장에 가셨다가 홍차보다 커피를 더 
오대산 산행에서 여행모드로 전환 (강릉안목<b>커피</b>거리와 송정해변),https://blog.naver.com/bonitajin2?Redirect=Log&logNo=222496646415,안목커피거리로 달달한 커피와 빵 그리고 빨갱이언니표 빨파노랑색 두건을 쓰고 인증샷도 남겨보고 ㅋ 마스크를 쓰고 있어도 숨길수 없는 웃음가득한 얼굴표정들 이것이 행복인게지 창넓은 창가테이블에서 
오사카 모닝<b>커피</b>와 점심 '백식당(佰食屋)',https://blog.naver.com/ledimoon?Redirect=Log&logNo=222479993169,아직 문을 열지 않아서 근처 커피숍에 들려 모닝커피를 마셨다 느낌이 좋았던 커피숍 상호명은 기억이 나지 않는다 모닝커피는 진리 드디어 백식당에 왔다 간판을 못찾아서 이리저리 해메었던 기억이 
사용하기 편리한 데일리 드립백<b>커피</b> 추천!,https://blog.naver.com/junstar1010?Redirect=Log&logNo=222480117956,사용하기 편리한 데일리 드립백커피 추천 안녕하세요꾹꾹이입니다 요즘 날이 선선한 게 집에서 느긋하게 커피타임 즐기기 딱인데요 한겨울엔 커피콩도 직접 갈고 핸드드립세트 사용해서 향기로운 홈카페 
5. 4 - 6 / 4번째 어린이날:) , 깜짝선물 일리 <b>커피</b>머신 y3.3,https://blog.naver.com/khjung13?Redirect=Log&logNo=222482809277,길에 커피 마셔야지 창녕까지 왔음 요기 들려줘야지 ㅋㅋ 카페귀촌 창녕카페 커피랑 음료 나오기 전 놀기 안에서 너무 시끄러울 것 같아 토토는 밀쉐 센스있게 테이크아웃잔으로 주셨는데 빨대에 반지가 
《강남역 카페》 도심 속 오아시스, 브루<b>커피</b>... ,https://blog.naver.com/sharkskins?Redirect=Log&logNo=222499419472,브루커피  부산 해운대 해리단길 깊숙한 곳에 본점을 두고있는 꽤 유명한 커피 브랜드이다 지난 부산 여행 때 해운대 본점에 갔다가 허탕을 쳤는데 드디어 이번 지인이 전시를 진행하며 나 역시 
불당동애견동반 토모토모<b>커피</b>,https://blog.naver.com/bl07107?Redirect=Log&logNo=222471015559,토모토모커피 지인이 오픈했는데 귀여운 아이템도 많고 애견동반카페라서 빨리 가보시라고 올려드려요  예스 키즈존이에요  지인 반려견이름이 토리 모카 라서 상호는 토모토모커피가 되었어요 메뉴 
가족휴가/ 고성 카페 <b>커피</b>고,https://blog.naver.com/gracepark69?Redirect=Log&logNo=222474883069,고성 바다뷰 비치뷰 커피고를 소개할게요 여행 다닐 때 어디가 뷰가 좋고 커피가 맛있는 카페가 어딘지 고민할 수 있는데요 요즘은 스마트폰이 있고 검색하면 다 알수있으니까 편한 것 같더라구요 저희 
2021. 08. 16 순남<b>커피</b> 스콘 (feat. 반려견 동반카페),https://blog.naver.com/llbohyunll?Redirect=Log&logNo=222473573128, 순남커피에 스콘 먹으러 어제는 점심을 파리바게뜨 샐러드로 건강하지만 배고프게 먹었던 터라 순남커피는 스콘과 파운드 휘낭시에 에그타르트 등 커피와 함께 먹을 수 있는 구움과자 디저트 종류가 
부산기장 웨이브온 <b>커피</b>,https://blog.naver.com/prayreader?Redirect=Log&logNo=222474975880,부산기장 웨이브온 커피 부산기장에 가면 꼭 가보고 싶었던 카페가 있었는데요 에서 몇년전 부터 음료는 티라미수와 카페라떼 브루잉커피 주문했어요 디저트 종류도 상당히 많았지만 티라미수도 
[SBA 기업스토리 콘텐츠]홈카페 전용 휴대용 고성능 <b>커피</b>... ,https://blog.naver.com/seoulsba?Redirect=Log&logNo=222484598064,주빈스코프는 커피 메이커 브랜드인 를 운영 중에 있으며 그라인더 컴프레소 등의 홈카페용 커피용품을 개발 및 판매하고 있습니다 주빈스코프와 관련해 자세한 제품 정보가 필요하신 분들은 
배스킨라빈스31 싱글레귤러 아이스맥심모카골드 <b>커피</b>아이스크림,https://blog.naver.com/gloomyrainz?Redirect=Log&logNo=222486689138,월에 만난 또 다른 아이스크림은 커피맛 아이스크림인 아이스맥심모카골드 나는 커피를 안 마시지만 신메뉴는 지나칠 수 없다는 생각이 들어서 꼭 먹어야겠다고 다짐했지 사진출처  배스킨라빈스 
추석선물, 추석 더치 <b>커피</b> 선물세트,https://blog.naver.com/kaisr2?Redirect=Log&logNo=222487853254,하루 잔씩 아이스커피를 마셨던 년 여름의 폭염이 어제처럼 기억납니다 더위에 도움이 되고 식후에는 커피를 안 마시면 허전해서 블랙커피를 자주 마셨었죠 그리고 이제 곧 우리의 대명절 추석이 
판교 알레그리아 카페 라 노체, 도제 식당 (<b>커피</b> 너무 맛있어요),https://blog.naver.com/hwkmh?Redirect=Log&logNo=222487351221,판교 알레그리아 카페 라 노체 도제 식당 커피 너무 맛있어요 남편이 추천해준 도제식당 과 하나라는 알레그리아 커피 정말 맛있어요 커피도 정말 예쁘게 나와서 여자들이 좋아할만 한 곳 ㅎㅎ 커피 
2021년 7월의 일상 1(상수 오츠<b>커피</b> 마포점, 로우로우 홍대점... ,https://blog.naver.com/yangbbong87?Redirect=Log&logNo=222495225310,오츠커피 마포 상수역 브렛피자 옆에 있는 오츠커피 늘 가고 싶었는데 사람들이 그득이라 눈치만 보다가 오늘은 당당히 들려보았다 정말 이날 정말 더웠고 들어가자마자 아이스 커피 주세요를 
[서울/서초동] '콰이어 <b>커피</b>', CHOIR COFFEE,https://blog.naver.com/happieczar?Redirect=Log&logNo=222483791098,룰 커피 왔다가 근처에 괜찮은 카페가 없나 검색해 보고 방문한 곳 직원분과 어색한 시간을 보낸 후 스몰라떼 와 아포카토 주문 마침 배가 너무 고파서 까눌레 피낭시에 솔티드초코마들렌도 꼽사리 
홈카페 용품, 주방저울 스마트 <b>커피</b>저울 사용기,https://blog.naver.com/sticky4?Redirect=Log&logNo=222478430910,홈카페를 즐기다보니 커피에 대한 욕심이 느네요 초반에는 홈카페 용품 정도 였는데 원두에 눈길이 간혹 커피를 잘 아시는 분이 제 포스팅을 보고 지적을 해주셨고 자주 가는 단골 카페 사장님도 사용해 
울산대학교 무거동 카페 - 땡스<b>커피</b>(HTX COFFEE) 애견동반 가능,https://blog.naver.com/ddawndew?Redirect=Log&logNo=222484544615,요즘 커피를 줄이는 중이거든요 오늘은 집 근처 동네 골목에 있는 조용하면서도 작은 카페인 땡스커피 다녀온 이야기를 정리합니다 땡스커피라고도 하고요 티에이치엑스 커피라고도 합니다 자고로 카페 
짠테크를 위한 홈카페 가정용 <b>커피</b>머신기,https://blog.naver.com/admycin?Redirect=Log&logNo=222477733714,커피는 내 인생에 빼놓을 수 없는 항목인데 사 마시는 커피를 줄이기 시작했다 번의 커피 무지출 데이를 만들어내고 원씩 적립하여 원의 저축습관을 만들었다 월에 습관이 조금 만들어져서인지 
[여의도] '더 현대 서울' 유명 <b>커피</b> 뽀개기 - 블루보틀, 카멜<b>커피</b>... ,https://blog.naver.com/nippyturtle?Redirect=Log&logNo=222489473185,마포로 이사온 후 코로나의 방해로 더 현대 서울이 오픈한지 개월만에 이곳에 입점한 유명 커피가게 곳을 모두 방문 완료 첨에는 가장 사람이 적은 곳 방문 테일러커피   콜드브루 캔 커피도 
쉬어가는 일상, 파미어스몰/삼청동샤브샤브/키쏘<b>커피</b>/서울숲산책,https://blog.naver.com/ju0ha2?Redirect=Log&logNo=222494208013,친구가 하는 줌마커피에서 열심히 머리길러야지  엄마네집에 있는 냐옹이 베리 까까도 혼자 꺼내먹는 함께하쟝 키쏘커피 이건 집근처에 있는 키쏘커피 새로생긴 카페라서 그런지 깨끗했당 커피맛은 쏘쏘 
원두에 진심 ㆍ 레이크<b>커피</b>로스터스 <b>커피</b> 원두 주문 라떼맛 최고,https://blog.naver.com/100vs100328?Redirect=Log&logNo=222486463857,지난번 먹어본 레이크커피로스터스 커피원두 재주문 했어요 가성비 맛과 신선함 너무 좋았거든요 홈카페 일년차 다양한 원두를 접해 보았습니다 ㅋㅋ 커피가 다되가면 어딜 시켜야되나 
동탄 석우동 무인카페 <b>커피</b>에반하다!,https://blog.naver.com/bangwul92?Redirect=Log&logNo=222471852804,동탄 석우동 무인카페 커피에반하다 안녕하세요 방울이입니다 밤에 주로 산책을 하는편인데 뭔가 신용카드는 물론 체크카드 삼성페이 모두 가능해서 굳 커피에반하다 무인 카페는 로봇 바리스타와 
마이센 블루 플라워의 골드 라인 (<b>커피</b>팟3종, 오블롱, 팬다곤... ,https://blog.naver.com/suhi0000?Redirect=Log&logNo=222497477423,커피팟종미듐사이즈과  모카찻잔조 마이센에서 블루플라워 들꽃과 곤충  골드 악센트가 상태는  커피팟의 화이트장미에 칩이 있는데 잘 보이지 않아요 그외는 상태좋고 아름다워요  커피팟 
신사동 가로수길 카페 마일스톤<b>커피</b> milestone coffee... ,https://blog.naver.com/padamnara?Redirect=Log&logNo=222483929385,마일스톤커피 티라미수가 생각나서 찾아왔어요   오랫만에 찾은 가로수길 카페 마일스톤커피는 매장 분위기도 그렇고 디저트 메뉴도 그렇고 한층 업그레이드 된 느낌이었어요 내가 오본지 오래되서 그런가 
샤오미 <b>커피</b>머신 5세대, 캡슐<b>커피</b> 가성비의 끝판왕!,https://blog.naver.com/pit_auto01?Redirect=Log&logNo=222480500973,개인적으로 돌체구스토 네스프레소 등 다양한 캡슐 커피머신을 사용했었는데요 이제는 가성비 끝판왕 커피머신을 사용해볼까 합니다 내돈내산 캡슐 커피머신 리뷰를 시작해볼게요 너무 저렴해서 정말 이 
[반월당카페] 더기<b>커피</b> / 땅콩크림라떼인 덕산슈페너가 맛있는... ,https://blog.naver.com/minji8635?Redirect=Log&logNo=222495204534,더기커피 유이쯔 옆에 위치해있는 곳인데 라떼류도 맛있고 휘낭시에도 맛있다 위치는 대구 중구 크크크 아무튼 모든 메뉴가 맛있는 더기커피 휘낭시에는 추가해도 안해도 상관없는 맛이고 그냥 커피가 
레이<b>커피</b>바, 분위기 좋은 인덕원 카페,https://blog.naver.com/ali7548?Redirect=Log&logNo=222474417591,레이커피바 불막창 맛집은 포스트 아래 링크 걸어둘게요 네이버로 인덕원 카페 검색해서 갬성만 보고 뭔가 커피프린스 생각나는 느낌 이 드라마 언급하면 너무 옛날사람인가요 갬성이라는 걸 좀 
문의 많이 주셨던 독일 바커스 <b>커피</b>콩 재입고 되었어요^^,https://blog.naver.com/flame0303?Redirect=Log&logNo=222492391009,문의 많이 주셨던 독일 바커스 커피콩 재입고 되었어요 나른한 오후 기분 좋은 당충전으로 정말 좋은 년의 역사를 자랑하는 바커스 커피의 커피콩 초콜릿 구매 요청 많으셨는데 
네스프레소 캡슐<b>커피</b>로 즐기는 홈카페, 리미티드 에디션 캡슐... ,https://blog.naver.com/al_satang?Redirect=Log&logNo=222493582458,네스프레소  리미티드 에디션 캡슐커피 이스피라치오네 이탈리아나 커피 종과 함께 이탈리아 도시여행해요 저 뿐만 아니라 주변에서 요즘 아주 흔하게 듣는 말 아 여행 가고 싶다 가고 싶을 때 여행 
분당 55도<b>커피</b>로스터스 : 분위기 좋은 감성 카페,https://blog.naver.com/decadentliz?Redirect=Log&logNo=222430771085,도커피로스터스 분당시범먹자거리 한옥 베이커리 카페 아기랑 다녀왔어요 스페셜티 커피를 로스팅하는 숲속 분당 카페 방문기 핫플은 역시 한산할 평일에 다녀와야 제맛이죠 분위기 좋은 감성 카페를 찾아 
오송 프랜차이즈 [달리는 <b>커피</b>] 방문 후기(샌드위치, <b>커피</b>),https://blog.naver.com/pjm0509?Redirect=Log&logNo=222480533446,보통 아침 끼니 를 거르시는 직장인 분들이 많죠 귀찮은 아침을 해결해야 할 때 생각나는 음식 바로 커피  샌드위치 프랜차이즈 전문점입니다 ㅎ 달리는 커피 방문 후기를 공유드려요 ㅎ 위치 외관 
[블로그씨] <b>커피</b> 취향,https://blog.naver.com/mint_pumpkin?Redirect=Log&logNo=222487321149,나의 커피 취향에 대해 이야기해 주세요 와 나 왜 사진 찍어둔거 없지 이런건 짤방과 함께 써야 사실 씁쓸한 맛을 별로 좋아하지 않아서 커피를 썩 좋아하진 않는다 뭔가 커피를 좋아한다고하면 
프레시카페 더치<b>커피</b>선물 깔끔해서 좋아,https://blog.naver.com/ariel_0402?Redirect=Log&logNo=222473397592,프레시카페 더치커피선물 직장생활 할 땐 카페인에 취약해서 주말 아니면 커피 자제해서 마셨던 내가 결혼하고 회사 관두면서 아침이고 저녁이고 에라이 모르겠다 하면서 커피 마시는 요즘 집에서 
상수 애견동반 카페 인솔<b>커피</b>,https://blog.naver.com/fromrei8?Redirect=Log&logNo=222429736842,애견동반 카페 상수 인솔커피 이 동네를 지나가는 길에 주차가 되는 상수 카페를 찾다가 발견한 곳이다 마침 커피맛을 중요시 여기시는 분과 동행하고 있었기에 그것도 중요했고 막상 가보니까 강아지들이 
반송동카페 아이캔<b>커피</b> 동탄점에서 포장했어요,https://blog.naver.com/limzzang1015?Redirect=Log&logNo=222476105661,커피를 좋아하는지라 쉬는날엔 항상 남편과 커피를 먹곤하는데요 이날은 반송동카페인 아이캔커피에 다녀왔어요 메뉴를 쭉 훑어봤는데요 커피 및 음료등 판매하는 메뉴가 많아서 좋았어요 그리고 전 
삼덕동 구)이에<b>커피</b> 기록 (현, 삼덕모가),https://blog.naver.com/yunji0203?Redirect=Log&logNo=222470993462,이에커피 솨장님은 너무나 친하고 좋아하는 분이라 자주 방문했는데 ㅋ 사진만 어마무시하게 이에커피 공간으로 운영하시지만 최근엔 대구 방문이 거의 없어서 한번밖에 못가봤다 ㅎㅎ 라이카 
간편하게 장소 상관없이! 드립백으로 내려먹는 드립<b>커피</b>,https://blog.naver.com/sticky4?Redirect=Log&logNo=222480481725,여기커피에서 신제품이 나왔어요 드립백 커피 패키지랍니다  여기커피라고하면 제가 이전 포스팅에서 여러 번 소개해드렸던 곳인데요 진짜찐짜 원두 맛집 커피 맛은 기본이고 스페셜 블렌딩 원두를 
서면 카페 브룩스(BROOKS) 크로플과 드립<b>커피</b> 대신 초코라떼,https://blog.naver.com/tsslove?Redirect=Log&logNo=222482666784,서면 카페 브룩스 크로플과 드립커피 대신 초코라떼 안녕하세요  은비입니다 부산여행 중에 서면에서 친구를 만나기로 해서 ㅋㅋ 서면에서 일이나 좀 하면서 기다릴까 하고 드립커피가 된다는 브룩스 
드롱기 <b>커피</b>머신 청소 (feat. 식품첨가물 100% 에코 디스케일링),https://blog.naver.com/ineedamuse?Redirect=Log&logNo=222437571999,한동안 열심히 사용했던 드롱기 커피머신 그런데 일이 바빠지고 여유가 없으니 원두를 갈고 필터 끼우고 내려마시고 청소하고 너무 귀찮았다 원래 바쁠 땐 누가 내려주는 커피가 제일 맛있지 그러다 최근 
[인도 델리 기행] 데반스<b>커피</b>/ GK 마켓투어/ Spago 이탈리안,https://blog.naver.com/pola0000?Redirect=Log&logNo=222489673725,커피도 살겸 당보충도 할겸 데반스 커피로 기진맥진 영혼탈출 습관적셔터누르기 를 포착한 남편 아 멍하다 멍해 센거 한방 아포가토 후루룩 해장할때 나는 자연음 무음처리 실패 어쩔 ㅋㅋㅋ 
우리집 홈카페 기록, 셀프 <b>커피</b> 배우기 중입니다,https://blog.naver.com/byclaire01?Redirect=Log&logNo=222478400690,카메라에 담긴 이런 저런 사진 중에 커피 관련된 것만 털어봅니다 이름하여 블태기 극복용 포스팅 카페 다니기를 자제하고 있다보니 집에서만 주구장창 마시네요 원두 사서 제 나름대로 연구하며 커피 배우기 
대전 갈마동 : 로얄라멘 츠케멘 라멘, 갈마동 카페 워크룸<b>커피</b>,https://blog.naver.com/romance_86?Redirect=Log&logNo=222484957127,라멘 먹고 싶을 때 또 가고 싶네유  잘 먹고 가요  라멘 먹고 차 커피는 근처에 있는 워크룸커피로 우왕 우리밖에 없다 블랙블랙 시크한 늬낌의 워크룸 커피 깔끔하다 음악도 힙하고 깔롱함 ㅎㅎㅎㅎ 
여우 꼭지 장식 <b>커피</b> 스쿱 우드 카빙(coffee scoop),https://blog.naver.com/kkal07?Redirect=Log&logNo=222482438280,손잡이가 긴 커피 스쿱입니다 손잡이에는 여우 얼굴로 꼭지 장식을 했습니다 므켐크님한테 받은 따라란 여우 꼭지 장식이 들어간 커피 스쿱 블랭크 개 완성 저 상태로 다시 냉동실에 잘 묵혀둬요 
그 맛이 나지 않는 한국편의점표 85도 소금<b>커피</b>,http://chiculture.egloos.com/4199833,대만 여행하시는 분들이면 꼭 한번은 마셔 본다는 도씨 소금커피가 한국의 편의점에서 팔고 있길래 한 번 마셔 보았습니다 대만있을때도 가끔 먹었던 소금커피인데요 특히 한국에서 오시는 관광객들에게는 
광안리 카페, 언더<b>커피</b> 라이프.,https://blog.naver.com/reddotskirt?Redirect=Log&logNo=222475511251,광안리에 위치한 카페 언더커피 라이프 오픈한지는 꽤 됐는데 이제서야 방문 사실 몇 번 와서 언더커피의 메뉴 레몬 크로핀이 먹고싶었는데 없다고 해서 넘 아쉬웠다 다시 가야할 이유가 생겼고요 분위기는 
<b>커피</b>빈 해피모닝 크루아상 샌드위치로 간편아침식사 해요!,https://blog.naver.com/ssung_sarah?Redirect=Log&logNo=222480217387,커피빈 해피모닝 크루아상 샌드위치로 간편아침식사 해요 가끔 날씨좋은날 아침에 산책을 하는데요 좋은 날씨 집에 가는 길에 커피빈에 다녀왔어욤ㅎㅎ 방배카페골목점 커피빈에 방문했어요 주말 
가평 두루<b>커피</b>... 가평에서 핸드드립 게이샤 <b>커피</b>를~,https://blog.naver.com/unikon?Redirect=Log&logNo=222472773224,두루커피에 도착했다 서울 계동에 있는 두루 계동점의 그 필체로 근사한 간판이 길가에 세워져있다 가평에서도 제법 산속으로 들어간 한적한 곳에 두루커피가 새로 오픈했다 전원생활을 꿈꾸셨던 
스타벅스 별다방점 리저브 <b>커피</b> 마시고왔어요~,https://blog.naver.com/mimi030630?Redirect=Log&logNo=222480388764,딸내미랑 명동칼국수 맛나게 먹고 밥 먹었으니 커피 마시러 가야죠ㅎ 명동에 스타벅스가 여러 곳 느낌 뷰가 창밖을 볼 수 있는 곳 자리가 나지 않네요 리저브 바에 앉아 메뉴를 탐색 난 드립커피 
