제목,링크,내용
맛있는라떼 부드러운<b>커피</b> 호주마약<b>커피</b>,https://blog.naver.com/ssagaz000?Redirect=Log&logNo=222492193723,그 비법은 바로 맛있는라떼 부드러운커피 호주마약커피랍니다 박수 짝짝짝 호주 네슬레가 한국인 입맛에 딱 맞게 만든 쓰지 않고 부드럽고 구수한 곡물향 아메리카노 스틱 맛있는라떼 부드러운커피 
진하고 크리미한 ☕ <b>커피</b> 바스크 치즈케이크 만들기 (영상... ,https://blog.naver.com/asy1347551?Redirect=Log&logNo=222458416754,ㅎㅎ 오늘의 베이킹은 커피향 가득 크리미한 커피 바스크 치즈케이크입니다 기본 바스크 치즈케이크 많이 만들어 보셨을 텐데요 커피 바스크 치즈 케이크도 꼭 만들어 보시길 바래요 
[서울/연희동] '라우터 <b>커피</b>', LAUTER COFFEE,https://blog.naver.com/happieczar?Redirect=Log&logNo=222492258971,스웨이커피스테이션을 지나 언덕배기에 아슬하게 위치하고 있는 살짝 동네 분위기의 라우터 커피 아두루마리 메뉴판이라니 ㅋㅋㅋ 사장님은 욕심쟁이 역시 모를땐 물어보는게 상책 와이프는 에티오피아 
그간 <b>커피</b> 생활 (홈 카페, 오피스카페, 캠핑 <b>커피</b>),https://blog.naver.com/fantasistah?Redirect=Log&logNo=222483737982,매일 마시는 커피 포스팅입니다 요새는 바쁘기도 하고 여러 상황이 안 좋다 보니 카페 방문을 하지는 못했어요 다만 그래도 저는 어디선가 열심히 커피를 마시고 있습니다 캠핑 가서도 빠질 수 없죠 저녁에 
베트남 5. 달랏 택시투어 랑비엔 / 손호아 / 메린<b>커피</b>농장,https://blog.naver.com/maycca?Redirect=Log&logNo=222489572763,액티비티 꽃정원 야시장 메린커피농장 등으로 정해져있고 간혹 전세기가 뜰 때는 골프를 치러오는 차와 커피문화가 발달해있달까 거리의 카페테리아에서 차문화를 즐기는 모습이 인상적이었다 이런게 
이번 추석에는 <b>커피</b>아르케 더치<b>커피</b>선물세트로 준비하세요,https://blog.naver.com/yel_1004?Redirect=Log&logNo=222491823610,따뜻한 커피 한잔 마시면서 시간을 보내곤 합니다 데크위에 떨어지는 빗소리에 귀를 기울이다보면 아무런 잡생각이 들지 않아서 좋더라고요 언제부턴가 매일 한잔씩 커피를 마시게 되었어요 처음에는 
부전 카페 - Know coffee espresso 노우 <b>커피</b> 에스프레소,https://blog.naver.com/wnsw77?Redirect=Log&logNo=222466972932,월 일 가오픈       이탈리안 스타일 에스프레소 바 아는 오빠가 운영하는 아는 커피  커피는 먹다가  정도 남았을 때 설탕을 넣어 섞어 먹으면 기분 좋은 마무리가 될 수 있다 
모카포트 사용법 카페라테 만들기(Ft. 드롱기 <b>커피</b>그라인더),https://blog.naver.com/kh750?Redirect=Log&logNo=222491405846,드롱기 커피그라인더 집에서 홈카페 를 즐기는 커피사랑경화 보통은 드립커피 로 내려서 마시거나 캡슐커피 를 마시거나 요즘은 편하게 콜드브루 로 마시고 있지만 신랑이 드롱기 커피그라인더 를 사 
핸드드립 <b>커피</b>:: <b>커피</b> 드립 전기포트 추가 -- <b>커피</b> 취향이 점점... ,https://blog.naver.com/artofgolf?Redirect=Log&logNo=222497714965,핸드드립 커피를 시작한 이후 지금까지 이 드립포트를 사용해 왔습니다 드립포트 이 드립포트에 정수기에서 뜨거운 물을 받아서 커피를 내려먹었습니다 드립커피 커피드리퍼에 일정하게 뜨거운 물을 
[제주 월평동] <b>커피</b>템플 | coffeetemple,https://blog.naver.com/3345?Redirect=Log&logNo=222485424546,한국에서 손꼽히는 바리스타가 제주에서 운영하는 카페 커피템플 |  년도 월드바리스타챔피언쉽에서 대한민국 대표로 출전했다고 하는 커피 경력 년의 김사홍 바리스타가 년 초 제주시 
<b>커피</b>빈해피모닝 아침으로 든든해요,https://blog.naver.com/sohwa91?Redirect=Log&logNo=222484975484,같은 커피빈해피모닝 서비스를 소개해볼까해요 그럼 리뷰시작해볼게용 커피빈해피모닝 서비스는 매장오픈시간부터 오전시까지 음료와 커피빈크루와상 제품을 구매하시면 크루와상을 할인된 가격에 
에스프레소머신 다 갖춘 <b>커피</b>머신 에스토 올인원,https://blog.naver.com/everything91?Redirect=Log&logNo=222492076897,에스프레소머신 다 갖춘 커피머신 에스토 올인원     요즘 커피가 발전하는 시대의 흐름을 잘 탄 기능도 디자인도 예쁜 커피머신이에요 커피머신 크기가 작고 가볍고요 사용방법이 간편하고요 
착한 가격의 화곡동 매머드<b>커피</b> 익스프레스 꿀라떼와 아메리카노,https://blog.naver.com/asdffggg2?Redirect=Log&logNo=222464737113,착한 가격의 화곡동 매머드커피 익스프레스 꿀라떼와 아메리카노 집 근처에 오픈한 매머드익스프레스 커피에요 사이즈 아메리카노가 원으로 매우 매우 착한 가격의 카페라 자주 애용할 것 같아서 오픈 
구담 <b>커피</b>베이, (정코다리 건물),https://blog.naver.com/andongdek927?Redirect=Log&logNo=222480544981,왼쪽 흰건물이 코다리집이고 이 건물이 다 커피베이 인줄 알았는데 거긴 가정집이고 층 식당 층 아기의자는 없음 아메는 다른 커피베이보다 비쌌다 원인 곳도 있는데 여긴 원 낙동강뷰 
페루 <b>커피</b>, 엘모리토 핸드드립으로 원두<b>커피</b> 마시기,https://blog.naver.com/minkknim?Redirect=Log&logNo=222488681462,살짝은 허전하고 살짝은 여유로워서 이런 날 커피를 안 마시면 언제 마시겠냐며 맛있는 커피를 마시기로 했어요 오늘은 유난히 페루 커피가 땡기는 날이라 엘모리토를 마실까 게이샤 커피를 마실까 살짝 
<b>커피</b> : 폴 바셋 드립백 바리스타 파우치 시그니처... ,https://blog.naver.com/rachel0507?Redirect=Log&logNo=222500390933,커피  폴 바셋 드립백 바리스타 파우치 시그니처 블렌드         에스프레소 종류나 캡슐커피 타입을 제일 좋아하지만 가끔은 핸드드립이 그리울 때가 있다 그래서 그냥 
디카페인 드립백으로 오후에도 맛있고 풍부한 <b>커피</b>타임 ~,https://blog.naver.com/minyoung__e?Redirect=Log&logNo=222490013637,개인적으로 커피를 너무 좋아하는 인 카페인중독일지도 모를 매일 잔은 기본인듯한데 저녁시간에 그래서 요런 타임에는 디카페인커피가 낫더라고요 게다가 초딩님은 커피를 잘 못마시는 스타일인데 
가을의 시작 대바늘 뜨개질 &amp; 뜨거운 <b>커피</b>♡,https://blog.naver.com/banyson?Redirect=Log&logNo=222490277600,저는 가을이 되면 따듯한 커피가 제일 먼저 생각나고 두번째는 뜨개질이 생각납니다  대바늘 뜨개질은 집에 오면 비교 후기 남겨볼께요 지난주만 해도 시원한 아이스커피가 그렇게 좋더니 계절의 
아산 신정호 노커베이커리 논밭 앞에서 <b>커피</b>,https://blog.naver.com/hhhjjroo?Redirect=Log&logNo=222490198985,커피는 취향에 맞게 골라 마실 수 있다 우리 부부는 산미가 적고 쌉싸름한 맛이 강한 맛으로 상하목장 냉장보관 티라미수나 라떼도 있었고 상하목장 아이스크림에 커피를 얹은 메뉴도 있었다 그리고 
프리랜서 필수품 #<b>커피</b>드립백추천 #플뤀더<b>커피</b> #내돈내산,https://blog.naver.com/slamorange?Redirect=Log&logNo=222495188841,안녕하세요 러빗입니다  얼마전에 구매해 본 드립백 커피 맛있는거 많은 사람 알게해주세요 하고 쓰는 포스팅입니다 저는 커피를 좋아해서 집에서 마실 수 있는 방안을 늘 다방면으로 궁리합니다 한 때 
양양여행 / 카페 바다뷰 제빵소 / 맛난 빵과 <b>커피</b>와 차 / 후진항... ,https://blog.naver.com/smile7929?Redirect=Log&logNo=222505521300,바다뷰제빵소라 해서 빵과 커피를 판매하는 곳이겠거니 생각하면서 지나쳐 가곤 했다 지난 월말경 자매 셋이 떠나온 동해안 여행에서 한번 들려 보았다 빵도 맛나고 커피도 맛있고 바다뷰가 너무 좋아 오늘은 
디카페인 원두 추천 임산부 <b>커피</b>로도 좋은 브라운체리,https://blog.naver.com/supia2728?Redirect=Log&logNo=222490679145,커피를 너무 너무 좋아하지만 오후에 마시면 잠을 통 못자서 안마시려고 노력했는데 요즘은 디카페인 커피를 어디서든 구하기 쉬워 오후에도 커피를 즐길 수 있게 되었어요 브라운체리 커피체리의 씨앗이 갖고 
에이<b>커피</b> - 부암동, 서울시,https://blog.naver.com/sso_long?Redirect=Log&logNo=222490677259,에이 커피에 들러모두 테이크 아웃으로 사서 집으로 돌아가는 길은 언제나 룰루랄라ㅋ 계열사에서 골목길로 조금만 걸어 들어오면 에이커피이다 계단이 예쁜 곳 테이크아웃으로 따뜻한 커피를 사고 캔으로 
일산 호수공원 카페, 올댓<b>커피</b> 에스프레소 바 (  ),https://blog.naver.com/leesaelom?Redirect=Log&logNo=222488690847,올댓커피 에스프레소바  일산카페 가로수길 호수공원 안녕하세요 로미예요  일산에서 제가 좋아하는 카페가 몇 군데가 있는데요 그 중에서 재방문이 가장 많았던 곳은 올댓커피예요 일산 본점 
오송 카페 [우쥬라이크<b>커피</b>(Wouldulike)] 방문후기,https://blog.naver.com/pjm0509?Redirect=Log&logNo=222481670923,오늘도 커피숍 방문 후 후기를 들고 왔는데요 비교적 최근에 생긴 카페이고 이색적인 아이스 캔커피 를 볼 수 있는 곳 모두 아실만한 카페 우쥬라이크커피  입니다 ㅎ 위치 외관 전화번호  
부천 컴포즈<b>커피</b>창업 양도양수 추천,https://blog.naver.com/jknew1?Redirect=Log&logNo=222482584879,부천 컴포즈커피창업 양도양수 추천드립니다 작년에 이어 올 상반기에도 폭발적인 확장세를 보여주고 있는 컴포즈커피 입니다 어느덧 호점을 넘어서며 웬만한 주요상권에 입점이 되어 있음에도 여전히 
8.20 대전 2 _ 장태산 &lt;<b>커피</b>인터뷰&gt;,https://blog.naver.com/jean7457?Redirect=Log&logNo=222480065130,커피인터뷰   입구 쪽 전경 나무 질감과 색감이 아기자기한 느낌이다 안으로 들어가면 가을에 와서 바깥 풍경 바라보며 커피 마시면 좋을 것 같다 장태산휴양림 입구엔 이렇다 할 카페나 
베란다 식물/<b>커피</b>나무 키우기 - 곁줄기,가지치기,https://blog.naver.com/el512?Redirect=Log&logNo=222452667471,베란다 식물커피나무 키우기  곁줄기가지치기 저희 집 베란다정원에는 커피나무 하나가 자라고 있었더랬죠 이웃님께서 커피체리를 나눔해주신 덕분에 키우게 된 아이지요  커피나무 성장 꽃대 새잎 그 
우리동네 <b>커피</b>집 사장님,https://blog.naver.com/cafemori?Redirect=Log&logNo=222496579213,동네 커피집에 가끔 간다 지난 주말에는 외출 하면서 잠깐 들러 커피를 샀다 따듯한 아메리카노 하나 라떼 하나 주세요 했더니 나를 보고 이제 아이스는 많이들 안찾으시네 하신다 계절이 바뀌었으니까요 
오프플러스<b>커피</b> : 한적하고 <b>커피</b>가 맛있는 세종카페,https://blog.naver.com/heo1028?Redirect=Log&logNo=222488226748,세종카페  오프플러스커피 안녕하세요 저는 뽀오 동생입니다 처음으로 포스팅해서 넘넘 떨리기도 세종카페  오프플러스커피 코로나로 야외 카페에 가고 싶어 무한검색하다가 갔더니 사람이 
부암동 카페 <b>커피</b>파운드,https://blog.naver.com/lucy038?Redirect=Log&logNo=222484876969,부암동 카페 커피파운드 바로 앞 한 두대 주차 가능 각국의 유명 스페셜티 로스팅 원두를 수입 유통하던 회사에서 직접 운영하는 쇼룸이자 카페인 커피파운드 장충점구약수점을 시작으로 부암동에 호점을 
맛있는 로스팅 원두 쇼핑몰 추천 ː 커퓸<b>커피</b> / 파스텔 블루... ,https://blog.naver.com/921yh?Redirect=Log&logNo=222500896311,커피를 자주 마시긴 했지만 직장이 카페니까 그냥 집에서는 대충 내려마셨었는데 요즘들어 왠지 제대로 차려놓고 먹고 싶어짐ㅋㅋㅋ 그래서 오늘 리뷰할 제품은 홈카페 원두로 제격인 원두 쇼핑몰 커퓸커피 
오후 4시의 꽈배기와 팥도너츠 <b>커피</b>타임,https://blog.naver.com/ppsus?Redirect=Log&logNo=222482432343,이런 날 센스있는 선물 감사합니다 커피 내려서 오후의 간식 블랙커피와 달달한 꽈배기와 팥도너츠는 두말이 필요없지요 커피엔 도넛 대신 커피엔 꽈배기ㅋ 우유와도 꿀조합인 건 다 아시죠 겉은 
<b>커피</b>머신엔지니어 136기 마스터반 자격증수업,https://blog.naver.com/sfantera?Redirect=Log&logNo=222491318218,안녕하세요 한국 커피머신산업연구원 차기동 입니다 기 커피머신엔지니어교육을 진행 하였습니다 어려운경기이지만 그래도 이번 사장님은 큰 결단을 내리셨습니다 좋아하는 커피와 함께 
&lt;강아지와 부암동 카페&gt; 환기미술관 x 에이<b>커피</b> 서울,https://blog.naver.com/eunkaren?Redirect=Log&logNo=222484549852,에이커피 서울  주차는 매장 앞에 두대 정도 가능 요렇게 운치있는 계단을 올라가면  작지 않은 규모의 에이커피서울 카페 등장 꺾여져있는 직사각형 구조로 길쭉하면서 좀 특이한 형태였다 
대구 앞산 카페 | 플러시<b>커피</b>스탠드,https://blog.naver.com/alswl20622?Redirect=Log&logNo=222482274108,플러시 커피스탠드 대구 남구 큰골길  층 플러시커피스탠드 대명동  화일   월요일 휴무       앞산 큰골집 앞에 새로 생긴 카페에 다녀왔어요 월에 
영덕카페 오션뷰가 예뻤던 무브온<b>커피</b> 다녀왔어요 (feat.흐린날),https://blog.naver.com/jyk_94?Redirect=Log&logNo=222492209905,오션뷰가 예쁜 영덕 카페 무브온커피    영업시간  매일    무브온커피는 영덕 풍력발전소 가는 해안도로에 위치한 오션뷰카페에요 저희 부부도 영덕 여행 중 풍력발전소 구경하러 가기 전 
서울 문래창작촌 산책과 카페 스멜팅<b>커피</b>,https://blog.naver.com/fromrei8?Redirect=Log&logNo=222491128656,서울 산책 문래창작촌 카페 스멜팅커피 비슷한 일상에 아주 살짝 양념을 쳐볼까 싶어서 종종 들리게 보통 맛있는 커피를 마시러 가자고 하면 잔말없이 따라나서는 남편과 걷는다 커피를 마시러 가자더니 
<b>커피</b> 끊기 1년째, 생활의 변화.,https://blog.naver.com/leesh2519?Redirect=Log&logNo=222483622627,커피를 끊은지 년이 다되어간다 아침에 아이스아메리카노가 아닌 따뜻한 티로 시작하는 이제는 익숙한 풍경이다 한 년정도 커피를 열심히 마셔왔던 것 같다 에스프레소도 가끔씩 마셨고 샷 추가 하시는게 
<b>커피</b>가게 히토릿코 at 우리동네,https://blog.naver.com/sky-ps?Redirect=Log&logNo=222483641930,와보는 커피가게 히토릿코 창문메뉴에 모카 브라질 과테말라 만데린 콜롬비아 써있어서 저렇게 커피만 종류 파는줄 알았었다 어정쩡한 오후시지만 다행히 영업중이다 대 후반으로 보이는 할배와 할매가 
홈메이드아이스크림:<b>커피</b>카라멜&amp;더블딸기아이스크림 만들기,https://blog.naver.com/jeehsong?Redirect=Log&logNo=222455443494,특히 커피카라멜아이스크림은 마치 스벅의 카라멜프라푸치노를 떠올리는 맛이라니저도 다시 한번 먹어보고 싶어졌어요 그냥 스벅 가야 겠지요 홈메이드아이스크림 커피카라멜아이스크림 
잠실 카페 맛집 마호가니<b>커피</b> 케이크 포장,https://blog.naver.com/dlrhdmssla?Redirect=Log&logNo=222487904689,맛있는 케이크를 포장하기 위해 방문한 잠실 카페 맛집 마호가니커피 커피도 베이커리도 맛있지만 케이크도 짱맛있는 잠실역 맛집이다 ㅎㅎ 잠실 홈플러스 층에 위치한 마호가니커피 잠실역 카페 커피에 
용산 오츠<b>커피</b> 솔직 후기 | 서울 3대 아인슈페너 맛집,https://blog.naver.com/a_m_a_z_jung?Redirect=Log&logNo=222489919500,오늘은 인스타그램에서 아주 핫한 카페 용산 오츠커피 방문 후기와 함께 찾아왔어요 용산 오츠커피 용산 오츠커피는 인스타그램 계정 팔로워 수만 여명에 이를 만큼 요즘 꽤 핫한 카페에요 서울 대 
<b>커피</b>마스터의 조용한 아지트같은 카페 : 용인 양지면 흥남<b>커피</b>... ,https://blog.naver.com/p_sophia?Redirect=Log&logNo=222495785091,이번에는 맛으로 승부하고 있는 카페를 소개해드릴게요 흥남커피 경기 용인시 처인구 양지면 상호명이 흥남커피인 이유도 나와있네요 각종 자격증도 벽에 가득해요 정말 커피 마스터 느낌 
네스프레소 캡슐<b>커피</b> 리미티드 에디션으로 이탈리아 여행,https://blog.naver.com/jenny8428?Redirect=Log&logNo=222493800121,저도 집에 있는 날에는 무조건 커피와 함께하는데 네스프레소 오리지널 커피머신 유저들을 위해 리미티드 에디션 캡슐 커피가 출시되었어요 제가 사용 중인 커피 머신은 네스프레소 에센자 미니 화이트에요 
제주 시청 카페 라토<b>커피</b> 주택개조 카페,https://blog.naver.com/armanino2?Redirect=Log&logNo=222447243550,    지인 볼일 볼 동안 잠시 제주 시청 근처 카페에서 시간을 보냈는데 검색해보니 라토커피라는 주택을 개조한 카페가 있어서 방문해봤어요 청주 시내에도 라토 커피 라고 같은 이름의 주택 개조 
제주 동문시장 카페:: 윤재<b>커피</b>⭐️ 엄마표 기름떡 필수! <b>커피</b>... ,https://blog.naver.com/shjce93?Redirect=Log&logNo=222498602056,워낙 한옥 컨셉을 좋아해서 한옥 느낌이 묻어나는 동문시장 근처 윤재커피 고고 윤재커피는 음 막 인스타 감성 카페라기 보다는 뭔가 파주 프로방스 느낌의 카페였다 요 마당에는 그리고 이런 푸르댕댕한 
의령 신반 카페, <b>커피</b>가 맛있는 비전트리,https://blog.naver.com/uiryeonginfo?Redirect=Log&logNo=222483842019,의령 신반 카페 커피가 맛있는 비전트리 의령군 블로그 기자단 전수현 신반 나들이를 나섰다가 시원한 모든 커피는 기본 투 샷이며 연하게 먹고 싶다면 따로 요청하면 될 것 같습니다 기본 커피 종류도 
[블랙코드<b>커피</b>] 디카페인 원두 드립백, 임산부<b>커피</b> 아르보르,https://blog.naver.com/cozydarkness?Redirect=Log&logNo=222491699770,디카페인 원드 드립백 선물세트 블랙코드 커피 커피를 좋아해서 하루에도 몇 잔씩 마시는데 요즘은 코로나로 카페도 자주 못가지요 그래서 아쉬운대로 에스프레소 머신을 사서 원두를 직접 내려 먹기도 
O.P 티오피 심플리스무스 플라워 피니시 꽃향이 나는 편의점<b>커피</b>,https://blog.naver.com/frenchpopp?Redirect=Log&logNo=222495967045,전 정말 커피가 없으면 안 돼요 하루에 세잔은 기본 아침에 일어나면 가장 먼저 찾는 게 바로 커피예요 저처럼 눈을 뜨면 가장 먼저 커피타임부터 갖는 분들 진짜 많죠 집에 머신기가 있긴 하지만 커피를 내려 
• [홈카페] 스페셜티<b>커피</b> 드립백추천 [엘카페 로스터스 드립백... ,https://blog.naver.com/cha9212?Redirect=Log&logNo=222492917653,스페셜티커피의 지평을 열었다는 평가와 함께 엘카페의 이자 한국 대  심판관이라는 양진호 바리스타님의 유명세로도 소문난 곳이다     좋은 커피를 선별하는 가장 권위있는 
서울 여의도 데이트 코스, 진주집 서울<b>커피</b> 자매공원... ,https://blog.naver.com/fromrei8?Redirect=Log&logNo=222463981842,서울커피자매공원아이엠베이글 아마 콩국수가 먹고 싶다고 했던 것 같다 그 말의 꼬투리를 잡아 다가오는 주말 데이트 코스를 촤라라 펼쳐내었다 이런 건수를 놓칠 수 없지 콩국수 먹으러 간 김에 커피도 
아보카도 요리 전참시 세븐 아보카도 <b>커피</b> 만드는 법,https://blog.naver.com/ellymom81?Redirect=Log&logNo=222487764024,아보카도 커피 쉽고 맛있는 아보카도 요리 전참시 세븐 아보카도커피를 만들었다  아보카도와 커피의 페어링 아보카도는 부드러운 식감으로 커피는 아보카도의 느끼함을 살짝 잡아주는  커피는 취향에 
환한 아크릴조명 간판 <b>커피</b> 테이크아웃매장,https://blog.naver.com/opencrystal?Redirect=Log&logNo=222491526484,아크릴조명 간판 역사내 커피전문점 아크릴조명으로 된 간판은 주로 실내와 실외를 할 것 없이 많이 위의 커피전문점은 프랜차이즈로 운영되고 있는건 모두 알고계시지요 저도 출근 퇴근때 커피를 
빽다방 원조<b>커피</b> 카페인, 칼로리 후기,,,https://blog.naver.com/maize210?Redirect=Log&logNo=222485150979,원조커피 후기를 작성해보려고 해요 ㅋㅋㅋㅋㅋㅋㅋㅋㅋㅋㅋㅋㅋㅋㅋㅋ 모든 음료는 다 점바점이잖아요 특히 요 지점에서 마셨던 음료들은 하나같이 다 맛이 별로였는데ㅋㅋㅋ 원조커피도 역시나 맛이 
(완료) 피츠<b>커피</b> 오가닉 프렌치로스트 그라운드 <b>커피</b> 907g,https://blog.naver.com/emilymom0815?Redirect=Log&logNo=222468887387,피츠커피 오가닉 프렌치로스트 그라운드입니다 피츠커피는 미국 대커피중 하나로 손꼽히는 커피인데요 스타벅스나 커피빈처럼 매니아층 많은 커피 브랜드에요 저도 커피 좋아해서 하루 한 두잔은 꼭 
주말 힐링 명동 남산 둘래길 산책과 맛있는 <b>커피</b>,https://blog.naver.com/circusgirl1?Redirect=Log&logNo=222489240915,같은 커피 여기 이런 카페가 있어 싶었는데 골목 안쪽에 문을 연지도 모르겠던 카페 여긴 나만 알고싶다 예쁘고 커피가 솔직히 잔이 많이 작다 싶었는데 꼬수운 라떼맛에 일단 만족ㅋㅋㅋㅋ 결국 아메리카노 
동네 카페 나들이 : 빈티지 감성과 산 정상에서 맛보는 <b>커피</b> 한 잔,https://blog.naver.com/yangju619?Redirect=Log&logNo=222482781855,따뜻한 커피와 달달한 티라미수를 맛보며 서로의 안부도 묻고 창밖 풍경도 감상했어요 카페 포레엠 나뭇가지에 매달아 놓은 좋은 글귀들과 오래된 카메라들과 우크렐라 커피 원두 자루를 재활용해서 만든 
대전 유성 카페 <b>커피</b>인터뷰,https://blog.naver.com/babo890327?Redirect=Log&logNo=222485609298,충남대에서 차로 분 거리에 위치한 커피인터뷰라는 곳인데요 이미 유명해서 많은 분들이 알고 계실 것 같아요 대전에 사는 신랑 친구도 저희 대전왔다니까 커피인터뷰 가냐고 전화왔더라고요 커피인터뷰 
원주 카페 우밀타 <b>커피</b> 혁신도시 가게 되면 들리는...!,https://blog.naver.com/bloom12qw?Redirect=Log&logNo=222481536720,우밀타 커피 어느 날 친구랑 점심을 먹고자 무실동에서 만나 여기저기 다 휴무ㅎㅎ 휴무일이 아닌데 휴무 여름휴가 그래서 어쩌다 혁신도시까지 오게 된 날 ㅎㅎㅎ 그리고 또 다른 날은 우밀타 버터 커피 
편의점<b>커피</b> 추천 맥심 티오피 심플리스무스 플라워 피니시... ,https://blog.naver.com/jej7634?Redirect=Log&logNo=222495455539,제가 소문난 커피 덕후라는 것은  이미 많은 분들께서도 알고 계신 사실일 듯 합니다  허허 학생 때에는 커피 없이 어떻게 살았지   싶을 정도로 하루에 한 잔 이상은 꼭 마시는 것 같은데요 ㅋㅋ 그래서 
유명 식음료 프랜차이즈 대표 메가<b>커피</b> 인기비결,https://blog.naver.com/ksarangga?Redirect=Log&logNo=222402200529,하루 한잔은 꼭 커피를 사 먹게 되요 습관처럼 몸에 베인지라 하루라도 거르는 날이 있다면 공허한 이미 커피 또는 음료 애호가들 사이에서 가성비 진찐 브랜드로 인정을 받고 있는 메가커피가 바로 그 
[회현/남대문]가성비 최고_야호 <b>커피</b>,https://blog.naver.com/rosa9126?Redirect=Log&logNo=222489013859,이날은 좀 여유있는날이기도했고 커피가 먹고싶어 주문해보았어요 히익 스페셜티 아메리카노가  원이라구우 커피덕후는 무조건 로 갑니다 밑에 스페셜티 커피 인증서도 있더라구요 커피 
[ 메이저스 <b>커피</b> ] 문 라이트... 좋은 블렌딩 원두 <b>커피</b> 추천,https://blog.naver.com/dolmory9?Redirect=Log&logNo=222479918512, 메이저스 커피  문 라이트  지포백이 적용되어 소분해서 즐기기에 편리합니다  아로마 바디감 고소함과 단맛이 매력적인 블렌딩 원두 커피 추천  가격  원 원  재구입 의사 
