제목,링크,내용
온세상을 한껏 보듬다/ 밀양누리보듬장난감도서관 장난감대여,https://blog.naver.com/miryangsi?Redirect=Log&logNo=221476420960,구성품 뭐 하나 없다고 크게 불편하지 않던데 알뜰구매 하심 좋겠죠 누리보듬장난감도서관 된다니 불편한 걱정은 안하셔도 되어요 자 그럼 누리보듬장난감도서관에서 장난감대여는 어떻게 하면 
절대 배신하지 않는 돈의 습관 6번째 이야기 ●인스타... ,https://blog.naver.com/duddnr0729?Redirect=Log&logNo=222476473236,책 내용 나눔은 여기까지고 다음 문단부터는 돈 굴리기에 대한 얘기를 할 것이니 이후 내용은 없다는 불편한 진실은 아는지에 대해서 생각했다 국가는 우리를 여러 위험으로부터 보호하는 것은 사실이지만 
이민 생활에 힘이 되는 응원,https://blog.daum.net/19861207/12877233,미국은 운전면허증이 없으면 상당히 불편하다 멋모르고 시작한 이민생활 중 는 한국에서 생활을 배려하면 나눔을 실천하며 겸손하게 세상을 보고 행복하게 살겠다 평생 사랑하지 못하고 미워했던 
[현대자동차그룹기프트카] #2. 기프트카에 대해 알아보아요 ^^,https://blog.naver.com/perkyhm?Redirect=Log&logNo=70093585409,저 또한 몸은 불편하지만 다른 사람들보다 몇배 더 즐겁고 밝게 살아가는 아이들을 보며 입은 웃으면서 꿈 나눔에 동참할 수 있지요 캠페인 기간 동안 하루에 응원의 댓글이 개 이상이 달리면 꿈을 
은평구, 교통수요관리 평가 大賞 수상,https://blog.naver.com/cartvnews?Redirect=Log&logNo=221426337004,특히 역촌역 번 출구 나눔카 노상예약소 설치 및 주택가 주변 나눔카 차량 개소에 배치함으로써 은평구 내 개소 등 에서 주민들이 공유차량을 편리하게 이용할 수 있도록 노력했으며 교통 불편 
유휴공간 공유 통한 주민공동체 활성화 박차,https://blog.naver.com/spostnews?Redirect=Log&logNo=80209887524,물론 나눔과 배려의 가치를 확산했다는 점에서 관심이 높다 석관동 아파트에 거주하는 한 주민은 그동안 여러 체육동호회가 콩나물시루 같은 운동장을 이용하느라 불편한 점이 한둘이 아니었는데 새로 
5월 30일 부동산 블로그 글모음 (부동산&amp;재테크),https://blog.naver.com/mustang10004?Redirect=Log&logNo=222374611699,  나눔부자 님 블로그  집이 언제나 이긴다 에이드리안 킴  어우 돈이 좋다 태민 집을 보는게 불편한 김광규  
2박3일 부산여행:) 죽성드림성당, 오랑대공원 일출, 아수라... ,https://blog.naver.com/smilehaena?Redirect=Log&logNo=221510118067,해운대에서 치킨 받아왔는데 영 먹기 불편해서 결국 집으로 가지고 왔다ㅎㅎ 굿모닝  아침은 나가서 먹기로 역시 또 원래 가려했던 곳은 대기가 참으로도 길어 차선으로 뒀던 거루캥테이블 
[옥수13구역] 옥수13구역 대림이편한세상옥수 입주권매매에... ,https://blog.naver.com/forstock72?Redirect=Log&logNo=220039633980,옥수구역에서는 카 쉐어링 시스템인 나눔카 홍보가 있었는데 편리하다고 느끼면 많은 분들이 동참할 것이고 어딘가 불편하다면 사라지겠죠 옥수와 옥수을 비교할 때 한강조망이 있기 때문에 옥수가 
건대 빌리브인테라스 최고의입지,https://blog.naver.com/carcar0710?Redirect=Log&logNo=221579322699,지하 층에는 카쉐어링 주차공간이 대 제공되니까 나눔카를 지정했을 때 차량이 항시 대기하는 환경이고 이것도 마찬가지로 화양동 최초의 나눔카 지정 오피스텔이기 때문에 건대 주변 오피스텔의 혁신을 
카인드 캠핑카(캠카랜드) 별내점방문~,https://blog.naver.com/ancobang?Redirect=Log&logNo=221459557643,좀 불편해하셨네요 작년 월에 출고를 해서 첫겨울을 나면서 동파우려 때문에 월말에 남이섬 여행을 싱크대쪽에서 물이 좀 나오는가 싶더니 더이상 나오지를 않네요 물을 제대로 못써서 불편하긴했지만 
전역했습니다,https://blog.naver.com/2_hyunsu?Redirect=Log&logNo=222488059388,해서 같이 갔다 오랜만에 반가웠습니다 시티보이 코로나 끝나면 술 마시는 걸로 교통이 불편한 조각 나눔하고 갔습니다 나눠 먹을 수 있는 사람이 있다는 게 얼마나 기쁜지  나 도서관에 있다가 갑자기 
카세어링 피아트로 업그레이드~!!!!,https://blog.naver.com/uro4u2016?Redirect=Log&logNo=120209961499,쉽게얘기하면 나눔카 서비스에요 자신의 자동차가 없어도 마트갈때가 교통이 불편한 지역으로 가야할때 이용하면 편리한 카세어링 그럼 여기서 궁금증이 생기죠 렌트카랑 카세어링 차이가 뭘까요 
《사설구급차/ 응급차/들것/카서비스》허리골절환자분... ,https://blog.naver.com/qq8000qq?Redirect=Log&logNo=221622520710,거동이 불편하신 상태가 카로이동해 자택에서는 단독빌라 계단이 높아 들것으로해서 안전하게 연세나눔정신 자뼈 골절 전주 엠블런스 열린병원 비용 정읍 요양병원 후기 정형외과 서울대 고대 세브란스 
젠틀맨 워크인 스위치, 코딩 <b>나눔</b> 창원 김해 부산 양산 울산,https://blog.naver.com/polo877?Redirect=Log&logNo=221676567542,영상 확인 방법이 불편하고 화질이 만족스럽지 못 하셔서 파인뷰  블랙박스로 교체하시러 오셨습니다 평소 주차 녹화를 사용하지 않으셔서 보조 배터리 없이 주행 녹화로 설치를 해드렸습니다 주행 
건대 빌리브인테라스 오피스텔 주목받는 이유는?,https://blog.naver.com/anckra90d?Redirect=Log&logNo=221597247598,아무리 교통이 좋아도 집 근처에 도보로 이용할수 있는 시설이 없다면 조금은 불편함이 생기는게 화양동 일원에서 최초로 나눔카 지정 오피스텔로 예정이 되어 있기 때문에 월등한 가치를 선보일 예정입니다 
i30 레자시트 교체,https://blog.naver.com/lhbakh?Redirect=Log&logNo=220558472744, 그래서 부득이하게 나눔을 신청했고 당첨됐고 가지러 가야했기 때문이다 쿠션감도 좋고 운전하실 때 불편함도 없다 오래되고 낡은 시트를 새 시트로 교체 했을 뿐인데 차 안은 
[썬양부부 캠핑기록] -  부여 진달래 관광농원에서 레트로스... ,https://blog.naver.com/seon_1024?Redirect=Log&logNo=222500145456,큰 불편함은 없었던 것 같아요 개수대는 샤워실과 화장실이 있는 건물 내에 있었는데 뜨거운 물도 잘 옆 사이트 이웃분들과 나눔 경험은 처음이었는데 정말 감사하더라구요  맛있게 잘 먹었습니다 
2019. 8. 9 이웃블로거님과의 만남,https://blog.naver.com/jisu1405?Redirect=Log&logNo=221617619118,다행스럽게도 시트포지션이 나하고 딱 맞아서 운전하는데는 불편함이 없었다 대구미술관으로 이동했을때 블로거님 차량 뒤따라 가는데 따라잡질 못했는데 차를 바꿔타고 이동을 하는데 내가 내차를 못잡는 
서울시 강북 균형발전 정책구상 발표,서울시 균형발전 주요사업... ,https://blog.daum.net/sungsu_factory/3561,비 강남권역 주택가 밀집지역의 핵심 생활불편 중 하나인 주차공간 부족 문제 해결에도 나선다  공유차량인  나눔카  시대를 강북부터 전면적으로 열어서 자가용이 필요 없는 라이프스타일을 
[쌍둥이 육아 일기] 생후 631~647일, 교정 581~597일... ,https://blog.naver.com/spring921?Redirect=Log&logNo=222172210879,국물까지 마시고 나면 카하고 시원한 소리를 내뱉는다 잘 먹고 소화 잘 시키고 쑥쑥 크렴 국 국에 위통약은 내 일상의 필수품 노랫말처럼 속이 불편한 날이 많아 위염약을 끼고 산다 마음 편히 온전한 
전기차 셰어링 서비스 본격 시행!,https://blog.naver.com/cartvnews?Redirect=Log&logNo=10168069319,지난 월부터 일반 승용차를 공동으로 이용하는 나눔카 서비스를 실시해 온 서울시는 이번에 전기차로 전기차 카 셰어링 서비스 앞으로 대중화되기 위해서는 짧은 주행거리와 충전으로 인한 불편함이 해결 
[정보] 공유차량 서비스, 딜카! 이용할만 하네^^,https://blog.naver.com/rglee0610?Redirect=Log&logNo=221396071161,당일 시간 전에 전화한통 띡 걸어서는 통화가 안되면 일방적으로 예약을 취소하는 이런 말도 안되는 시스템이 고객들의 불편을 초래하고 있음을 이미 알고 있다고는 하면서도 본사 담당자가 대응하는 태도로 
[후원자명단]  2016년 이전 푸른나무재단 해피빈 모금함... ,https://blog.naver.com/bakbht?Redirect=Log&logNo=221764228603,푸른나무재단에 보내주시는 지속적인 사랑과 관심에 진심으로 감사드립니다 후원금은 자라나는 청소년들에게 폭력없는 안전한 학교생활과 꿈을 펼칠 수 있는 기회를 선물하는데 
롯데렌탈, 장애아동 이동보조기구 지원! 친환경 기부 드라이빙... ,https://blog.naver.com/lotte-rentacar?Redirect=Log&logNo=221414210047,하는 나눔이라는 슬로건 아래 사회적 교통약자인 장애아동을 지속적으로 지원하며 사회적 책임을 실천하고 있는데요 이동이 불편한 장애아동 가정의 가족 여행을 지원하는 편한 동행을 비롯해 지난 
차박 돈 없어도 가능!  저렴하게 차박을 즐겨요~,https://blog.naver.com/mirsanup?Redirect=Log&logNo=222428825972,직접 만들거나  나눔받아 차박에 필요한것들을 준비하기 시작했답니다 지금은 많이 바뀌었지만 처음 크다보니 불편해서 합판으로 직접 제작했어요 미송합판  한장  구조목 개  두께    피아노경첩 
은평구, 교통수요관리 대상(1위) 선정…연말 14억여원 획득,https://blog.naver.com/seouldesks?Redirect=Log&logNo=221172905981,중심으로 나눔카 차량 대 추가 배치 대중교통 친절 서비스 향상을 위한 대중교통 브랜드화 등에 행정력을 집중했다 또한 교통 불편 민원해소를 위한 마을버스 시내버스 노선 조정 등 승용차 이용 
22th camping - 영덕 칠보산 오토캠핑장.,https://blog.naver.com/cky0248?Redirect=Log&logNo=220970882264,급하게 뭐 사러 나가기에 번거롭고 불편한건 있지만 산속에 한적하게 있는 기분이 캠핑하는 맛 둘이 낮잠타임이 달라서 오랜만에 만났지만 여유있는 대화는 못나눔 애기들 저녁도 준비하구요 수제 
[부내 언니 톡] &quot;시어머니가 사준 7억 짜리 아파트가 16억 됐어요&quot;,https://blog.naver.com/sum-lab?Redirect=Log&logNo=221671820406,불편한데 그게 지금은 억 원이 됐네요 물론 좋아요 하지만 시어머니가 바로 옆 아파트에 사세요 퇴근하면 시어머니댁으로 직행해야 합니다 주말도 거의 시어머니와 함께 보내고요 그 점은 좀 불편합니 
중국심천민박+사랑, <b>나눔</b> 성장을 실천하는 할빈시... ,https://blog.naver.com/sz4947?Redirect=Log&logNo=220717703840,사랑 나눔 성장을 실천하는 할빈시 은방울예술단 할빈시조선족녀성친목회은방울예술단 사랑 나눔 이날 공연은 리옥순세 진혜숙세등 어머니가 불편한 몸임에도 불구하고 단원들의 부축을 받으며 
◈ 울산웨딩·울산결혼 ◈ 울산 ‘결혼<b>나눔</b>을 실천하는... ,https://blog.naver.com/whqhdwp68?Redirect=Log&logNo=40109302872,몸이 불편해 결혼식을 올리지 못한 다문화 가정 동거부부나 장애인 동거부부들의 사연을 신청 받아 지난해 말 울산지역의 웨딩관련 업체들로 구성된 국내 첫 결혼봉사단체인 결혼나눔을 실천하는 
[추천앱] 공유경제 앱 추천 (쏘카,티클,헬로마켓),https://blog.naver.com/nvappstore?Redirect=Log&logNo=50188503741,내 소유가 아닌 누군가와 공유하는 차를 운전한다는 건 누구에게나 불편하고 꺼려질 수 있습니다  티클 카풀 카풀  티클  개발자 소셜나눔 분류 라이프스타일 상세보기 카풀서비스 티클 
사진으로 보는 광주 양림동 펭귄마을 나들이,https://blog.naver.com/yunyomee?Redirect=Log&logNo=221273477608,여년 전 호남 최초로 서양 근대 문물을 받아들인 통로이자 희생과 나눔의 공동체 역사를 태동시킨 하지만 광주 관광 홈페이지오매광주에는 무릎이 불편한 어르신이 뒤뚱뒤뚱 걷는 모습이 펭귄 같다고 
리얼 서핑마니아의 레이 루프렉+캠핑카+커스텀캐리어... ,https://blog.naver.com/jangkijacom?Redirect=Log&logNo=220131364540,자신의 불편함을 풀기 위해 나에게 미팅을 요청했다 그는 기존 툴레 제품을 사용했던 클라이언트였다 매우 바람직하며 박수를 받을만한 재능 나눔이다 클라이언트는 커스텀 가치를 높이 평가했다 
겨울냄새,https://blog.naver.com/plyoum?Redirect=Log&logNo=222462869507,나눔해야 할까 싶을 정도 이번 식재료 비우면 어글리 채소들 받으려고 했는데 그리고 두부유부초밥 할 말은 아니지만 렌즈에 익숙해져 보려고 원데이를 제법 대용량으로 구매했는데 눈이 뻑뻑하고 불편해 
스물 일곱번째 방주이야기 (2020.07),https://blog.naver.com/ckghpark?Redirect=Log&logNo=222048024761,이동이 불편한 가족들은 저희가 방문을 하여 위로하며 만남을 지속하고 있습니다 감사한 것은 모임이 사역나눔 월까지는 지속되는 정부의 통제와 집회금지등으로 교회와 가정에 머무는 것이 저희가 할 
'가입부터 운전까지 원스톱' ....공유경제 아이콘  '쏘카... ,https://blog.naver.com/hkc6633?Redirect=Log&logNo=221052519187,다행히 네비게이션이 자주 사용해 왔던 맵이라 사용하는 데 전혀 불편함은 없었다 차량의 전반적인 후면의 나눔카 표시는 쏘카가 서울시 카셰어링 사업자임을 나타낸다  시사오늘 권희정 기자 주행 
13.07.23 공유경제, 그것이 알고싶다.,https://blog.naver.com/borabomb?Redirect=Log&logNo=120195101993,되는 나눔카 등은 숨겨져 있던 우리 욕망의 새로운 출구가 되어 준 것이다 나는 서울에서 나고 자란 하지만 이런 나도 사실 불편했던 적이 있는데 그 것은 미국에서의 여행이었다 사실 나의 경우 패키지 
02.10- 예비차를 만나다,https://blog.naver.com/pinkpiggy13?Redirect=Log&logNo=221820431760,불편해서 맨 뒷자리에 주로 앉는답니다 시트 사실상 종점인 월드컵파크단지에 내립니다 월드컵파크단지는 내리는 사람이 거의 없기 때문이죠 그리고  폰트가 서울 버스 중 유일하게 나눔고딕 
군산 목사님 노트북2대, 배그용으로 업글 때문에 250km 또... ,https://blog.naver.com/zxcvnm13k?Redirect=Log&logNo=221784417289,지식나눔임 이 노트북은 어디서 구했는데 하드가 없다고 한다 그래서 사용을 못하고 있는데 이 선을 측면판 반대쪽으로 넘겨서 타이로 묶어 놨으면 나 역시 불편했던 작업임 사용자는 선이 어떤 건 
씨티카(City Car) 반납시 주차 문제,https://blog.naver.com/fass777?Redirect=Log&logNo=140202846038,나름 좋은 의미에서 나눔카를 사용하지만 이런 일로 내 시간과 노력을 더 써야 하는 것은 유쾌한 일은 아니다 하지만 이런 불편함에도 분명 나눔카는 꼭 필요하고 활성화 되어야 할 문화 중에 하나이다
쌍문동 청년주택 현장 다녀왔어요,https://blog.naver.com/mintsarang1977?Redirect=Log&logNo=222002762327, 주차대수 나눔카  포함 대 가능  합니다 쌍문동 청년주택 쌍문역 부근 현장 모습입니다  쌍문역 지하철도 빨리 오고 출근을 한다거나 외출을 할 때 큰 불편함은 없을 것 같다는 생각이 들었습니다 
쎄트메뉴 가족의 황금 연휴 기록~,https://blog.naver.com/jmstenis2?Redirect=Log&logNo=221001093969,방문시도를 나눔에 횐님들 많이들 나가시던데 사실 오프라인으로 뵌 분들이 없어서 방문하기 애매하고 길벗님과 똑같은 혈액형이기에몸도 불편하고 애마는 기약도없고 잠시 방문이지만 하늘은 
영등포구, 30일까지 구정발전에 도움되는 ‘공유’아이디어 공모,https://blog.naver.com/seouldesks?Redirect=Log&logNo=221024248870,공모분야는 주차장 공유 나눔카카셰어링 아이용품 공유 학교 내 공유 기타 공유 일반 속 불편함을 해소할 수 있다는 점이 핵심이다며 주민 여러분의 참신한 아이디어가 더 나은 영등포로 
마케팅스페셜:코너스톤브릿지, 美 타임스퀘어 등장,https://blog.naver.com/cornerstonebridge?Redirect=Log&logNo=221575693714,국토부는 버스회사의 직원 채용을 지원해 시민 불편을 최소화하겠다는 입장이다 하지만 버스회사 서울시 나눔카 년까지 만대로 확대 예정 서울시가 년까지 승용차 공동 이용 서비스 나눔카를 
유품정리업체 폐기처리비용 착하네요,https://blog.naver.com/elikqinx9?Redirect=Log&logNo=222451110943,모두다정리의 대표는 희망나눔협의회라고 하는 곳의 후원이사로 활동하며 독거노인과 일반인 촌맺기 이런 불편하고 어려운 점을 누구보다 잘 알아서 시간 친절상담이 가능하고 견적에 대해서도 별도의 
[월간 이주용 2월],https://blog.naver.com/kuribeat?Redirect=Log&logNo=221829900200,정보와 카 라이프를 공유하는 것 평소에 당첨운 없기로 소문났는데 운좋게 상품을 많이 받았다 커피 같은 나눔을 실천할 수 있기를 가난이 진짜 무서운 이유는 삶의 불편함이 아니다 꿈을 없애거나 꿈을 
경산카페추천 뷰맛집 프로다카페 이렇게 넓고 깨끗할수가,https://blog.naver.com/poo1888?Redirect=Log&logNo=222301820452,사진으로 표현이 안되어서 그렇지 완전 열정적이심 먹고 있는데 저러면 불편하다 하는 분들도 있는데 주민들께 나눔 했습니다 다요트 중이라 눈물을 머금고 치팅데이가 되면 다시 가서 먹어볼게욥 
동남아골프 / 태국 가성비골프장, 장박골프장 &quot;사왕C.C&quot;,https://blog.naver.com/rbtrainbow?Redirect=Log&logNo=221803484385,한국인 매니저분이 상주하고 있어 현지에서 불편함을 덜어드립니다     사왕는 근처 분거리에 바다도 있고 시간 거리에는 후아힌 관광지도 있기 때문에 하루정도는 관광일정을 
스포티지r 안드로이드 네비매립 후방카메라 부산 장착 전문점... ,https://blog.naver.com/yi4435?Redirect=Log&logNo=222459477518,너무나도 불편함 때문에 휴가 중 시공 받으셨습니다 아무리 휴대폰 스마트폰 좋아 졌다고 하여도 데이터 나눔 유심 카드 발급 후 사용 하시면 아주 편리합니다 그리고  포트 역시 개 까지 확장 가능한 
평창 용골송어횟집에서 동해안 지경해수욕장까지~4박5일간의... ,https://blog.naver.com/rpdla883?Redirect=Log&logNo=60110951582,약간은 불편했을텐데 다행이다 우리가 자리잡은 곳에 수도꼭지한개 화장실은 공용으로 남여 각  관리하는분들과 한잔씩 정도 나눔하고 이렇게 낯선곳에서도 한잔씩 오고가다보면 금방 형님아우가 
세계가 열광하는 `신개념 셰어링` 한국만 과거 잣대로 규제,https://blog.daum.net/thfqlc6101/15263,지난해 서울시 나눔카 사업은 차량 대당 하루 평균 이용자가 명에 그쳤다 이용자는 서울시가 지정한 개 지점에서만 차를 빌릴 수 있고 빌린 곳에서만 반납이 가능하게 해 오히려 불편을 겪고 있었다 
가평군 칭찬합시다. / 산림.생태 유토피아 설악면 설곡리... ,https://blog.naver.com/chonchu?Redirect=Log&logNo=110069294504,나눔바이러스 전도자 박영주씨 아이디어뱅크 감성행정 실천으로 행복선사 가평군 환경과에 근무하고 거동이불편노인의 보행을 돕기 위한 실버카 지원사업에 사용해 달라며 주민지원과에 기탁한 것이다 
미니 컨트리맨 파크레인 락폴딩,https://blog.naver.com/jaepum6824?Redirect=Log&logNo=220691427314,미니 컨트리맨 파크레인 락폴딩 코딩하기 컨트리맨 촌놈을 출고하고 불편한 점이 한두개가 아닙니다 카페에 보니 코딩 나눔하시는 분이 계셔서 경기도로 올라갈까 말까 고민하던 차였는데 제가 다니는 
렌터카보다 간편하고 내차보다 현실적인,https://blog.naver.com/benefitmag?Redirect=Log&logNo=140194590051,불편하다면 카쉐어링으로 저렴한 가격에 편하게 차를 빌려 탈 수 있다 그렇다면 얼마에 사용할 수 있는 걸까 우리나라에서 서비스를 제공하고 있는 주요 업체의 가격을 비교해보자 서울특별시는 나눔 
누구나 할 수 있는 다양하고, 이색적인 기부 방법,https://blog.naver.com/seouledu2012?Redirect=Log&logNo=220227566333,어떤 것들이 있는지 알아보고 기부라는 행위가 대단히 어렵거나 불편한 것이 아니라 편하게 헌혈을 통한 생명 나눔에 기부를 통한 물적 나눔을 더하여 선진 헌혈문화를 만들어가고자 마련된 것입니다 
올바른 독서법 설계하기와 작가와의 대화 북콘서트... ,https://blog.naver.com/nosung?Redirect=Log&logNo=221741382426,이번 한마당 독서나눔 행사를 위해서는 여성과 인권 평화에 대한 책을 많이 읽으셨는데요 동화작가나 우선은 일반 독자보다는 역사 전공자를 대상으로 한 책 같아서 불편했습니다 전공자가 아닌 우리는 
[남원] 주민들이 만들어가는 복지 모델, 희망을 잉태하다,https://blog.naver.com/seogwipo-si?Redirect=Log&logNo=220931102498,이를 위해 남원읍과 남원읍지역사회보장협의체위원장 오영삼는 지난해 월 희망 나눔 캠페인을 거동이 불편한 대 김모 할머니는 실버 카노인 보행기를 지원받게 되자 한 달 생활비여서 엄두도 
실거주와 투자 두 마리 토끼를 잡은 건대 빌리브인테라스... ,https://blog.naver.com/tjdgk4479?Redirect=Log&logNo=221568676397,면 나눔 카 주차면 오토  시스템 스마트폰으로 보안 택배 관리비 등 연동 가능 층 임대료와 불편한 교통을 피해 상대적으로 저렴하지만 교통이 좋은 성수동이 제의 업무 중심지구로 
[2017.10.18.] 서울시 일행 9급 면접 후기,https://blog.naver.com/bahnhof0615?Redirect=Log&logNo=221121528333,있는가  나눔카 정책에서 개선해야 할 점은 무엇이 있는가  대중교통과 교통 정책에 관심이 많다고 했는데 서울시 대중교통을 이용하면서 불편한 점은 무엇인가  점점 인가구가 많아지고 서울시 출산율이 
지프 랭글러 오버랜드 파워탑 시승기,https://blog.naver.com/quattro_rs4?Redirect=Log&logNo=222134407305,사실 허벅지를 지지하는 부분이 짧은 편이지만 불편함을 느낄 정도는 아니다 뒷좌석은 좌우 각각 마치 나눔 고딕 폰트가 나오기 전 세상 같다고나 할까 순정 네비게이션은 그래픽도 그래픽이지만 
시내 모든 교통정보 담은 서울교통포털 앱 나와,https://blog.daum.net/segapub/893,대수 나눔카 정보까지도 한 곳에서 확인할 수 있다  서울시도시교통본부는 이처럼 모든 달 간 앱 불편개선사항 접수 서울시 제공 교통서비스 지속 업데이트  서울시 교통정보는 
차량용테이블로 아늑함과 편리함 UP! '케이엠모터스... ,https://blog.naver.com/k50284?Redirect=Log&logNo=222001761376,차 안 수납이나 거치대는 무조건 많아야 좋다는게 차를 운전해본 사람이라면 누구나 아는 진실 그 편리함을 위해 이것저것 달기도 하지만 지저분하기도 하고 안전 걱정이 들기도 하고 그런데 차량용테이블 
산청 마근담 계곡과 자양보 오토캠핑장,https://blog.naver.com/ka8564?Redirect=Log&logNo=222060008999,주차가 불편하여 많은 사람이 찾지 않는곳이지만 수려한 풍광이 있는 곳이다 마근담 계곡에서 내려와 데크 위에 큰 천막을 설치해서 비나 눈이 오더라도 캠핑하는데 불편을 최소화 했다 개수대 캠핑장 
어쩌다 시작된 고생길의 시작... 스타렉스 캠핑카... Part.5,https://blog.naver.com/vip8030?Redirect=Log&logNo=221322530783,급한대로 내가 앉아있는데 그동안 다른일을 못하니 불편하다 뭘 올려둘까 이리저리 둘러보다 적당한놈 을 찾았다ㅋ 대충 위험한 공구는 치우고 뛰어다니다 공구라도 밟아 다칠까 주방으로 못나오게 방에 
자동차 엔진오일 최저가 교환방법 공유, feat. 공임나라 (충남... ,https://blog.naver.com/scoupe74?Redirect=Log&logNo=221661897148, 가족이 일하다보면 오히려 불편할때도 있으실텐데 지난번도 그렇고 너무너무 친절하시네요 작업도 즐겁게 하시구요 제발 오래오래 홍성에서 운영해주세요 자동차 엔진오일 최저가 교환방법 요약  
