제목,링크,내용
광화문광장 조성에 대한 시민 최종 의견은? 마지막 토론회,https://blog.naver.com/120seoulcall?Redirect=Log&logNo=221740169999,재편하고 나눔카 따릉이 이용을 확대하겠다 또 광장주변에 공유 교통을 배 설치하고 집회 또 사직율곡로 우회방안 재검토가 교통 등 시민불편 최소화를 위해 요구되었다 역사보행시민 
승리자의 <b>나눔</b>(2) 기콘도-챠니카교회 방문,https://blog.naver.com/b0810rw?Redirect=Log&logNo=220619888490, 승리자의 나눔 기콘도챠니카교회 방문 냐마타 청춘 이 군이 새벽 시 분부터 버스를 타고 와 누추함이 영 불편해서가는 데 까지 가보자했는데결국 집에까지 돌아왔다브라보 중간에 미친 듯이 
부산 송도 해상케이블카 &lt;부산에어크루즈&gt;, 머리위에는 하늘, 내... ,https://www.lovely-days.co.kr/3236,굉장한 불편함이 없었다 송도 케이블카에 탑승하니 부산의 시그니처인 바다가 내 발아래 있다는 초록우산 나눔카드 소지 본인 천원 할인  부산시 서구구민 대인 천원 소인 천원 할인 조조 또는 
안양중고차 고객님께 쏘울 부스터 양도 (걍 쏘울 대차),https://blog.naver.com/powcar331?Redirect=Log&logNo=222436788255,기존에 사용을 하던 오일을 제거하는 모습도 한 컷 담아서 투척을 해봤으며 여기서 봐도 교환 할 때가 된 듯 저기 저 커버 때문에 불편해 작업을 하기 불편해 하시는 중앙오토 형님의 모습을 보고 전 잠시 
[기조연설] 연대와 협력의 글로벌 거버넌스 - 박원순 서울시장,https://blog.naver.com/sehub?Redirect=Log&logNo=220192129538,올린 불편사항을 정책에 반영한 대표적 사례로 서울시민이 제일 좋아하는 정책 위가 됐습니다 서울시 고유브랜드인 나눔카는 서울시의 중소카쉐어링사업체를 통합해서 서울시가 직접 홍보해드리고 
데이터로 그리는 서울.2,https://blog.naver.com/wjddus1062?Redirect=Log&logNo=221512970721,서울시민의 나눔카 이용 현황은 서울시민의 한 달 승용차 유지비는 서울의 차들은 얼마나 빠르게 서울에서 발행하는 택시버스 불편 민원은 건설공사장 환결관리에 대한 서울시민 만족도는 서울에서 
현대자동차 기프트카 승가원천사들 편을 보면서 느낀점....,https://blog.naver.com/cs982002?Redirect=Log&logNo=20112509884,새로움은 아니지만 내가 누려 왔던 것에 대한 나눔과 힘든상황에서도 나약해 지지 않을 내 자신을 장애는 불편함일 뿐이라는 인식이 하루 빨리 우리 곁에 있었으면 좋겠다 그리고 그들이 사회생활을 하는데 
인스타그램 20년 1분기 기록들,https://blog.naver.com/lawnhappy?Redirect=Log&logNo=221929140268,차가 있다 없으니 그 불편함이 엄청났다 특히 마트가는 게 가장 문제였다 달의 오토바이를 팔고 경차를 사기로 하고는 레이와 스파크 중 엄청나게 고민을 하고 둘 다 나눔카를 빌려서 타봤는데 레이의 
키즈후리스 ,포근한 뉴발란스키즈 애착플리스 유아점퍼,https://blog.naver.com/3120ann?Redirect=Log&logNo=222098556681,작년까지는 패딩소재의 유아점퍼를 자주 입혔는데 아이 활동성에 불편함이 있었고 잦은 드라이크리닝 그래서 바로 준비한 애정이웃 나눔 이벤트 하단의 사진속 뉴발란스 키즈 덤블 배색형 베스크를 제 
노매드랜드(Nomadland, 2020년) 황혼기의 유랑자들,https://blog.naver.com/cine212722?Redirect=Log&logNo=222316008010,다만 절망을 희망처럼 좀 더 긍정적이고 덜 불행하게 하는 나눔이 있는 것입니다 희망까진 아니에요 노매드의 삶에서의 불편함도 리얼하게 많이 등장합니다 용변처리 문제 타이어 펑크 등 차에 이상이 
2021_1월 서평단 추천도서 (고등학교-환경편),https://blog.naver.com/h1126611j?Redirect=Log&logNo=222244717218,쏟아진다는 불편한 진실과 집 안 곳곳마다 주변 미스터리한 다양한 종이 해롭지만은 않다는 것들을 그 외 친환경 교통으로 친구들이 잘 알고 있는 공공자전거 따릉이 나눔카 차의 집입을 금지하는 
이제 사지 말고 빌리세요! 지금은 '공유시대',https://blog.daum.net/hellopolicy/6986064,서울시 나눔카 홈페이지 바로 가기 세종시 어울링카 세종시는 년부터 카셰어링 시범도시로 선정되어 어울링카를 운영하고 있습니다 신도시 건설 초기에 불편한 대중교통 수요를 충족시키는 것이 
서울 추천 공공앱 및 이벤트 안내,https://blog.pages.kr/2647,스마트불편신고 | 불법주정차 등 불편사항 초간단 신고 처리결과도 실시간 확인 불편한 일을 경로탐색 나눔카 자전거 주차장 실시간 영상 등을 제공하는 서비스  서울주차정보 서울시내 
[인터넷레일뉴스] 서울교통공사 홈페이지에 바란다 (2017.5.24),https://blog.naver.com/ianhan?Redirect=Log&logNo=221013443434,서울교통공사 홈페이지에 바란다  레일뉴스 칼럼니스트 미래철도 운영자 교통평론가 한우진  드디어 오는 월 일 서울시 지하철 양공사인 서울메트로와 서울도시철도공사의 통합체인 
여주 신륵사/남한강 캠핑 &lt;feat. 캠핑카여행&gt;,https://blog.naver.com/daily_jjo?Redirect=Log&logNo=222060257111,여쭈고 나눔해드리고 왔다 아파트 이웃보다 더 돈독한 캠핑카 이웃이랄까  숯불 장전  아빠가 여름캠핑은 저녁만되면 벌레가 너무 많이 꼬여서 조금 불편했던 점도 있었지만 행복했던 하루였다 
새로운 쏘카패스 전과 달라진 점, 그리고 슈퍼패스를 이용힌... ,https://blog.naver.com/portion2?Redirect=Log&logNo=222032891286,자동차를 구매하자니 비용과 이용시간이 얼마 없을 것 같고 자동차가 없자니 불편한 점이 많지요 그런 와중에 탄생한 나눔카 서비스인 쏘카와 그린카가 차가 없는 뚜벅이족에게 많은 도움을 주고 
[리:브리드 환경분야 소셜벤처 재도전 프로그램_데모데이]... ,https://blog.naver.com/merryyear09?Redirect=Log&logNo=222434163335,열매나눔재단 유튜브를 통해 생중계되었습니다 환경에 대한 사회적 관심이 높아진 만큼 에스에스씨는 캡슐커피 소비 증가로 인해 야기되는 환경 문제와 낮은 호환성으로 인한 소비자 불편에 주목하여 
베리캣님의 세가지 마음<b>나눔</b> 감사해요♡,https://blog.naver.com/qlsaks28?Redirect=Log&logNo=220738237016,찍어준다고 카메라도 들고 다니는데 여기에 알맞게 쏙 들어가더라구요 우리반 아이는 여기에 물도 넣고 과자도 넣고 할 수 있겠다며 정말 좋아했답니다 베리캣님 마음나눔 덕분에 여럿이 행복할 수 
[일어로 풀어보는] 역세권 2030 청년주택,https://blog.naver.com/woorileong?Redirect=Log&logNo=220688571257,타는 나눔카를 적극 활용 가능하도록 시설을 갖출 예정 출근히 불편해서 서울 중심지에 살고 싶은데 저도 어쩔 수 
일본군 위안부, 또 하나의 목소리,https://puripari.tistory.com/entry/%EC%9D%BC%EB%B3%B8%EA%B5%B0-%EC%9C%84%EC%95%88%EB%B6%80-%EB%98%90-%ED%95%98%EB%82%98%EC%9D%98-%EB%AA%A9%EC%86%8C%EB%A6%AC?category=453245?category=453245,눈이 불편했다   나눔의 집  에서는 할머니들에게 문제가 되는 부분들을  여러 차례 읽어드렸다  고 했고  고문변호사와 로스쿨 학생들은  쪽 책 가운데  곳에  명예훼손  이라고 밑줄을 
생활가전 렌탈케어 <b>나눔</b>렌탈에서 한번에 해결하기,https://blog.naver.com/llltorental?Redirect=Log&logNo=221688171923,이 날은 버스가 진입하기 어려운 위치라 저희 나눔카로 방문했던 날이에요 버스가 진입할 수 없는 활동이라는 것 자체가 온전히 하루를 투자하여 고객사에 방문한 다음 고객사 내부에서 불편을 
[주차장 수익 창출] 아이파킹과 함께하고 주차장 매출 30% 증가!,https://blog.naver.com/iparking_b?Redirect=Log&logNo=222224303474,겪는 불편함을 없애 주차장 이용 만족도를 높이는 것입니다 주차장 이용 만족도가 높아지면 주차정보제공시스템  나눔카 이용  주차장 유료화 혜택을 모두 골고루 활용하여 까지 감면 받았습니다 
세상을 바꾸는 1%의 기적, 현대위아 1% <b>나눔</b>,https://blog.naver.com/hyundaiwia_story?Redirect=Log&logNo=220912242035,현대위아 임직원들의 대표적인 사회공헌 활동인 급여 나눔이 시작된 지 벌써 년이 지났습니다 단순 이동을 위한 승합차 외에도 거동이 불편한 장애인들을 위해 맞춤형으로 제작된 이동목욕차와 
현대자동차 기프트카 캠페인 어려운 이웃에 차를!,https://blog.naver.com/dicagallery?Redirect=Log&logNo=140146597373,대중교통으로 거동이 불편한 아내를 데리고 병원에 가는 일은 불가능하기에 현재는 군청에서 우리의 덧글이 가장 아름다운 사랑 나눔의 실천이 될 수도 있으니까요 많은 참여 바랍니다   함영민
멀리서 들려오는 가을 소리,https://blog.naver.com/karamies?Redirect=Log&logNo=222463518096,작업실에 바지 몇 개를 나눔 할 목적으로 가져다 놓았는데 덕분에 갈아입을 여분이 있었다 근데 더 주변에 차가 막히면 힘들어하는 사람들이 있는 편인데 물론 지치는 일이긴 하지만 나는 별로 크게 불편하 
모터홈의 캠핑카 내부가 멋드러져요.,https://blog.naver.com/metagene?Redirect=Log&logNo=222012255879,중고캠핑카 이의 싼값 인덱스 캠핑카라고 부르면 드라이브 캠프장인 모터홈 봉고 지개 터널과 나눔 프리미엄 충전이나 기기의 불편함으로부터 시작되는 통상의 가위를 장비하고 있어 새우와 침대 공간이 
[봉상회] 캠핑장비 빌리면 캠핑카가 무료?? 뭘까요?,https://blog.naver.com/beyond_2848?Redirect=Log&logNo=222032692827,뭐 이건 다 결정하시는 분들의 맘일테니 전 그냥 팁을 살짝 드린거라고 생각하시고 또는 친구들끼리명 자고 오기는 불편하고 자연속에서 수다떨기를 하고 싶은 친구끼리 우리끼리 도 좋겠죠  번인 
자동차 부분도색 비용 알아볼 수 있는 광주 승주 자동차공업사,https://blog.naver.com/yksjehej?Redirect=Log&logNo=222199791479,있어서 불편하지요 광주 전남 중고 또는 정품 범퍼 수리 전문 업체에서 아우디 벤츠  등 수입차  나눔 광산구지역아동센터연합회나 투게더 광산 나눔 문화재단 등 공업사 수익금의 일부를 기부하여 
남양주시 해피누리 노인복지관 개관식 개최!,https://blog.naver.com/nyjloving?Redirect=Log&logNo=221237455705,개관을 기념하기 위한 행사로 한국연합회 수호천사 사랑의 짜장면 나눔카에서 참석자들에게 한편 이곳에서는 대중교통 이용이 불편한 와부읍 지역의 회원을 위한 셔틀버스가 일 회 운행 중에 
대전 자동차 현대순정 ecm 하이패스룸미러♡세종시... ,https://blog.naver.com/sgy1007?Redirect=Log&logNo=221475573488,세종시에서 사모님이 불편하다고 하셔서 현대모비스 순정 하이패스룸미러 장착하러 오셨습니다 감사합니다 대전 세종시 하이패스룸미러 장착전 모습 기존의 룸미러를 안전하게 탈거한 모습 
이웃사촌과의 행복<b>나눔</b>^^,https://blog.naver.com/landnmoney?Redirect=Log&logNo=222214292876,헌데 사소한 꿈같은것들은 현실어 익숙하게 마주하고 있다 줌회의도하고 줌수업도하고 카으로 선물도하고 축의금등도 핸드폰안에서 불편치않게 이뤄짐이 더이상 예의없는일이 아닌일상이 되었다 헌데 난 
노매드랜드,https://blog.naver.com/indizio?Redirect=Log&logNo=222313828316,심지어 탄소발자국도 적게 남긴다 노숙자 본인들은 불편함을 느낄까 일을 하다가 너무 피곤해서 기타 잡동사니들은 캠핑장 내에서 물물교환이나 무료나눔으로 얻는다 차박인의 삶은 단순하다 이 영화의 
뮤지컬헤드윅 조승우 이영미 후기 (210801) 조드윅♥,https://blog.naver.com/vicki79?Redirect=Log&logNo=222454263792,하고 끝나는 부분도 킬링파트 하이 이랑 카는 왜 협찬 안해주냐고 하는 장면도 킬링파트 코로나 맥주 들고 이름이 왜 이러냐고 하는것도 잊을 수 없다 옷 껴서 불편하다고 엉덩이한테 그만먹으라고 하는 
건대 빌리브인테라스 분양가 알아보고 왔어요,https://blog.naver.com/zepel?Redirect=Log&logNo=221621526737,그러한 불편함을 해소했다는 점은 저에게 메리트로 다가왔답니다 상업시설과 오피스텔이 한 건물 안에 실제로 입주하여 살게 될 입주민의 입장에서 생각했을때 조금이라도 불편한 요소가 있다면 그만큼 삶의 
#lh카셰어링 #행복카,https://blog.naver.com/akkn12?Redirect=Log&logNo=221540440674,우리에게 개인화 된 사회 문제를 공감하고 나눔을 통해 극복할 수 있다는 메시지를 전하고 있습니다 언제 어디서나 간편하게 행복카 대중교통이 불편한 곳에서 가까운 곳을 대중교통 때문에 멀리 
쏘카! 카쉐어링 편도서비스를 이용하다!,https://blog.naver.com/orca601?Redirect=Log&logNo=220252896784,카쉐어링이란 나눔 공유한다는 뜻인데요 우리는 대게 본인소유의 차가 없으면 대중교통을 제외한 문을 열고 들어가니 뭐 딱히 기대는 안했지만 옵션은 거의 없다고 보이네요 ㅎㅎ 하지만 가장 불편했던건 
[W-day] 아모리스역삼, 꽃기부 플리FLRY, 웨딩카,https://blog.naver.com/garam_flower?Redirect=Log&logNo=222076536784,없어도 전혀 불편함을 못느꼈습니당 부탁하기 애매한 경우 그냥 가방수니 없이 결혼식 진행해도 되실 것 같아요 지갑핸드폰 모두 식장에 마련된 사물함에 맡겼어요  사진  영상 볼 때마다 아모리스의 
[10개의 서울 이야기] ② 걷는 도시 서울,https://blog.naver.com/120seoulcall?Redirect=Log&logNo=221571911776,인도 계명은 보도 위에 설치된 모든 가로시설물의 설치 기준 시민 보행불편을 초래하고 있는 보행대중교통 통합연계시스템을 구축해 버스 지하철 따릉이 나눔카와 걷기를 연계해 최적의 
용인시 카셰어링 서비스와 장애인 생활이동 지원센터를 소개해... ,https://blog.naver.com/yeyeye19?Redirect=Log&logNo=221413977712,합니다 그린카나 쏘카같은 나눔카를 용인시에서 하는 거죠 절차는 사진에 나와 있듯이 회원가입 몸이 불편한 장애인분들을 위한 이동차량입니다 차량을 보면서 저걸 어떻게 이용하는 건가 하고 
이천사운드업카오디오 삼성 QM5 카오디오 헤드유닛 교체,https://blog.naver.com/dnjstjr4732?Redirect=Log&logNo=221408183931,안녕하세요 이번에 포스팅할 차량은 삼성  차량입니다  와 라디오 기능만 사용하셨는데 요즘은 블루투스나  를 많이 사용하시기에 불편함을 느끼셔서 카오디오 교체를 결정하셨습니다  차량은 뒷 
이동형사무실차를 캠핑카처럼도 쓸 수 있다? 그랜드 스타렉스... ,https://blog.naver.com/fhrm3?Redirect=Log&logNo=222124425683,수납장을 여닫는 방식과 칸 나눔 또한 조절이 가능하기 때문에 왼쪽과 오른쪽 수납장의 형태가 조금 등의 불편함이 있어 이동사무실차 등이 아니더라도 스타렉스 격벽 교체 작업은 많이들 받고는 하십니다 
서울시민회의 3차 주제별 회의 토론 자료집,https://blog.naver.com/tallmouth?Redirect=Log&logNo=222443933689,도로 하나를 마련해주면 안전하고 서로의 불편한마음도 줄이고 온실가스 감축에 도움이 될것이다 서울시에서 자전거 도로를 좀더 확충해주면 좋겠다 자전거전용도로 확장하고 시민은 
지구도 살리고 지갑도 채우고! 서울시 친환경 운전, 녹색 교통... ,https://blog.naver.com/hanwhablog?Redirect=Log&logNo=220205201376,현재는 전기차 구입 보조 지원금뿐만 아니라 렌터카 대신 전기 나눔카를 빌려주는 캠페인을 실시하고 있는데요 대중교통이 불편하거나 자가용 소유가 어려우신 분 등 누구나 공평하게 열려있는 전기차 나눔 
[김해시자원봉사센터] 뉴시스-경남도, 하동종합복지관에... ,https://blog.naver.com/gimhae1365?Redirect=Log&logNo=221613799481,거동이 불편한 노인들의 바깥 출입 시 안전한 보행에 도움을 주기 위해 경남자원봉사센터에서 제안하고 창원국가산단 내 한화디펜스의 지원총 만원과 기술봉사팀의 재능나눔 활동으로 제작하고 
단비게러지에서 뉴모닝 핸들리모컨, 제이비랩s62... ,https://blog.naver.com/rain2487?Redirect=Log&logNo=221901273320,최고등급 풀옵션에도 핸들리모컨이 없어 너무 불편한 뉴모닝에 순정같은 깔끔한 핸들리모컨을 무료나눔으로 기증을 하고 간 매트입니다 필요하신 분 가지고 가세요  택배는 안됩니다  올뉴모닝 
서하 육아일기 194 / 생후 297일, 아빠의 서프라이즈 선물... ,https://blog.naver.com/pran1574?Redirect=Log&logNo=222218091934,심기가 불편해 보임 엄마가 안 놀아주고 사진만 찍어서 그런듯 발꼬락 만지작거리다가 빙글 돌고 이건 나눔 안 받았으면 내 돈 주고도 샀을 듯 되게 재밌어 보이네 울애기 서아도 그렇다던데 서하도 
변해야 한다.,https://blog.daum.net/bando_mc/13343360,음식점도 코로나이 이유로 써비스는 하급으로 그리고 음식의 가지수는 줄고 손님은 불편하고 각자 처한 상황이 다르겠지만 서로의 부족함을 메워주고 따스한 마음을 느끼는 것이 바로 나눔인데 
[파주 <b>나눔</b>농장] 동 먹이주기 체험 | 염소,양 우유주기 체험... ,https://blog.naver.com/wlgp5551?Redirect=Log&logNo=222016263525,이것도 한 주  주 정도 된 것 같아요 동생네 가족이랑 파주에 위치하고 있는 나눔 농장이라고 게다가 머리끈도 없어서 너무 불편했어요 역시 엄마는 그냥 반바지 반팔 최고로 편하고 최고로 좋은것 그 
신령의숲 쿠폰 <b>나눔</b> 및 초반공략과 플레이후기,https://blog.naver.com/cty01?Redirect=Log&logNo=221572539562,신령의숲 쿠폰 나눔 및 초반공략 과 플레이후기 류준열 님이 스폰을 맡아 더욱 유명한 일본의 돌려줘야해서 불편하더라구요 수동전투는 비추해드리고 싶네요 저팔계와 한판 우리의 음양법사 부족으로 
이런저런 (플레이모빌) 이야기 - Vol.30,https://blog.naver.com/warai71?Redirect=Log&logNo=222454540921,뭔가 불편하지만 바꾸러 가기 귀찮아서 그냥 쓰는 중  올림픽 경기 중에서 펜싱 경기가 가장 상대로 나눔 이벤트를 하기도 했습니다  굿즈 관련해서 꽤 많은 이야기를 나눴고요 제작하는 
[인천여행] 당일 드라이브 여행~ - 을왕리해수욕장 /쏘카,https://blog.naver.com/kjy8317?Redirect=Log&logNo=220453495178,서울 나눔카로 차량 렌트 서비스인데 분단위로 렌트가 가능하며 인근 공영주차장 및 곳곳에 있어 기존 렌트카처럼 지점을 찾아가야하는 불편이 없어 좋다 처음 가입만 하고 나면 어플로 간편하게 예약 
퇴계로 차로 줄여 보행천국으로 상권‧관광명소에 서울시, 2.... ,https://blog.naver.com/coreap6?Redirect=Log&logNo=222141029862, 전 구간 완성  개 차로 줄이고 도보 최대 배로 확대자전거길따릉이나눔카 신규조성 걷기 불편했던 퇴계로가 걷기 편한 보행친화거리로 재탄생한다 명동 동대문시장 등 인근 상권에도 
건대 빌리브인테라스 더블역세권의 프리미엄!,https://blog.naver.com/zepel?Redirect=Log&logNo=221516791031,지하 층에서 지상 층 규모의 개 동이기 때문에 입주민들의 불편함도 적을 것으로 예상됩니다 아무리 직장 혹은 학교와 가까워도 주변에 기본적인 생활 인프라가 부족하다면 불편함을 느끼게 되고 
언제 어디서나 내차처럼 이용하는 카셰어링 서비스,https://swingboy.net/tag/%EC%A7%9A%EC%B9%B4, 나눔카 서비스  라는 이름으로 시작된 서울시의 카셰어링은 도심 대기환경 개선 차원에서 아직은 다른 사람과 함께 공유하는 것이 어색하고  불편함이 있을 수 있지만 그것은 익숙하지 않기 
소화시설 주정차금지 도색공사,https://blog.naver.com/sean1705?Redirect=Log&logNo=221695683440,소화시설주변 어제도 작업 바람이 많은날은 테이프작업할때 바람에 날려서 불편하고 어제는 서울시나눔카나눔카 전용주차서울시나눔카공영주차장주차장무단횡단금지 휀스중앙분리대교통안전 
[서울나들이 추천] 씨티카 타고 다녀온 63빌딩(아이맥스영화관... ,https://www.chadorri.com/?p=16189,차 앞에 나눔카 라고 이름이 붙어 있다 이제 차도 나눠 사용하는 시대 그 만큼 성숙한 거리는 얼마 되지 않아 가까운 곳인데 차가 없으면 가기 불편한 곳 이런 곳에 다닐 때 씨티카가 유용하게 
강북 달동네에 ‘홍콩 에스컬레이터’ 만든다…경전철... ,https://blog.daum.net/moduuri1004/11827931,나눔카공영주차장 확대로 주차난 없앤다 한편 시는 강북지역 주택가 밀집지역에서 가장 불편한 요소였던 주차공간 부족 문제도 해결에 나선다 공유차량인 나눔카를 강북부터 전면 시작해 
[무인주차장] 송정역에서 가까운 더원볼링장 주차장,https://blog.naver.com/green_walnut?Redirect=Log&logNo=220786048748,나눔카를 편리하게 이용하실 수 있습니다 해당 주차장도 장날이면 어김없이 외부차량들의 장기불법주차로 고민을 하시다가 나이스파크 무인주차시스템을 설치하시게 되었습니다 이용 시 불편한 
대전썬팅 카샵가오점에서 루마 유니크로 LF쏘나타 깔끔한... ,https://blog.naver.com/feeltinter?Redirect=Log&logNo=221722209632,창끝이 꺽인 부분도 너무 창과 떨어져 있어서 불편하셨을 듯 합니다 썬팅후 상당한 시간이 흘렀음을 운전시 햇볕으로 너무 불편하셨을듯 하네요 열선까지 모두 깔끔하게 제거한답니다 최대한 화학용품을 
8월 3-4번째 주, 아빠가 되다. 파란 물결, 먹고, 사고, 보고,https://blog.naver.com/super4854?Redirect=Log&logNo=222487719719,나는 나눔도 해줬다 그리 사는게 내 성향이라 사진을 보면 밥이 하나 밖에 없는데 각시는 쌀을 피한다 억 불편한 집 참 고마운 부분이 많다고 느끼며 살아가고 있단다 케일과 사과를 갈아줬는데 맛나 점심은 
dream이 드림이 되는 날을  계획하다.,https://blog.naver.com/prettyjin81?Redirect=Log&logNo=222135844127,서로의 울음소리가 아닌 불편한 것이 있어 깼습니다 달래고 다시 잠을 청하는데 시간이 조금 나 이나겸은 건강한 육체와 정신으로 경제적인 부와 지식을 축적하여 풍요로운 삶을 누리고 나눔을 
[New, 서울 두 바퀴] 서울시, 무장애·안전·신속·편리한... ,https://blog.naver.com/2seoulbike?Redirect=Log&logNo=221592281060,보행과 자전거를 최우선으로 고려하고 이후 순위로 나눔카 전동휠 등 친환경미래형 교통수단과 노상주차장 가로공원 등을 고려하고 나머지 공간을 차도에 할애하는 내용입니다 기존의 자전거 도로망이 
[Feb.일상]미니카, 마산할매집곰탕, 리묘카페,https://blog.naver.com/hellossumssi?Redirect=Log&logNo=221475773405,이름 적고 대기하기로 나중에 엄마아빠 나이들면 시골집 리모델링하고 귀농할거라구 개조 된 한옥 유심히 봤다 ㅋㅋ 햇살이 너무 좋아서  기다리는데 불편하진 않았당 한 분정도 기다렸나 내이름을 부르는 
보조 배터리, 코딩 <b>나눔</b>  부산 양산 김해 창원 경남 울산,https://blog.naver.com/polo877?Redirect=Log&logNo=221811470602,가지로 불편함도 있고 녹화 저장이 제대로 안 되는 경우가 많다 보니 순정 블랙박스 사용함에 대한 울산 경남 김해 창원 양산 부산 인근에 계신 분들은 연락 주시면 무료로 코딩 나눔 해드리고 있습니다
세금감면 혜택으로 효율적인 주차장운영이 가능한 아이파킹... ,https://blog.naver.com/iparking_b?Redirect=Log&logNo=221740356769,주차장을 운영하면서 불편하거나 세금 때문에 어려움을 겪은 적은 없으신가요 특히 서울시에서 아이파킹 시스템을 도입만 해도 자동으로 적용되기 때문에 별도 처리할 사항이 없어 편리하며 나눔카와 
[리:브리드 환경분야 소셜벤처 재도전 프로그램] &quot;친환경... ,https://blog.naver.com/merryyear09?Redirect=Log&logNo=222328661470,열매나눔재단이 기아차 그린카 비소사이어티와 함께 의미 있는 실패를 경험한 후 포기하지 않고 플라스틱 캡슐커피로 인한 환경오염 문제뿐 아니라 소비의 불편함과 니즈를 함께 해결하는 것이 
