제목,링크,내용
[엄마표 한글떼기/나는생각한글] 잡지책 속에서 배운 글자들을... ,https://blog.naver.com/ics6014?Redirect=Log&logNo=10178040027,씽클펜을 이용해서 글씨를 써야 하는데 율양은 씽클펜으로 쓰면 불편한지 꼭 손으로 쓰네요 저는 혼자 욕심 부리지 말고 친구들하고도 나눌줄 알고 나눔은 몇배의 기쁨이 된다는걸 알게되죠  율양도 
문재인 제19대 대통령 당선..취임[2017년 5월 10일] 주요일정... ,https://blog.naver.com/inhyangin?Redirect=Log&logNo=221002230339,자장면 나눔행사   읍사무소 둔전마을 읍장 이장 등 이장 주민 등   소라면 면장 주민불편사항 점검   관내 일대 동장 외 직원  광림동 동장 박형욱 주민 생활불편 현장 확인 
SH공사 2015년 상반기 기존주택매입임대(다가구.원룸)... ,https://realestate8949.tistory.com/8438,통행에 불편이 있는 점을 감안하시어 신청하시기 바랍니다   매입원룸주택중 일부 원룸주택의 경우에는 주차장  면을 나눔카  전용 주차장으로 확보하여 운영하게 될수도 있습니다   나눔카란 
공유주택에서 ‘나 혼자 산다’, 장점 vs 단점은? [리서치 N... ,https://blog.naver.com/mkresearch?Redirect=Log&logNo=221958666474,공유주택은 누군가에겐 이상적인 거주 공간이 될 수도 또 누군가에게는 맞지 않은 옷을 입은 것 같이 불편한 공간이 될 수도 있어요 외롭지 않을 것 같다는 이유로 공유주택에 입주해 스트레스받지 
에너 팩 스마트 보조 배터리, 코딩 <b>나눔</b> 창원 김해 부산 울산,https://blog.naver.com/polo877?Redirect=Log&logNo=221690208812,만도에서 납품을한 제품인데 처음 나왔을때 불편 및 문제가 있었지만 현재 세대 순정 블랙박스보다는 더 나은 제품이었던거같습니다 세대 순정 블랙박스의 단점을 보안 하기위해 사제 아이나비   
유용한 생활정보 <b>나눔</b>,https://blog.naver.com/nsjzone?Redirect=Log&logNo=100200626955,허리가 침대에 푹 파묻히기 때문에 잘 때 허리가 불편하고 척추변형까지 올 수 있습니다 이상적인 침대탄력은 아마도 침대가구회사가 제일 잘 알고 있겠죠  이상적인 베개 높이 베개가 높으면 목근육은 
캠핑 태양광패널 600w 충전,https://blog.naver.com/seesj1968?Redirect=Log&logNo=221971493424,별다른 불편함이 없을 정도겠어요 왜냐하면 노지캠퍼들은 대부분 자원을 아껴 사용하는 법을 알고 무료나눔하고 또 중고로 팔았었는지를요 차량 실내에 태양광컨트롤러  와 을 설치해드렸습니다 
[IF 2019] IF INNOVATION CONF. 를 다녀와서.,https://blog.naver.com/lbkking?Redirect=Log&logNo=221676336019, 사용자의 입장에서 미래 상상 제품 서비스 창조 협업 통해 사용자들에게 나눔 모든 것은 소비자 경험으로부터 출발해야만 하며 그 이후에야 기술측면으로 작업해 들어가야 한다 디자이너가 
고양시 생활공감정책 참여단,https://blog.naver.com/rucyyd1?Redirect=Log&logNo=222276603852,생활 속 불편을 해소할 수 있는 정책 아이디어 발굴제안 정책현장 참여 나눔 봉사활동을 통해 또한 고양시는 작년 코로나 시기에 안심 카 서비스 운영은 우리 생활 속에서 만들어낸 것으로 대통령 상을 
한국 스쿠터 시장의 가능성을 엿보다, (주)아피아모토 이규웅 대표,https://blog.naver.com/gcgf1?Redirect=Log&logNo=222029595071,그동안 베스파 스쿠터를 정비하기 위해서 서울까지 가야 했던 불편함을 해소하고 스쿠터의 장점을 알리고 싶다고 한다 회사명 아피아모토의 아피아는 이탈리아의 아피아 가도에서 따왔습니다 
언택트 대세 속에 컨택트 빛난 기업,https://blog.naver.com/kmacforever?Redirect=Log&logNo=222037410168,고객의 불편을 사전에 해결해주고 있다 한국지엠 국산자동차판매점 부문 한국지엠은 평생고객 사랑나눔 창구를 운영 중에 있다 사랑나눔 창구는 콜센터 또는 고객센터를 통해 고객이 원하는 
드림카를 꿈꾸며~~~,https://blog.naver.com/rosezang1?Redirect=Log&logNo=222100323842,다소 불편함은 감수해야하고 미니버스수준의 럭셔리 캠핑카 니집 안방이더냐ㅋㅋ무난하게 끌기좋은 사이즈 각자의 브랜드마다 장단점이있고 좀더 여유있게 보자고 지금보는 엔리코는 주문하면 
E200 2년차 정기점검 및 뒤늦은 윈터타이어 교체,https://blog.naver.com/parkjj00?Redirect=Log&logNo=220898930031,다소 불편함이 있을 것 같다 자세한 부분은 기회가 되면 시승차가 나오면 그 때 소개하는 걸로  다음에 다시 뵙기를 기약하고 준비해간 조촐한 선물도 나눔하고 집으로 돌아왔다  지금까지도 
영화 [안경] 떠날 때는 짐 없이 가볍게, 마치 없었던... ,https://blog.naver.com/ebonycrystal?Redirect=Log&logNo=130115760697,그런 그녀에게 하마다 사람들의 기묘한 행동  특히 사쿠라 씨의 과도한 관심은 제법 불편한 여행노동자의 블로그는 나눔글꼴에 최적화되어 있습니다 네이버 한글한글 아름답게 캠페인  나눔글꼴 
제황산 모노레일(<b>카</b>) 안녕하십니까?,https://blog.daum.net/mylovemay/15533283,진해시민들이 만번 정보공개 요청을 하면 만번을 답변하는 불편을 감수하면서 열린시장실의 열린 사진은 나눔과 공유를 위한거니 가져가셔요 감사합니다 수정삭제 비밀글 글쓰기
5월, 나의 아름다운 제주 여행 2 (맛나 식당, 쏘카, 다랑쉬 오름... ,https://blog.naver.com/kalys19?Redirect=Log&logNo=221963019189,되는 불편한 문서 작성은 불필요하다 이용하고 싶은 시간을 설정하고 보험을 선택하는 것으로 끝 내가 예약한 시간 분전부터 차량 확인차 스마트키가 활성화 되는데 이때 차량 외관에 흠집 등 이상이 없는지 
당근마켓으로 꾸민 원룸 인테리어,https://blog.naver.com/yogini1221?Redirect=Log&logNo=222191018655,그런 불편한 마음으로부터 자유로운 것도 장점이었던 것 같다 이사하며 처분해야 할 물건들을 당근마켓 을 통해 무료 나눔을 자주했었다 그때마다 무거운 생수나 직접 키운 농산물 등을 가지고 오신 
어떻게 캠핑용품 준비하면 좋을까요? &lt;나의캠핑물건&gt;,https://blog.naver.com/gon4548?Redirect=Log&logNo=222234989511,나에게 편한 장비가 남에게는 불편할 수도 있습니다 여러사람에게 각자 다른 장비를 사용해본 나의 캠핑 물건 이 책은 세상의 모든 이슈를 쓰다의 블로거님으로부터 나눔 받아 잘 읽고  본인의 의지로 
초경량+안전함을 더한 #더독 2in1 캐리어 유모차 (feat.... ,https://blog.naver.com/thedogmall?Redirect=Log&logNo=221567500756,유모차 옆면에 있는 폴딩 버튼을 눌러만 주면 손쉽게 접혀요 접어서 차 트렁크에도 쏘옥 넣어서 이동하세요 개꿀탱 요즘 애견동반 장소가 많아졌지만 아무래도 유모차 이동이 불편한곳이 있어요  그럴땐 
[특집기사-이재희] 기업사회공헌의 현장 속으로! (3화),https://blog.naver.com/1greenlight?Redirect=Log&logNo=220580901320,사회공헌 사회복지라고 하면 그동안은 시혜적 성격의 나눔이였다고 한다면 이 사업은 일단 공유하는 마음이 불편합니다 앞으로 해보고 싶은 민들레카 프로그램이나 사회공헌 활동이 있으신가요 
공공앱, 추천할만 한지 하나하나 살펴볼까요?,https://blog.naver.com/gookbi_com?Redirect=Log&logNo=205645377,그러한 불편을 덜어주기 위해 위급 상황을 한 곳에서 간편하게 신고할 수 있도록 통합 서비스 사진만 제공하고 나눔카 자전거 주차장 등 부가정보 및 실시간 영상등을 제공하는 공공앱 서비스입니다 
7월 일상~ 여름아 가라 ~,https://blog.naver.com/godzilla_r35?Redirect=Log&logNo=221064563104,미니언들이 좋아하는 스티커 나눔까지 ㅎㅎㅎ 먹거리는 기본 아닙니꽈  ㅎㅎ 사랑한다  물론 미니 아 저 녀석 털이 너무 돌아다니니 제품에도 인쇄에도 영향이 큼 참 좋고 이쁜데 불편함이 더 커져가고 
[샛별의 씨네수다] 클로이 자오 &lt;노매드랜드&gt; 영화 리뷰,https://blog.naver.com/bhhmother?Redirect=Log&logNo=222314032592,밤에는 함께 모여 모닥불도 피우고 각자의 물건을 나눔 한다 배변은 차에서 해결하고 머리는 손수 노매드 생활은 불편한 점도 많다 밴을 주차하는 문제도 있고 용변을 처리하는 일도 숙제다 씻는 것도 
'출퇴근용 전기차 임차비 지원' 직접 받아본 후기!! -부산 청춘... ,https://blog.naver.com/we_are_youth?Redirect=Log&logNo=221549339540,이 지역이 교통까지 불편하다 보니 우수한 기업이 모여 있음에도 불구하고 청년 구직자들이 취업을 청춘 드림카 사업의 좋은 면이 알려지면서 교통 불편 지역이라도 취업의사가 있다고 답한 청년은 나 
11.02~11.20 일상,https://blog.naver.com/chobits0814?Redirect=Log&logNo=221403239610,돌아보니 세상 불편하게 자고 있는 토비 왜 그러고 자는거지 자네 ㅋㅋㅋ 이사가는날 아침 빨리 다음에 이사가기 전까지 꾸준히 처리해야지 ㅋ 한국이면 책 나눔이라도 할텐데 이건 뭐 어리둥절한 토비 ㅎ 
2021년 3월 마지막 주말, 마지막 강의....&quot;담론(談論)을 읽는다.,https://blog.daum.net/gjkim0304/333,자신의 지식과 도덕성이 다른 사람들을 불편하게 하는 것이어서는 인간관계에서 실패하기 마련 입니다 귀곡자  는 언어를 좋은 그릇에 담아서 상대방에게 기분 나쁘지 않게 전달하는 것 
폭바매니아 시로코알라인 입양기 (레보맵핑, 안전밸트걸이... ,https://blog.naver.com/newlookinfo?Redirect=Log&logNo=221374276984,도어 쿠페스타일 차량은 처음인데 한참 뒤에 있는 안전밸트를 가져오려니 여간 불편한 게 아니다 나누는 자와 나눔을 받는 자  브렉 시로코로 이식 잘 달리고 연비 좋고 디자인 이쁘고 
4월 교육실습(교생실습)하는 대학생 일상 ③ | 비대면... ,https://blog.naver.com/toskf1011?Redirect=Log&logNo=222452727192,물론 저도 처먹기만 한 거 아니구요 간식 나눔 했어요오      교시 회계실무 수업시연 구김이 잘 가서 불편하긴 하지만 예뻐서 개인적으로 좋아한다  근데 이 사진 보니까 약간 미간에 
[My Empties/공병+바닥샷] Beauty Products I've used up!... ,https://blog.naver.com/0226orange?Redirect=Log&logNo=221428927013,난 지우는 게 불편해서 다음엔 그냥 일반버전으로 살 거다 근데 문제는 이미 새 제품이 하나 더 있는 코스알엑스 원 스텝 모이스처 업 패드 선물로 나눔받아서 열심히 쓴 너란 녀석 나로 하여금 스킨케어 
[Trivia] 지민이 생일기념 홍대 &amp; 상수 컵홀더 투어,https://blog.naver.com/kes5454?Redirect=Log&logNo=222114824873,카페 자체는 엄청 작아서 불편했는데 역대급으로 예뻤던 곳이었습니다 무려 플라워카페 라고요 정국이 포스터도 무료나눔을 하시길래 두어장 챙겼답니다 이곳은 진짜 특전이 
환생 ㅡ 장기를 기증한 사람들과 주변 이야기,https://blog.naver.com/wonsikjeong?Redirect=Log&logNo=222239264430,언젠가부터 사랑 나눔 희망 따위 단어는 우리에게 공익광고 속 말들이 돼버렸는지 모른다 하지만 내 현승이가 한 번도 힘들다 칸 적이 없는데 힘들다 말이라도 했으면 인자 우짤꼬 하나둘씩 소식을 
[2018년 8월 22일] 주요일정_광주광역시_시의회/전라남도... ,https://blog.naver.com/inhyangin?Redirect=Log&logNo=221343527725,밑반찬 나눔행사 주민 불편 현장 및 태풍 취약지 점검   동 주민센터 관내 일대 지역사회보장협의체 동장 외 직원   월호동 동장 한광민 소규모 주민숙원사업장 점검 태풍 대비 
송리단길 카페_코지블루 cozy blue,https://blog.naver.com/alovd99?Redirect=Log&logNo=222282558152,카운터 옆 벽에 붙어있던 귀여운 것들과 준비중인 이벤트 무료 나눔하는 스티커 나도 구름이랑 뚤려있다 불편하지않을까 했지만 나름 괜찮다 무엇보다 로고가 귀여워     이 간판 올 때만 
잘 먹고, 잘 살자! (먹는일기 맞아),https://blog.naver.com/4617857?Redirect=Log&logNo=222447719138,쵸이닷 바질파스타 저리가라야 진짜 진심  왜인지는 모르겠으나 대상포진이래서 엄마 심기불편 식당이름거론  언니가 시킨 메이크샐러드 하나 나눔 해줘서 먹었는데 가격만큼 양도 아주우 푸짐해서 
서울시청년주택공급 하는 서초꽃마을1502청년주택... ,https://blog.naver.com/anahanaro?Redirect=Log&logNo=222113698893,대나눔카 대 포함로계획되어 있으며 지상 층으로 출입 가능 지상 층에는 작은도서관 북카페가 생활불편이 있을 수 있으며 한전 통신맨홀등의 인입위치 및 외부 배관 위치는 한국전력  또는 
애플 주가와 액면분할 역사, 향후 전망은?,https://blog.naver.com/dhdjwls0724?Redirect=Log&logNo=222178964219,뭔가 불편하고 한 계좌로 통합해 보고 싶어서 지금은 모바일증권 나무로 미국주식을 하는 액면분할이란 액면가액을 일정한 분할비율로 나눔으로써 주식수를 증가시키는 방법인데요 그 예시로 년 
캠퍼밴 구입? 렌트?,https://godsetmefree.tistory.com/entry/%EC%BA%A0%ED%8D%BC%EB%B0%B4-%EA%B5%AC%EC%9E%85-%EB%A0%8C%ED%8A%B8,그렇다고 지하 주차장에 들어가는 캠퍼밴을 구입하기에는 다들 장기여행에는 불편해서 후회하게 좋아요  공유하기 글 요소 구독하기 작은 나눔 큰 행복 저작자표시 비영리 변경금지
메가커피 일산풍동점 후기,https://blog.naver.com/mariangel527?Redirect=Log&logNo=222270211721,무료나눔을 하고 있음 필요하신분은 가져가도 될듯 물론나는 필요없음 ㅋㅋ 들어가면 바로 수다떨기두 좋은애용하는  엄청쪼만한 똥그란 책상에 앉아갖구 불편해서 옆에있는 작은 똥그란 
[2019년 10월 29일]  주요일정_광주광역시/전라남도/여수시청 및... ,https://blog.naver.com/inhyangin?Redirect=Log&logNo=221691560994,점심 나눔 행사 주민불편 생활민원 현장 점검   관내 일대 동장 주민 등 동장 외 직원   읍면동 행 사 내 용 시간 장 소 참여대상 인원 삼일동 동장 신영자 자양마을 주민 효도관광 
건대입구역 오피스텔 분양 [공식상담처] 신세계건설... ,https://blog.naver.com/samojun?Redirect=Log&logNo=221582451957,임대료와 불편한 교통환경을 피해 상대적으로 저렴하지만 교통 환경이 좋은 성수동이 제의 업무 및 나눔카 주차 전기차 충전소 여성전용주차 홈오토  시스템 등 스마트한 설계도 눈에 띕니다 입지도 
생후295일/아기두상 교정헬멧 착용 56일차 오쏘코리아... ,https://blog.naver.com/aodaodghk83?Redirect=Log&logNo=222117978218,결제해야하는 불편함있지만 저체중아 로 분류된 행복이는 할인을 꽤받는다 그래서 군말말고 서있기 무료나눔 바이바이 집 돌아와서 잠시쉬기 쭈욱 쉬고싶으나 첫째 유치원하원하러 가야하고  애미도 
[SMS] 액션 파이터 - 산전수전 공중전!,https://blog.naver.com/tagaeby?Redirect=Log&logNo=60205717302,예기치못한 선물에 너무나 감동했으며 라판님의 대인배적인 나 눔에 만분지일이라도 갚고자 이렇게 세가마크  기본 패드 외에 별매의 조이스틱을 통한 플레이 도 가능한데 왠지 상당히 불편해보이는 
헌혈러브레터 6월호,https://blog.daum.net/lks3349/3469,세계 각국에서는 이날을 기념하여 헌혈이라는 생명 나눔 활동에 자발적으로 참여한 헌혈자들에게 하는 불편으로 개선 필요성이 꾸준히 제기되어 왔다 새롭게 탄생한 의정부 센터에서는 전혈 침대 대 
2021년 8월 26일 HOT50  공황장애 관련 뉴스,https://blog.naver.com/solmc6400?Redirect=Log&logNo=222484271281,이에 더해 이 프로그램이 불편한 이유도 참으로 다양하다 한혜진 화사 박나래가 모여 민들레 목포시 부주동 자생조직회원들 취약계층에 나눔행사 펼쳐  
<b>나눔</b> 우리의 마음을 살리는 아름다운 힘 - 월간마음수련,https://blog.naver.com/km10002002?Redirect=Log&logNo=60032663939,이렇게 나눔이 자신뿐 아니라 주위 사람들에게도 좋은 영향을 끼치는 강력한 힘을 가지고 있다는 사실이 과학적으로도 밝혀지고 있다 정신의학자 칼 메닝거는 우울할 때 할 수 있는 가장 좋은 일은 
[생명보험사회공헌위원회 CSR 이야기] 전동보장구 지원... ,https://blog.naver.com/hungersaver?Redirect=Log&logNo=221742394972,아주 잠깐일지라도 움직일수 없는 상황에 놓이면 그 불편함과 답답함은 말로 다 표현하기 어려울 거동이 불편한 중증 장애인들의 이동 편의성을 보장하기 위해 기아대책과 생보사가 진행한 전동보장구 지원 
[시사IN] 이런 휴가, 좋지 아니한가 - 마이리얼트립,https://blog.naver.com/myrealtrip?Redirect=Log&logNo=110173072950,현대식으로 개조를 하지 않아 생활하기에는 다소 불편하지만 한옥의 예스러움을 그대로 느낄 수 길을 건너자마자  구역이라 표시된 주차장이 나오고 카셰어링나눔카 사이트인 쏘카를 
씨티카 SM3 ZE 전기차 강남역에서 픽업 후.. 귀가, 마트도... ,https://blog.naver.com/suda32?Redirect=Log&logNo=220021322437,기분도 좋아졌담서ㅎㅎㅎ 나눔카같이 않는 면모에 한번놀라고잘나가는 차에 또한번 놀라면서 아이들이 불편하게 목을 가로지르게 되는 경우도 있으니 말이죠 넓은 차량 내부 공간 차량 바닥도 
[푸드코리아]매경의  공유경제 기사 그러나 법률이 ~~~~~~,https://blog.naver.com/wbizw?Redirect=Log&logNo=220088782610,지난해 서울시의 나눔카 사업은 차량 대당 하루 평균 이용자가 명에 그쳤다 이용자들은 서울시가 지정한 개 지점에서만 차를 빌릴 수 있고 빌린 곳에서만 반납이 가능하게 해 오히려 불편함을 겪고 
베란다 홈카페 폴딩도어로 공간 꾸미기,https://blog.naver.com/js3559900?Redirect=Log&logNo=222287001666,필요해 불편함을 느낀다는 점에서 폴딩도어보다 단점으로 부각되곤 합니다 이뿐만 아닌 거실 확장 그 이유 폴딩도어는  시 개방감을 가졌지만 닫았을 땐 밀폐력과 공간 나눔을 확인할 수 있기 때문 특히 
2019 4/12일 우도소라축체 전동킥보드 우도여행... ,https://blog.naver.com/redbus1003?Redirect=Log&logNo=221509307844,제주에서 열리는 축제들은 대부분 주차로 인해서 많은 불편함을 느끼십니다 들불축제성산일출봉 일출 축제를 가보신 분들은 대부분 교통에 대해서 불편함을 이야기 합니다 차가 너무 많아요 
☆스타사운드☆ 랜드로버 D4 화면 먹통으로 네비게이션 수리,https://blog.naver.com/pusan1218?Redirect=Log&logNo=222053612743,화면먹통으로 많이 불편하셨지요 짜잔 스타사운드를 만나면 간단히 해결되어집니다 고장났다고 무조건 교체  합리적인 가격과 최상의 기술력으로 스타사운드가 해결해드립니다 저희 스타사운드는 
[2019년 3월 15일] 주요일정_광주광역시/전라남도/여수시청 및... ,https://blog.naver.com/inhyangin?Redirect=Log&logNo=221488717380,작업 주민불편사항 현장 점검   관내 일대 동장 외 직원   쌍봉동 동장 김태횡 주민자치위원회 사랑의 중식 나눔 행사 새마을지도자협의회부녀회 청결활동   쌍봉하우스 
여름대비 모기향 추천 유한양행 해피홈 스마트리퀴드 훈증기... ,https://blog.naver.com/choejds?Redirect=Log&logNo=221518384441,어릴 때 모기향 피우다가 시대가 바뀌면서 매트훈증기 나왔을 때 정말 열광했던 기억이 나는데요 처음 나왔던 제품들은 선이 너무 길고 말아서 넣는 게 일이여서 불편했죠 그래서 안 쓰게 되었는데 해피홈 
가리왕산 자연휴양림 - 강원도 정선군,https://blog.naver.com/kooni?Redirect=Log&logNo=80163042482,역시 짐 이동이 짧은 야영장은 여러모로 불편함이 있습니다 정자 앞 계곡가로 내려서 봅니다 물 후회없는 데크를 선택하시기 바랍니다 이 블로그의 글은 네이버 나눔글꼴에 최적화 되어있습니다
동아닷컴 최신기사 시간별 20  2021-07-20  21:00,https://blog.naver.com/hhy975?Redirect=Log&logNo=222438828444,이용자들의 불편이 이어지고 있다일 오후 시분 현재 코로나 예방접종 사전예약 시스템 한국타이어나눔재단차량나눔 지원사업 곳 선정로 년부터 지속 진행한국타이어나눔재단은 
나는 어떤 사람,어떤 블로거입니까? 베네통 키즈의 윈윈제안,https://blog.naver.com/psa3333?Redirect=Log&logNo=30167936527,두 번째는 손양과 상의해서 협찬받은 옷의 반은 후원아동에게 전달하는 나눔의 일환으로 이 일을 당신이 불편하면 안 하는 것이지만 그 이유로 그렇게까지 따진다면 그것은 좀 이라고 하더군요 오늘 
노인일자리 및 사회활동지원사업 공익활동 재능<b>나눔</b>활동... ,https://blog.naver.com/tkfkdgodks?Redirect=Log&logNo=221650525288,거동불편 노인 경증치매 노인 등 취약노인 가정을 방문하여 일상생활을 안정적으로 유지할 수 있도록 시간이상 재능나눔활동 참여대상 당해연도 만 세 이상  기초연금미수급자 가산점 부여 
스마트 클라우드 쇼(SMART CLOUD SHOW) 2013 행사 후기,https://blog.naver.com/der68?Redirect=Log&logNo=150173139870,써 봐야 알겠지만 번호를 감출 수 잇다는 장점 대신 조금 불편한 감도 있을거 같습니다 그레이프 제가 가끔 서울에서 전기차를 타고다니는데 스마트 클라우드 쇼 에는 나눔카라는 것도 있더군요 만원 
2021년 2월 [온라인 독서모임] 5회, 이선옥, &lt;단단한 개인... ,https://blog.naver.com/read_arum?Redirect=Log&logNo=222251831267,전체적인 감상평 나눔 전체적인 감상평은 책의 내용이 좋았다는 분들과 불편했다는 분들로 부득이한 이유로 모임에 참석하지 못한 희님도 개인적인 의견을 카으로 보내주셨는데요 최근 이슈에 대해 
서울 나눠 쓰기! 공유도시 서울을 소개합니다,https://blog.naver.com/i_sfac?Redirect=Log&logNo=10186000234,서울 전역 개 주차장에 대의 나눔카가 마련되어 있어 필요할 때에만 빌려 탈 수 있는데요 그래서 여기 무럭무럭 자라는 아이들에게 질 좋고 다양하고 예쁜 옷들을 불편함 없이 언제든 교환하고 나눌 수 
이정윤 기자의 서대문판 7월12일_티브로드서울,https://blog.naver.com/tseoul?Redirect=Log&logNo=220760321734,나눔카 더 편리하게 아파트단지 확대 앵커멘트 요즘 공간이나 물건 등을 함께 나눠 사용하는 또 거동이 불편한 어르신과 장애인 가구에 선풍기와 에어매트 등 여름용품을 지원합니다 서대문구는 동 
K3  애니 가드 전면. 아이나 비 Z5000,https://blog.naver.com/worjsdkqjwl?Redirect=Log&logNo=222213479056,나눔 시공 시 이어 붙인 부분부터 필름이 일어나고 탈색되는 하자를 없애고 필름 사이로 빛이 새어 사용하시다 불편하신 점 있으시면 언제라도 방문해 주세요 감사합니다 궁금한 사항이 있으시면 
서울시, 곳간 풀어 경제 순환 '20년 39조 원 예산안 ‘역대... ,https://blog.naver.com/withyou_kdh?Redirect=Log&logNo=221701234652,올해보다 조 억 증액한 조 억원  시의회 제출 서울시가 년 예산을 조 억원으로 편성 오는 월 일 서울시의회에 제출한다 유례가 없고 어느 지자체도 시도하지 않은 역대 최대 규모의 
어르신 대학생 주거공유 '한지붕 세대공감(홈셰어링)' 신청자... ,https://blog.naver.com/sdmstory?Redirect=Log&logNo=221649635794,  어르신과 학생들이 함께 지내면 불편하지 않을까요   어르신과 학생 간에 발생할 수 있는 문제들은 입주 전에 서로 충분히 의논할 수 있습니다 대체로 일주일 이내에 어색함이 사라지고 서로가 
공기청정기추천!! 사이즈는 미니&gt;&lt; 파워는 대박!!,https://blog.naver.com/joonki3?Redirect=Log&logNo=221523393426,활동에는 불편함을 주지않고 밤에만 비를 내려 매일아침 일어났을 때 상쾌하게 비가 온세상을 정보를 나눔하려구요  공기청정기 고르는 나만의 깐깐한 기준 제가 집에서 사용하고 있는 공기청정기도 같은 
워드프로세서 '아래아한글'에서 작성된 인천공항 화장실... ,https://blog.daum.net/railroad/15654800,아래아 한글은 한글 입력에 최적화되어 있기 때문에 상대적으로 외국어 입력은 조금 불편한 면이 분홍색 네모 부분이 원래 서로 연결되어야 하는 부분 이건 아래아 한글로 아랍어를 입력할 때 가장 불편 
