제목,링크,내용
<b>산림</b>기사 한방을 위한 전략법?,https://blog.naver.com/pjhjms1228?Redirect=Log&logNo=222456613148,회 산림기사 시험을 보기 위해서 현재 열심히 하고 있습니다 최종합격을 하게 되면 승진에 도움이 되고 공시에도 일부 직렬에서 특채라는 혜택도 얻을 수 있고 가산점도 인정이 된다고 하더라고요 저는 산림 
경주 <b>산림</b>환경연구원 스탬프투어 재미있어,https://blog.naver.com/0watergirl0?Redirect=Log&logNo=222501774815,저희가 도착한 이곳은 경주 산림환경연구원이예요 이곳은 다양한 식물들이 많고 경상북도에서 하는 경주 산림환경연구원은 오른쪽과 왼쪽으로 나뉘어져 있는데 몇 해전부터 한쪽은 건물을 새로 짓고 
<b>산림</b>기능사 실기 작은 부분도 놓치지 말자!,https://blog.naver.com/ys892015?Redirect=Log&logNo=222462520834,산림기능사 실기 작은 부분도 놓치지 말자 확실히 요즈음 인생 후반기에 새로운 일에 도전하시는 아무래도 우리나라 가 산으로 뒤덮여 있는만큼 산림과 관련된 일이 많을 수밖에 없는데요 구체적으로 
<b>산림</b>기능사 자격증 자세히 알아보기,https://blog.naver.com/hsh6340?Redirect=Log&logNo=222503934987,산림기능사 자격증 자세히 알아보기 평생직장은 옛말이 된 요즘 인생 후반기에 새로운 일에 이 중 하나가 바로 자연친화적이면서도 전문적인 직업 중 하나인 산림산업 분야라고 합니다 아무래도 이 
<b>산림</b> 임도를 따라 걸어보다.,https://blog.naver.com/chinajgkim?Redirect=Log&logNo=222497041464,산림 임도는 호불호가 엇갈리는 평가다 우선 불편한 느낌은 버스를 타고 고향으로 오다 보면 울창해야 할 산림 한가운데에 도로가 뻥 뚫리고 절개한 산비탈 지역이 황토색으로 벌겋게 노출되어 왠지 무엇인가 
익산시, <b>산림</b>소득지원사업 추가 모집,https://blog.naver.com/hiksanin?Redirect=Log&logNo=222482305432,산림소득지원사업대상자를 추가 모집한다 시는 이달 부터 월 일까지 관내 거주하며 농지를 소유 또는 임차해 조경수를 재배하는 임업인이나 생산자 단체를 대상으로 임가 소득 증대를 위한 산림소 
<b>산림</b>기사  이렇게 공부해서 합격했어요!,https://blog.naver.com/ehaulee?Redirect=Log&logNo=222414104892,산림기사 자격증에 합격하게 된 이이라고 합니다 지금도 산림기사를 준비하고 계실 수험생 여러분들에게 도움이 되고 싶어 합격 수기를 작성하게 되었네요 저는 일단 산림학과 졸업생이구요 산림분야로 
<b>산림</b>기사 응시자격 및 시험대비 확인,https://blog.naver.com/annasui1127?Redirect=Log&logNo=222438420756,오늘은 산림청 부처 소속의 시험을 소개해드려고 합니다 개인을 넘어서 단체 기관 국가의 자원 중에 하나인 산림을 보호하고 관리하는 업무를 도맡는 분야인데요 산림기사 응시자격 그리고 수험 준비 
수 있다고요?! | 월드비전 기후변화 대응 <b>산림</b>복원사업(FMNR),https://blog.naver.com/wvfamily?Redirect=Log&logNo=222482316870,먼저 읽고 오면 이해에 도움이 많이 됩니다 월드비전 산림복원사업으로 회복된 숲의 모습 오늘은 기후변화 대응사업 중 하나인 산림복원사업      을 함께 알아보려 
불암산<b>산림</b>치유센터에 가면 '힐링'이 기다려요~,https://blog.naver.com/120seoulcall?Redirect=Log&logNo=222488796559,노원구에 서울 최초의 도심형 산림치유센터건강한 체험 프로그램 가득 불암산산림치유센터에서 바라본 불암산 이 경관만 봐도 치유에 한 발자국 다가서게 된다 최윤정 산 정상부에 있는 큰 바위가 
한국 농수산대학 <b>산림</b> 단기소득 교육,https://blog.naver.com/sd5513?Redirect=Log&logNo=222467625140,한국 농수산대학 산림 단기소득 교육 한국농수산대학 산림단기소득교육 에 참석 하였습니다 오늘부터 일까지 일수로 일간의 일정으로 진행되는 산림단기소득교육 은 코로나 가 기승을 부리는 영향으로 
<b>산림</b>기사 응시자격 수월하게 맞추는 방법 안내,https://blog.naver.com/cndgksdl?Redirect=Log&logNo=222485618872,산림기사응시자격 안녕하세요 여러분의 학습플래너 세모쌤입니다 오늘은 산림기사를 찾아보시고 취득하시려는 분들에게 도움이 되고자 글을 작성하게 되었어요 산림기사 자격증을 취득하게되면 산림과 
공주<b>산림</b>휴양마을(주미산자연휴양림),https://blog.naver.com/searover2?Redirect=Log&logNo=222348233443,바로 공주산림휴양마을 입니다 년 월 개장한 공주산림휴양마을은 다양한 숙박시설과 야영장 호수 산책로 등을 갖춘 곳입니다 공주시내에서 가깝고 주요 관광지에서의 접근성이 좋아 공주 여행의 
경주 '경상북도 <b>산림</b>환경연구원', 자연 속에서 즐기는 언텍트... ,https://blog.naver.com/pride_gb?Redirect=Log&logNo=222493761027,경주 경상북도 산림환경연구원 자연 속에서 즐기는 언텍트 여행지 울창한 숲속에서 자연과 함께 힐링할 수 있는 경상북도 산림환경 연구원을 소개합니다 최근에 코로나 의 여파로 언택트 관광지가 
한라산 둘레길 당일 트레킹(feat. <b>산림</b>휴양길, 동백길, 수악길),https://blog.naver.com/kyi2609?Redirect=Log&logNo=222491740986,당일치기로 산림휴양길 동백길 수악길 다녀옴 제주도여행에는 모두 대중교통 이용  이번 한라산 둘레길 코스와 길이는 산림휴양길 동백길 수악길 이지만 수악길 은 트레킹 
<b>산림</b>복구사업의 오늘,https://blog.naver.com/mireco2016?Redirect=Log&logNo=222493949993,우리의 산림을 되돌리는 것 만큼 중요한 일은 또 없죠 오늘 한국광해관리공단은 어재의 잿빛 숲이 오늘의 푸른 솦으로 바뀌는 사업 한국광해관리공단 산림복구사업의 오늘에 대해 이야기합니다 광업활동은 
부산<b>산림</b>교육센터에서의 천연염색체험 프로그램~,https://blog.naver.com/kjinsook2004?Redirect=Log&logNo=222479670220,부산의 금정구에 있는 부산산림교육센터는 윤산중학교가 폐교되고 만들어진 곳입니다 부산산림교육센터에서는 숲체험 숲탐험 목공 프로그램 천연염색체험 프로그램 등 다양한 프로그램들을 하고 있습니다 
홍천 도시<b>산림</b>공원 토리숲 산책하기,https://blog.naver.com/khycmh012?Redirect=Log&logNo=222481756695,홍천 도시산림공원 토리숲 산책하기 좋아요 가을비가 촉촉하게 내렸던 주말 이번주는 태풍이 오고있죠 잠시 비가 멈췄던 주말 후다닥 산책하러 가까운 공원으로 출발 도시산림공원토리숲 강원도 홍천군 
알고보면 <b>산림</b>을 보호하는 말벌,https://blog.naver.com/andyou34?Redirect=Log&logNo=222471218959,말벌에 대한 인식이 안좋은 편인데 말벌은 산림을 보호해주는 고마운 곤충으로 그들은 해충을 방제하는데 큰 역할을 함 말벌은 산림 내 포식자로 나방 유충 같은 산림해충들의 개체수를 제어해줌 그래서 
<b>산림</b>기사 자격증으로 취업준비 끝,https://blog.naver.com/ehaulee?Redirect=Log&logNo=222449831368,산림기사 자격증 합격자입니다 이번에 한 번 만에 합격하게 되어 합격수기를 남기게 되었습니다 전공이나 적성을 고려했을 때 산림기사가 적당하다고 생각되었습니다 산림 분야에서 일을 하기 위해서는 
복권기금으로 만든 ‘<b>산림</b>텃밭정원 힐링과정 교육사업’,https://blog.naver.com/k-fowi?Redirect=Log&logNo=222477958623,출처산림복지 블로그기자단 기 김윤경 기자 출처어반정글 제공 복권기금과 푸르른 숲은 어떤 관계가 있을까요 복권기금은 숲의 다양한 기능 증진을 지원하는 재원인데요 구체적으로는 산림보호 산림치유 
용정 <b>산림</b>공원, 도심 속 숲속으로 힐링하러 떠나볼까요?,https://blog.naver.com/cjcityblog?Redirect=Log&logNo=222416359272,위치한 산림공원이랍니다 이곳에서 피톤치드 맡으며 힐링 및 산책을 할 수 있어서 사람들 또한 많이 찾고 있는 곳이기도 합니다 김수녕 양궁장 맞은편에 위치한 용정 산림공원은 시민들에게 아름답고 쾌적한 
<b>산림</b>경영지도원 채용 공고 발표 시험일정 및 원서접수 확인!,https://blog.naver.com/edupdkorea?Redirect=Log&logNo=222484291765,산림경영지도원 채용공고 발표 월 일 필기시험 시험일정 및 상세개요 확인 안녕하세요 에듀피디입니다  산림조합중앙회에서 년 산림경영지도원 채용공고를 발표하였습니다 기존 발표했던 
제주시, <b>산림</b>재해 예방 추자도 공익숲가꾸기 추진,https://blog.naver.com/kohj007?Redirect=Log&logNo=222493384177,제주시 산림재해 예방 추자도 공익숲가꾸기 추진  제주시는 추자도 산림의 생태적 건전성 확보와 건강한 산림자원 조성을 위해 공익숲가꾸기사업을 
<b>산림</b>청, <b>산림</b> 생명 자원 혁신성장거점 지자체 공모,https://blog.naver.com/coq?Redirect=Log&logNo=222496630459,인천경기강원경북 북지 지역 대상 국비 억 원 지원 충북 산림 바이오센터 조감도 산림청청장 최병암은 생명 자원 산업계와 임업인이 상생하는 산림 생명 자원바이오 혁신성장거점 조성사업에 
나주 <b>산림</b>자원연구소 비 오는 날도 좋네~,https://blog.naver.com/lovingssu?Redirect=Log&logNo=222495848042,나주 산림자원연구소 비 오는 날도  다음달이면 더 예쁠 것 같아요 날씨가 많이 선선해졌어요 나주 산림자원연구소 이곳은 조금 외딴곳 나주도 빛가람동쪽은 번화가 느낌인데  이곳은 시골 분위기가 
금강자연휴양림 <b>산림</b> 박물관 - 숲에서 느끼고 박물관에서 배워요!,https://blog.naver.com/sejong_story?Redirect=Log&logNo=222464332399,산림박물관 숲 금강자연휴양림 충청남도산림박물관 세종시에는 자연을 벗 삼아 몸이 건강해지고 마음까지 풍요로워지는 온 가족이 함께할 수 있는 금강자연휴양림이 위치해 있습니다 금강자연휴양림 
인생샷 성지 메타세쿼이아와 향나무 숲길 전라남도 <b>산림</b>자원연... ,https://blog.naver.com/bluedaisy706?Redirect=Log&logNo=222465568675,년 월 일 화 인스타성지로 널리 알려져 있는 전라남도 산림자원연구소 이곳 입장 시간은 그러나 중국 쓰촨 지방 산림 공무원이 처음으로 살아있는 표본을 발견했고 년 후시안수 
공기를 느끼며 여행하기 좋은 '전라남도 <b>산림</b>자원연구소',https://blog.naver.com/najusipr?Redirect=Log&logNo=222481053021,나주의 월은 산림자원연구소의 메타세쿼이아 길과 주변에 조성한 맥문동 밭에 보라색의 꽃이 피는 시기입니다 제법 선선해진 기온을 느낄 수 있는 월 중순 여행하기 좋은 곳으로 전라남도 산림자원연구소의 
추석 벌초 비용, <b>산림</b>조합 벌초 대행 서비스 이용하세요!... ,https://blog.naver.com/pride_gb?Redirect=Log&logNo=222498256168,산림청 산림조합 벌초 대행 서비스 산림조합이 추석을 앞두고 신종 코로나바이러스 감염증코로나 탓에 고향 방문과 묘지 관리에 어려움을 겪는 국민을 위해 벌초 대행 서비스를 확대하고 있습니다 일 
김정섭 공주시장, “금학생태공원, 미래 <b>산림</b> 관광지로 조성”,https://blog.naver.com/sinmunman?Redirect=Log&logNo=222481899010,김정섭 공주시장 금학생태공원 미래 산림 관광지로 조성  억 투입되는 치유의 숲과 연계 다양한 활성화 방안 접목  김정섭 공주시장이 금학생태공원 일대를 공주를 대표하는 산림 관광지로 만들어 
포천 여행 국립수목원 광릉수목원 <b>산림</b>박물관 주변을 돌아보며,https://blog.naver.com/missionhkc?Redirect=Log&logNo=222425597102,포천 여행 중 만나는 국립수목원 일명 광릉수목원에 갔다가 산림박물관 주변을 돌아 보았습니다 국립수목원 주변을 천천히 돌아 보면서 천천히 산림욕도 하고 힐링을 하려고 합니다 국립수목원 산책을 할 때 
서귀포 치유의 숲 &lt;<b>산림</b>치유프로그램&gt;,https://blog.naver.com/seogwipo-si?Redirect=Log&logNo=222404870290,이번에 숲을 진심으로 사랑하시는 숲지도 산림치유지도사 선생님 따라 산림치유프로그램 체험을 해보는 귀중하고 건강한 시간을 가졌답니다 아침까지 내리던 비는 가랑비와 이슬비로 약해지더니 서서히 
남장달<b>산림</b>공원 여름 저녁 산책,https://blog.naver.com/hsgstory?Redirect=Log&logNo=222489914657,조성된 도시숲남장달산림공원은 대우아파트 바로 앞 주공 차차 아파트 이안아파트가 보이는 곳에 있습니다 이름만 들어봤지 공원이 이곳에 있는지는 몰랐네요 시행청  중부지방산림청 
노인분들 곁으로 찾아가는 복지시설나눔숲과 찾아가는 <b>산림</b>교... ,https://blog.naver.com/k-fowi?Redirect=Log&logNo=222481250024,출처산림복지 블로그기자단 기 엄윤주 기자 달서구노인종합복지관 복지시설나눔숲 숲이 면역력을 국립칠곡숲체원 찾아가는 산림교육  숲을 가져다드림 숲속 한 발짝 숲체험교육 프로그램 출처 
<b>산림</b>경영지도원 필기 공개문제 및 2021 <b>산림</b>조합중앙회 채용... ,https://blog.naver.com/ksy35442002?Redirect=Log&logNo=222424336758,산림경영지도원 필기 공개문제 및  산림조합중앙회 채용 일정 확인 안녕하세요 에듀피디 합격파트너입니다 오늘은 산림 및 임업 분야 종사자라면 주목해볼만한 취업 정보를 알려드리려고 합니다 
월간 <b>산림</b> 8월호: 숲과 섬, 자연이야기,https://blog.naver.com/iriver720?Redirect=Log&logNo=222486824278,산림 월호예요 월간지로 발행되는 산림은 산림청 산하기관인 산림조합에서 국내 다양한 산과 숲 공원은 물론 외국의 여러 숲과 도시공원의 이야기를 다루고 있어요 또 여러 분야 정보까지 다루고 있어 
최초의 <b>산림</b> 박물관이 순창군에 있습니다.&quot;전라북도 <b>산림</b>... ,https://blog.naver.com/photo4782?Redirect=Log&logNo=222492396722,순창 여행  순창 볼거리  순창 이색 여행지 전북 순창군에 아이들과 함께 산림 공부할 수 있는 전시관이 있습니다 전라북도 산림 박물관 전라북도 순창군에 위치한 전라북도 산림 박물관은 년 
<b>산림</b>청, ‘2021년 <b>산림</b> 공공·빅데이터 활용 창업경진대회’... ,https://blog.naver.com/coq?Redirect=Log&logNo=222500485457,산림청청장 최병암은 일 정부대전청사 층 대회의실에서 한국임업진흥원원장 이강오 한국산림복지진흥원원장 이창재과 함께 진행한 년 산림 공공빅데이터 활용 창업경진대회 시상식을 
충남 금산군 진악산 <b>산림</b>치유 하면서 등산하기 좋은 명산이다,https://blog.naver.com/yesworker?Redirect=Log&logNo=222493732204,단지 오르기 위한 산이 아닌 누림을 가질 수 있는 산림이라는 것과 그 숲속에서 그냥 지나치던 치유인자를 만날때 산림치유 진수를 누리는 시간이 된다 혼자서 누리기에 너무나 벅찬 이 순간을 카메라 
여수흥국사 <b>산림</b>공원ᆢ텐트,차박,취사,캠핑카... ,https://blog.naver.com/fruit528?Redirect=Log&logNo=222453182936,산림공원쪽에 한곳이 있고 흥국사 입구쪽에 한곳이 있는데여름엔 휴일은 물론 평일에도 주차하기가 좀 어렵다 생각했는데 사회적 거리두기 단계 영향인지 방문객이 확 줄었네요 그동안 흥국사 산림공 
진해가볼만한곳 비오는날 낭만이있는 <b>산림</b>휴양 진해드림파크,https://blog.naver.com/diamond407?Redirect=Log&logNo=222478078485,진해에 이렇게 큰 자연산림휴양지가 있는지 처음알았어요 자 그럼 지금부터 소담이와 산책을 낭만이있는 산림휴양 진해드림파크 진해드림파크는 진해만생태숲과 목재문화체험장 청소년수련원 광석골 
라라남매와 함께 :: 전라남도 <b>산림</b>자원연구소에서 인생샷!,https://blog.naver.com/skywldk?Redirect=Log&logNo=222503378980,나주산림자원연구소 월에 다녀왔던 전라남도 산림자원연구소 너무 너무 너무 좋았던 이 곳  함께 가셨던 부모님도 너무 좋아하시고 아이들도 좋아했던 푸르름 입장료와 주차료가 없는 이 곳 무료인데 
<b>산림</b>도로 걷다...문수지맥 &lt;예배령&gt; 가는 길,https://blog.naver.com/atmpkj?Redirect=Log&logNo=222500062308,경북 봉화군 주실령 아래에서 문수지맥 예배령까지 산아래 산림도로를 걸었습니다 여느 산림도로와 마찬가지로 여기에도 사람이 전혀 없습니다 도로 폭이 넓고 도로 가장자리에 나무가 많지 않지만 
횡성여행｜잣나무 숲에서 <b>산림</b>치유, '국립횡성숲체원' 이용안내,https://blog.naver.com/himawari_tw?Redirect=Log&logNo=222484540022,국립횡성숲체원은 한국산림복지진흥원에서 운영하는 국가 제호 산림교육센터입니다 청태산 해발 에 위치하고 있어 자작나무와 잣나무숲 이 있는 천혜의 자연환경 속에서 산림치유를 체험할 수 있는 
파주시<b>산림</b>조합 임산물유통센터_가을 국화 화분 구입, 고양동... ,https://blog.naver.com/no1cye?Redirect=Log&logNo=222497273229,가을 국화를 사러 파주시산림조합에 다녀왔다 며칠전에 근처에 지나가다 국화꽃판매라는 현수막을 파주시산림조합 임산물유통센터 강릉해변메밀막국수 가을국화 국화화분 국화구입 국화 
익산시, 국고보조 <b>산림</b>소득사업 추가모집,https://blog.naver.com/hiksanin?Redirect=Log&logNo=222499242894,위한 산림소득지원사업 대상자를 추가모집하고 있다 시는 올해 예산 소진 시까지 등하거나 산림조합원으로서 임업을 경영하는 자에 한해 지원할 수 있다 각 사업별 지원 품목은 
<b>산림</b>조합 “코로나19로 고향 못 가시는 분 벌초 대행... ,https://blog.naver.com/nong-up?Redirect=Log&logNo=222497770865,산림조합이 전문 작업단이 벌초 대행 서비스를 하고 있다 산림청 산림조합이 올 추석을 앞두고 벌초 대행 서비스를 확대 시행하고 있다 산림조합은 출향민이나 코로나로 직접 묘지 관리가 어려운 
담양 메타세콰이어길 , 나주 <b>산림</b>자원연구소 / 전라도 여행... ,https://blog.naver.com/pagani0101?Redirect=Log&logNo=222471206985,이곳은 전남 나주에 위치한 산림자원연구소입니다 산림자원연구소답게 정말 예쁜 정원을 볼 수 있는데 무료 개방입니다 한 번 살펴볼까요 담양보다 더 좋은 것 같은데 초록색으로 뒤덮인 곳을 거닐다 보니 
전남 <b>산림</b>자원연구소,산책하기 좋은곳,메타스퀘어길.,https://blog.naver.com/driver21v?Redirect=Log&logNo=222492397793,우리나라 산림에 자라고 있는 모든 종류의 나무들과 꽃들과 길거리에서 자라는 풀들까지 연구하고 분류하고 개량하는 전남 산림자원연구소이다 하늘을 덮을만큼 큰 메타스퀘어 낭수들이 아름들이로 굳게 
[거창군] 국가 <b>산림</b> 문화 자산 갈계숲-최은영기자,https://blog.naver.com/geochanggun?Redirect=Log&logNo=222489114316,년 월일 국가 산림 문화 자산으로 지정된 북상면에 위치한 갈계숲에 다녀왔습니다 거창 갈계숲은 숲을 걷다보면 여러 안내판도 보이는데요 꼭 읽어 보세요 앞서 말씀 드렸듯이 갈계숲은 산림청에서 
대전 장태산자연휴양림 <b>산림</b>휴양관 숙박후기~,https://blog.naver.com/hoggiii?Redirect=Log&logNo=222480273611,장태산자연휴양림 산림휴양관 대전 서구 장안로  장태산휴양림 은 대전 서구에 위치해있어요 휴양관 사정으로 산림문화휴양관 에 머물렀어요 산림관은 콘도 처럼 한 건물에 다른 객실들과 함께 있는 
<b>산림</b>조합 벌초 대행 서비스 확대 시행,https://blog.naver.com/coq?Redirect=Log&logNo=222498010546,산림청청장 최병암은 산림조합이 추석을 앞두고 코로나로 고향 방문과 묘지관리에 어려움을 겪는 국민을 위해 벌초 대행서비스를 확대 시행하고 있다고 일 밝혔다 산림조합은 출향민이나 코로나로 
광양시<b>산림</b>조합 벌초대행(도우미) 서비스 시행,https://blog.naver.com/hayo_nada?Redirect=Log&logNo=222483078866,광양시산림조합조합장 송백섭은 코로나로 어려움을 격는 광양 시민들을 위해 벌초 도우미 서비스를 월 일월부터 월 일금까지 접수 받는다 산림조합은 산림분야 전문기관으로 벌초 잔디보수 
제주시, <b>산림</b>경관 개선 덩굴류 제거사업 지속 추진,https://blog.naver.com/kohj007?Redirect=Log&logNo=222477395107,제주시 산림경관 개선 덩굴류 제거사업 지속 추진  제주시는 주요 도로변 및 조림 사업지의 산림 경관을 저해하고 수목 생장에 지장을 주는 덩굴류 
(지속가능한 환경이슈) <b>산림</b>전용 현장 및 풍력발전소... ,https://blog.naver.com/jootime?Redirect=Log&logNo=222486139391,산림전용현장 및 풍력발전소유휴부지 가능성  조지아그루지야 고리 지역 고리라고 스탈린 고향을 주말에 여행중이었어요 여기저기 돌아다니며 자연감상을 하던 중에 이렇게 산림없이 바람 잘드는 
예고없이 찾아오는 <b>산림</b>작업사고, 아무 걱정하지 마세요.... ,https://blog.naver.com/kofpi?Redirect=Log&logNo=222465893697,오늘은 산림작업자의 안전사고 예방을 위하여 운영하고 있는임업기계장비 품질인증 제도를  산림작업 안전사고 현황  이처럼 아름다운 산을 가꾸고 국산 목재를 생산하기 위해서 조림 숲가꾸기 
영덕 <b>산림</b> 생태문화체험공원 ᆢ영덕 풍력단지ᆢ영덕여행,https://blog.naver.com/cholong68?Redirect=Log&logNo=222484059748,강원도 가는 길 영덕 풍력 단지 라는 표지판을 보고 찾아 간 곳 영덕 풍력단지 산림생태문화체험공원 요즘 같은 코로나 시국 거리두기에 도시락 준비 해서 하루 종일 보내도 괜찮을 만한 곳 인것 같다   이른 
[꽃무지 야생화촌] 나주 삼겹살 맛집, 세량제, 나주<b>산림</b>자원연구소,https://blog.naver.com/potata15?Redirect=Log&logNo=222483979181,즐거운 나주 나들이 세량제 나주산림자원연구소 꽃무지 야생화촌 나들이 작년부터 내내 코로나로 일년에 한 두번은 오게 되는 산림자원연구원 걷기 참 좋아요 다정한 커플 맞아요 막 끌려다니는거 아니고 
영암국유림관리소, 규제혁신으로 <b>산림</b>행정의 품질 향상,https://blog.naver.com/koreareg?Redirect=Log&logNo=222489970541, 서부지방산림청 영암국유림관리소는 최근 탄소중립 등 사회적 이슈에서부터 국민들의 실생활에서 느끼는 불합리한 제도개선 등 주민들의 산림정책에 대한 다방면의 의견을 수렴하기 위한 규제혁신 
2021년 <b>산림</b>조합 채용 공고 및 <b>산림</b>경영지도원 임용전형 공고,https://blog.naver.com/hayo_nada?Redirect=Log&logNo=222492938474,년 월 일 산림경영지도원 임용전형이 공지되었습니다 산림경영지도원 임용전형에 합격하게되면 산림조합 및 산림조합중앙회에 근무 할 수 있습니다 원서접수기간은 아래와 
<b>산림</b>복지진흥원, 발달장애인 대상 일자리 창출 ‘앞장’,https://blog.naver.com/k-fowi?Redirect=Log&logNo=222482024101,산림복지진흥원 발달장애인 대상 일자리 창출 앞장 신규 일자리 산림복지 교구제작관리원 현업 수행 산림청 한국산림복지진흥원원장 이하 진흥원은 발달장애인을 대상으로 새롭게 개발 
한국<b>산림</b>복지진흥원, <b>산림</b>복지분야 ESG경영 나선다,https://blog.naver.com/k-fowi?Redirect=Log&logNo=222489908589,한국산림복지진흥원 산림복지분야 경영 나선다 산림복지 가치 창출체계를 담은 지속가능경영보고서 발간 산림청 한국산림복지진흥원원장은 년 한국산림복지진흥원 지속가능경영보고서 
<b>산림</b>청, <b>산림</b>과학기술 연구분야 국민 참여 아이디어 공모... ,https://blog.naver.com/coq?Redirect=Log&logNo=222483468965,산림청청장 최병암은 일 정부대전청사에서 제회 산림과학기술 연구개발 분야 국민 참여 아이디어 공모전 우수 아이디어에 대한 시상식을 개최했다 이번 공모전은 국민이 직접 제안한 임업 현장 
