제목,링크,내용
백운동원림, 강진월출산다원, 익산<b>산림</b>문화체험관, 취다선리조트,https://blog.naver.com/korea_diary?Redirect=Log&logNo=222354241080,위치  전남 강진군 성전면 월하안운길  익산산림문화체험관 사진제공 채지형 차밭은 전남 보성이 사진제공 채지형 월 가볼만한곳 익산산림문화체험관은 차 관련 다양한 프로그램을 진행하기 위해 
제주 <b>산림</b>조합 나무시장, 묘목들 저렴하게 구입했어요!,https://blog.naver.com/kuly17?Redirect=Log&logNo=222292719577,월에는 임협 산림조합에서 한시적으로 나무 시장을 엽니다 저도 해마다 월이면 산림조합 나무시장에서 많은 나무들을 사다가 와흘 밭과 마당에 심었습니다 벚꽃이 만발했던 지난주에 꽃 구경을 하고 집에 
충남대학교 학과소개 49편 <b>산림</b>환경자원학과,https://blog.naver.com/cnunow?Redirect=Log&logNo=222468063140,충남대학교 학과소개 편 농업생명과학대학 산림환경자원학과입니다 카드뉴스를 통해 산림환경자원과에 대해 알아보고 댓글을 통해 다음 학과는 어떤 학과일지 맞혀보아요 충남대  충남대학교 
[국립<b>산림</b>과학원 지금] <b>산림</b>약용자원 지능형 온실, <b>산림</b>용... ,https://blog.naver.com/kfri9612?Redirect=Log&logNo=222493790954,산림약용자원 지능형 온실 산림용 지능형 온실로 확장한다 국립산림과학원 지능형 연구온실 활성화를 위한 세미나 및 현장설명회 개최 국립산림과학원은 월 일수 산림약용자원연구소에서 
숲속의 작은집 (forest house) <b>산림</b>경영관리사 6월 5일 일상,https://blog.naver.com/hajongho?Redirect=Log&logNo=222386764541,숲속작은집 트레킹 오두막구조목진열대오일스테인잡초제거우드머그컵나무컵나무잔원목막걸리잔치유의길미약골홍천강발원지산림경영관리사힐링나만의공간사색행복평 해발준자연인 
“<b>산림</b>청이 자랑한 해외 탄소 감축 활동, 알고 보니 대규모 <b>산림</b>... ,https://blog.naver.com/kohj007?Redirect=Log&logNo=222488575556,산림청이 자랑한 해외 탄소 감축 활동 알고 보니 대규모 산림 파괴산림파괴청 환경운동연합 산림청 캄보디아  시범사업지에서 여의도 면적의 배에 달하는 산림 파괴비판  
<b>산림</b>청, 한반도 대표 원시림 점봉산 곰배령 <b>산림</b>유전자원 보호... ,https://blog.naver.com/coq?Redirect=Log&logNo=222363992636,쥐오줌풀 산림청청장 최병암이 미래세대를 위해 보전해야 할 인류의 자연유산인 점봉산 곰배령 산림유전자원의 엄격한 보호를 위해 년부터 제한적 탐방제사전예약제를 운영하고 있다 일 산림청에 
아이에게 선물하는 자연, 전남 5월 가볼만한곳 영광 <b>산림</b>박물관!,https://blog.naver.com/glory_yg?Redirect=Log&logNo=222349203463,전남 월 가볼만한곳 영광 산림박물관으로 랜선투어 떠나요  알록달록 화려한 봄의 색 맞물려 화려한 자태를 뽐내는 영광 산림박물관 영광힐링스팟 전남 월 가볼만한곳  전통 기와 특유의 우아미와 
‘<b>산림</b>영향권 확보’ 친환경 벌채 모범 제시,https://blog.naver.com/sinmunman?Redirect=Log&logNo=222265255362,산림영향권 확보 친환경 벌채 모범 제시  도 산림자원연구소 야생 동식물 서식처 등 산림 역할 중점 충남도 산림자원연구소소장 서도원는 일 보령시 도유림 내 친환경 벌채 를 완료했다고 
통영의 예쁜공원,  망일<b>산림</b>공원,https://blog.naver.com/tongyeongsi?Redirect=Log&logNo=221885312465,오늘은 새롭게 태어난 망일산림공원을 소개해 드립니다 신설된 공원답게 깨끗하고 위에서 바라본 그 중 한 곳 망일 산림공원입니다 이곳은 정량동 멘데마을 도시재생과 연계하여 산림공원으로 
<b>산림</b>청, 환경단체·<b>산림</b>생태복원단체 등과 백두대간서 나무... ,https://blog.naver.com/coq?Redirect=Log&logNo=222349477557,산림청청장 최병암은 탄소 흡수원 확충을 위해 일 백두대간 대관령에서 환경단체와 산림생태복원단체와 함께하는 산림복원 나무 심기 행사를 개최했다 이날 행사는 산림생태복원과 신설년 월 일을 
월간 <b>산림</b> 7월호,https://blog.naver.com/iriver720?Redirect=Log&logNo=222451980203,월간 산림 월호가 나왔어요 보통 초에 우편으로 받는데 그동안 제대로 펼쳐서 꼼꼼하게 읽어볼 시간이 뿐만아니라 우리나라 임업과 산림정보도 알 수 있어요 명산 괴상 선유동계곡과 화양동계곡 숲길 
숲과 행복, 그림으로 그려볼까요? - <b>산림</b>복지 어린이 그림 공모전,https://blog.naver.com/k-fowi?Redirect=Log&logNo=222109329691,출처산림복지 블로그기자단 기 박경숙 기자 가을 그림잔치가 열리고 있습니다 산림청 주최 한국산림복지진흥원이 주관하는 산림복지 어린이 그림 공모전을 소개합니다 한국산림복지진흥원 년차 블로그 
한국<b>산림</b>복지진흥원 하반기 채용, 합격 꿀팁이 궁금하다면?,https://blog.naver.com/k-fowi?Redirect=Log&logNo=222101904267,출처산림복지 블로그기자단 기 김윤경 기자 우리는 가끔 산림에 가서 치유를 받고 옵니다 반면 매일 산림 속에서 일하는 사람들도 있는데요 산림 속에서 일하는 건 어떨까 궁금했습니다 물론 방문할 
[글.이.브] 아마존의 신음…브라질 <b>산림</b>개발허가기준 완화 법안... ,https://blog.naver.com/kiepblog?Redirect=Log&logNo=222399225672,브라질 산림개발허가기준 완화 법안 하원 통과 지난 월 일 브라질 하원은 산림개발 허가 기준 완화 법안을 통과시켰고 해당 법안은 상원으로 넘어가 표결을 앞두고 있습니다 이 법안이 상원까지 
<b>산림</b>청-육군, <b>산림</b> 보호와 <b>산림</b> 재해에 맞손,https://blog.naver.com/coq?Redirect=Log&logNo=222309694006,산림청 산림보호국과 육군본부 육군참모부는 일 충남 계룡대에서 산림 보호와 산림재해 예방을 위한 업무협약을 체결했다 이날 협약은 산림 보호와 재해 예방을 위해 상호 간 적극적으로 협력하고 발전을 
한라산 둘레길 3구간 <b>산림</b>휴양길(서귀포 자연휴양림 숲길... ,https://blog.naver.com/wyindwyind?Redirect=Log&logNo=222457828070, 한라산 둘레길 구간 산림휴양길은 서귀포자연휴양림의 숲길 산책로와 같다고 보면 된다 의  한라산 둘레길 구간 산림휴양길에서 한라산 둘레길 구간 동백길로 접어드는 거다 강수량이 제일 
<b>산림</b>복지서비스 이용권 기한 내에 사용하세요,https://blog.naver.com/k-fowi?Redirect=Log&logNo=222107104080,출처산림복지 블로그기자단 기 엄윤주 기자 다양한 산림복지 서비스 중 산림복지 혜택을 받지 못하는 산림복지 소외자에게 지급되는 산림복지서비스 이용권의 사용 기한이 점차 도래하고 있습니다 
2021년 <b>산림</b>조합 나무시장 개장 및 나무 구입하기.,https://blog.naver.com/knkim2?Redirect=Log&logNo=222278462028,금년 봄에도 산림조합의 나무시장이 개장되고 필요한 나무들을 구입해서 지난번 봄날 나무 심기 평택과 안성 산림조합의 나무시장 플래카드 가격은 수목 화초의 생장 상태에 따라 다르기 때문에 
제주시, <b>산림</b> 내 불법행위 STOP! 드론 본격 투입!,https://blog.naver.com/wowjejusi?Redirect=Log&logNo=222308234587,제주시는 고해상도 산림드론을 활용하여 산림 내 불법행위 단속에 나설 예정입니다 제주시는 본격적인 행락철인 월부터 월까지를 산림 내 불법행위 특별단속기간으로 정하고 단속활동을 펼칩니다 이에 
2022년 강원세계<b>산림</b>엑스포 자원봉사협력 업무협약식,https://blog.daum.net/gwvc1365/1590, 사  강원도자원봉사센터와 조직위원회는  월  일  금  조직위원회 회의실에서  재  강원세계산림엑스포조직위원회  위원장 김태선  와  강원세계산림엑스포 자원봉사협력 업무협약식  을 
내몽고여행- 자작나무<b>산림</b>공원 (桦木沟国家森林公园), 우란부통... ,https://blog.naver.com/mayalee79?Redirect=Log&logNo=222412343827, 국가산림공원 자작나무 산림공원이란다 도착해서 보니 유료입장인데다가 지금은 전부 개방되어 있지않고 몇 군데만 볼 수 있단다 들어가야 하나 말아야 하나 고민하다가 
국립수산과학원과 국립<b>산림</b>과학원의 각별한 연구협력..,https://blog.naver.com/kohj007?Redirect=Log&logNo=222355580138,국립수산과학원과 국립산림과학원의 각별한 연구협력 양 기관 원장이 이끄는  연구협력 추진협의회 개최  국립수산과학원과 국립산림과학원의 각별한 
서울대공원 치유의 숲, <b>산림</b>치유 프로그램,https://blog.naver.com/finezoos?Redirect=Log&logNo=222309912558,년 서울대공원 새롭게 달라진 산림치유 프로그램을 소개합니다 먼저 치유의 숲이란 숲이 증진시키는 산림치유 목적으로 조성된 산림인데요 서울대공원의 숨겨진 보물 힐링의 공간입니다 
<b>산림</b>병해충분야  QGIS 실습교재 e-Book 무료 서비스,https://blog.naver.com/kofpi?Redirect=Log&logNo=222160559920,위한 산림병해충분야  실습교재  무료서비스 안녕하세요 무료 오픈소스 지리정보 프로그램인 의 실습 교재를 제공해드리고자 합니다 의 폭넓은 사용범위 중에서도 산림병해충 
<b>산림</b>청, <b>산림</b>일자리발전소 그루 매니저 4기 발대식 개최,https://blog.naver.com/coq?Redirect=Log&logNo=222391191917,산림청청장 최병암은 지역 맞춤형 산림 일자리 창출육성을 지원하기 위해 일 대전 서구 둔산동 한국임업진흥원 소나무재선충병 모니터링센터에서 산림 일자리발전소 그루 매니저 제기 발대식을 
국립<b>산림</b>과학원-홍릉시험림(홍릉숲),https://blog.naver.com/52pouch?Redirect=Log&logNo=222265269227,국립산림과학원 서울특별시 동대문구 회기로  운영시간 평일  주말 월  국립산림과학원은 출입기록을 수기나 코드로 하지않고 전화로 하는것이 특이했어요 전화한통으로 
개청 30주년 서부지방<b>산림</b>청… 지역특성 살린 <b>산림</b>경영 다짐,https://blog.naver.com/leebangheui?Redirect=Log&logNo=222377247488,월 일로 개청 주년을 맞은 서부지방산림청청장 조준규이 지역별 특성 살린 산림경영을 다짐했다 서부지방산림청은 년 월 일 남원영림서로 시작하여 년 월 일에 서부지방산림청으로 
인천<b>산림</b>조합, 코로나에 지친 시민들에 '나무' 선물,https://blog.daum.net/insufirst/7307289,산림조합 코로나에 지친 시민들에 나무 선물 댓글  미디어인천신문    문종권 기자 승인   일 인천시민 대상 무료 나무 나누어주기 행사 미디어인천신문 문종권 기자 인천산림조 
[한국<b>산림</b>복지진흥원] 2021년 녹색장학사업 장학생 선발 모집... ,https://blog.naver.com/paichaiuniv?Redirect=Log&logNo=222438228430,화 까지 산림일자리 장학금    월  금 까지 학업 장학금과 산림일자리 장학금으로 나누어져 있어서 본인에게 맞는 장학금으로 신청하시면 될 것 같아요 학업장학금 
스승의 날 행사 온석대학원대학교 <b>산림</b>치유복지학과, 감사하고... ,https://blog.naver.com/namoo528?Redirect=Log&logNo=222356026437,온석대학원대학교 산림치유복지학과를 설립하시고 고생만 하시다 가신 멘토교수님이 생각났기 온석대학원대학교 산림치유복지학과 새로운 직업에 관심을 가진분이나 나무숲과 함께 행복한 미래를 
<b>산림</b>조합 웃소 정기예금 2% 가입했어요,https://blog.naver.com/bluecaj?Redirect=Log&logNo=222258314961,가평산림조합에서 정기예금 가입하고 왔어요 정기적금 만기된 게 있어서 만기해지하러 갔다가 알게 산림조합이라서 비과세 혜택도 받을 수 있고요 정기예금 금리 면 이자가 많이 쌓이는 건 아니지만 
경남 남해 / 아이들과 함께 편백자연휴양림 <b>산림</b>복합체험센터,https://blog.naver.com/nadongyup?Redirect=Log&logNo=222346944241,그 이유중에 하나가 휴양림 안에 있는 산림복합체험센터 덕분이었습니다 산림복합체험센터는 무료로 즐길 수 있는 유아 실내놀이터 목공예체험 찜질체험실 체험존 등 체험을 즐길 수 있는 공간입니다 센터 
경주 <b>산림</b>환경연구원_가족 나들이,https://blog.naver.com/jeabasnap?Redirect=Log&logNo=222281535126,경주 산림환경연구원 입니다 주룩주룩 가을비가 내리던 날이였어요  후배 작가인 임스냅과 그의  경주 산림환경연구원의 핵심 포인트인 나무다리인데요 비가 오는 바람에 조심조심 또 조심 아가와 
코로나 블루 극복을 위한 위로와 치유의 온라인 <b>산림</b>치유 박람회,https://blog.naver.com/k-fowi?Redirect=Log&logNo=222129193835,출처산림복지 블로그기자단 기 박경숙 기자 온라인 산림치유 박람회라니 제목을 들어선 선뜻 이해가 되지 않는데요 숲에 가지 않고 집에서 인터넷 행사를 통해 숲 나들이한 듯 기분 전환이 될까요 
한-타지키스탄 <b>산림</b>분야 협력사업 주요현안 논의,https://blog.naver.com/coq?Redirect=Log&logNo=222301856657,타지키스탄 싹사울 조림 용기묘 준비 타지키스탄 피스타치오 조림 식재 준비 산림청청장 최병암은 일 현재 추진 중인 산림 분야 공적개발 원조사업 주요 현안 논의를 위해 타지키스탄 산림청과 비대면 
시대, 슬기로운 숲 생활을 위한 비대면 <b>산림</b>복지 서비스,https://blog.naver.com/k-fowi?Redirect=Log&logNo=222167221435,코로나가 장기화되면서 산림복지진흥원에서는 숲에 직접 가지 않고도 숲을 체험할 수 있는 비대면 산림복지 서비스를 제공하고 있습니다 더 간편하면서도 안전하게 즐길 수 있는 숲 체험 프로그램을 
비대면 <b>산림</b>교육 프로그램  ‘집으로 온 <b>산림</b>교육 학습지’,https://blog.naver.com/k-fowi?Redirect=Log&logNo=222107109828,출처산림복지 블로그기자단 기 엄윤주 기자 사회적 거리두기가 잦아진 요즘 일상의 많은 것들이 청소년을 대상으로 실시되고 있는 국립청도숲체원의 비대면 산림교육 프로그램을 소개합니다 집으로 
<b>산림</b>복합경영으로 산나물 명이나물(산마늘) 심었어요,https://blog.naver.com/mbksy?Redirect=Log&logNo=222084152620,산림복합경영으로 산나물 명이나물산마늘 심었어요 산림복합경영을 하는 호두대장 산나물 엄나무와 눈개승마 두릅에 이어 명이나물산마늘도 심기로 하였습니다 목본류로는 참나무 소나무 서어나무 
<b>산림</b>청 한국<b>산림</b>복지 진흥원 녹색자금 -숲체험,https://blog.daum.net/han903/992,산림청 한국산림복지 진흥원 녹색자금 숲체험 댓글  풍경 사진    녹색자금  복권위원회  산림청  우포늪 숲체험  푸른우포사람들  한국산림복지진흥원 코로나 영향으로 바깥 활동도 많은 제약을 
전남 나주 <b>산림</b>자원연구소 (메타세콰이어길),https://blog.naver.com/97109061?Redirect=Log&logNo=222267357930,가족 여행으로 년만에 다시 찾은 전남 나주 산림자원연구소 담양의 메타세쿼이아길메타세콰이어길 생명의 땅 전남 산림자원연구소 산림자원연구원이 아니었네요 ㅎㅎ 멋지지요 메타세콰이어길 
<b>산림</b> 속 일자리｜숲으로 출근하는 사람들,https://blog.naver.com/k-fowi?Redirect=Log&logNo=222095347123,출처산림복지 블로그기자단 기 권경원 기자 여러분 어떤 사람들이 숲으로 출근하시는지 아시나요 저도 산림으로 지로를 정해서 대학으로 왔지만 학년까지도 숲에서 어떤 사람들이 있는지 알지 
국립<b>산림</b>과학원, ‘<b>산림</b>치유 항노화 프로그램’ 운영,https://blog.naver.com/yjwu2004?Redirect=Log&logNo=222123851088, 몸과 마음이 젊어지는 공간 치유의 숲   산림청 국립산림과학원원장 전범권은 노인성 질환 중 하나인 뇌신경계질환의 증상 지연과 완화를 위하여 산림자원을 활용한 치유 프로그램인 산림치유 
2021년도 <b>산림</b>기술자 전문교육 시행,https://blog.naver.com/hayo_nada?Redirect=Log&logNo=222483092787,산림기술 진흥 및 관리에 관한 법률에 의하여 산림기술자 자격증은 관리되고 있다 산림기술자 자격증은 기초교육과 정기교육을 통해 산림기술자 전문교육을 이수 받아야 기술자격증을 
국립<b>산림</b>과학원, 정이품송 장자목 <b>산림</b>교육용 분양..,https://blog.naver.com/kohj007?Redirect=Log&logNo=222392091329,국립산림과학원 정이품송 장자목 산림교육용 분양 삼척국유림관리소 산림수목관찰원에 식재  정이품송 장자목이 산림교육용으로 분양됐다 산림청 
<b>산림</b>병해충 리테라 3월호(vol.1),https://blog.naver.com/kofpi?Redirect=Log&logNo=222291463105,산림병해충 정보 제공 및 수목관리에 대한 정보를 제공하기 위해 한국임업진흥원에서 산림병해충 소식지를 제작하였습니다 소나무재선충병 등 산림병해충에 대해 자세히 알고 싶었지만 찾기 어려우셨던 분들 
<b>산림</b>법인 준비 방법,https://blog.naver.com/maring02?Redirect=Log&logNo=222369625480,산림법인을 준비하는 방법에 대해서 자세하게 알아보도록 하겠습니다 산림사업의 종류에 따라 정해진 기준이 있습니다 기준을 충족해야 합니다 산림법인인 산림사업 종류는 가지 종류로 나눌 수 있습니다 
싱그럽게 즐기는 힐링 여유, 숲 캉스 추천 “청주 용정<b>산림</b>공원”,https://blog.naver.com/cjcityblog?Redirect=Log&logNo=222407149331,청주 용정산림공원을 다녀왔습니다 용정산림공원은 김수녕 양궁장 바로 맞은편에 위치하고 있습니다 도심에서 가까운 산림공원으로 울창한 숲과 잘 다듬어진 산책로로 남녀노소 누구나 걷기 좋은 
<b>산림</b>청, 숲 체험 <b>산림</b>교육센터 코로나19 방역 점검,https://blog.naver.com/coq?Redirect=Log&logNo=222341448680,부산 산림교육센터 와 숲 유아체험 프로그램 나 어릴적에 프로그램 나주산림교육센터 자연을 그리다 체험 프로그램 칠곡산림교육센터사진산림청 산림청청장 최병암은 특별 방역관리 주간월 일월 
<b>산림</b>기사 <b>산림</b>공학 2주차 시작하였습니다.,https://blog.naver.com/gip8066?Redirect=Log&logNo=222227317468,산림기사 자격증을 취득하고 다시 양산 임업기술훈련원에 입교해서 주간의 소정의 교육을 이수하면 산림 공학 기술자 자격증을 받게 됩니다 양산 임업기술훈련원에서 총교육시간은 시간 오전 시부터 
<b>산림</b>청, 기후위기 적응을 위한 <b>산림</b>생물 다양성 증진 전략 강화,https://blog.naver.com/coq?Redirect=Log&logNo=222360090178,산림청청장 최병암은 일 국제 생물 다양성의 날을 맞아 제차 산림생물 다양성 기본계획 추진상황을 점검하고 향후 정책추진을 철저히 하기로 했다 일 산림청에 따르면 국제 생물 
광해방지기술 개발사업 - <b>산림</b>복구편,https://blog.naver.com/mireco2016?Redirect=Log&logNo=222308699340,오늘은 푸른 지구를 위해 노력하는 한국환경공단의 산림복구 사업에 대해 이야기합니다 내일의 지구를 위한 움직임 한국광해관리공단은 산림탄소상쇄사업을 통해 광산개발로 인한 폐탄광 산림복구지를 
[ 나주 여행 ] 나주 메타세콰이어길 &quot;전라남도 <b>산림</b>자원연구소&quot;,https://blog.naver.com/wihana2010?Redirect=Log&logNo=222299019841, 나주 여행  나주 메타세콰이어길 전라남도 산림자원연구소 봄 벚꽃 말고 하  나입니다 주말마다 나주 산림자원연구소가 생각나는 오늘이에요 모 하냥 벚꽃 지면 어디가냥  보자 보자 보자 어디 가 
<b>산림</b>토양과 경작토양을 비교 설명하라,https://blog.daum.net/k0ks0/5885765,산림토양과 경작토양을 비교 설명하라 댓글  생리학     산림토양과 경작토양의 일반적인 차이점  괄호 안은 근거를 설명함   본 표는 한국과 같이 경사지 산림토양에만 적용할 수 있음  
평창국유림관리소, '<b>산림</b> 드론 감시단' 운영,https://blog.naver.com/pc_happy700?Redirect=Log&logNo=222285675989,평창국유림관리소가 산불을 예방하기 위해 산림 드론 감시단을 운영한다고 해요 월 일부터 월 평창국유림관리소는 건조한 봄철에 발생하는 산불예방 활동을 강화하기 위해 월 일까지 산림 드론 
<b>산림</b>기사 취득- 나름 노하우 방출기,https://blog.naver.com/qinghai104?Redirect=Log&logNo=222086784138,이 이야기를 하는 이유는 산림기사를 목표로 한다면 비전공에 문과출신이든 나이가 이 넘었다는 것이 불편할 수는 있지만 장애물은 아니라는 것을 알려주기 위함이다 산림기사 가 되기 위한 내 
남산 솔바람 오감힐링여행 <b>산림</b>치유 프로그램,https://blog.naver.com/jylhee0704?Redirect=Log&logNo=222159533314,이 친구와 함께 사전 예약을 통해 남산 솔바람 오감힐링 여행이라는 산림 치유 프로그램에 참가하였답니다 이 문이 잠겨 있어서 평소에는 개방되지 않는 곳이구요 사전 예약을 통해 명에 한해 산림치유사님 
[이벤트] <b>산림</b>복지 어린이 그림 공모전 (유아, 초등 집콕놀이),https://blog.naver.com/k-fowi?Redirect=Log&logNo=222102833305,그렇다면 사회적 거리두기를 위한 비대면 공고전 산림복지 어린이 그림 공모전을 추천해요 유아 산림복지 어린이 그림 공모전 주제 이번 어린이 그림 공모전의 주제는 숲이 주는 복지혜택 산림복지예요 
[국립<b>산림</b>과학원 지금] <b>산림</b>에 원격탐사, 인공지능 융합하여... ,https://blog.naver.com/kfri9612?Redirect=Log&logNo=222490202110,산림에 원격탐사 인공지능 융합하여 첨단 산림관리 달성 국립산림과학원 제차 산림 정보통신기술 토론회 개최 디지털 산림관리 및 정밀 임업 실현을 위한 산림 정보통신기술 연구 강화할 것 
노을 맛집...군산 국립신시도자연휴양림 <b>산림</b>문화휴양관 하현달,https://blog.naver.com/doojool69?Redirect=Log&logNo=222300271765,그나마 산림문화휴양관 평일 순위 대기 걸어 놓은 게 운 좋게도 차례가 왔기에 새로운 휴양림을 저희가 이번에 머물렀던 산림문화휴양관에 대해서 잠시 알아보기로 하겠습니다 국립신시도자연휴양림의 
[오늘도 숲에 갑니다]<b>산림</b>교육과 치유로 소통하는 미래를 꿈꾸며,https://blog.naver.com/k-fowi?Redirect=Log&logNo=222178369910,그중에서도 체계적인 프로그램을 앞세운 산림교육치유가 세계무대에 진출했다 산림교육치유로 세계와 소통하는 시작이 될 무하마드 널 시암시 숲해설가를 소개한다 글 사진 편집실 한국의 산림복지를 
금강자연휴양림 금강수목원 <b>산림</b>박물관 방문기,https://blog.naver.com/hero290?Redirect=Log&logNo=222446460412,장애인도 갈수있는 나무테크길 산림박물관 온실 향도 나고 산림에 대한 정보가득 백두대간 미로원은 폐쇄 잘보고 갑니다 금강수목원 산림박물관 나눔길 시간정도 관람하면 됩니다 꼼꼼히 보면 산책로 다 
국립<b>산림</b>품종관리센터,https://blog.naver.com/seefuture?Redirect=Log&logNo=222436136947,국립산림품종관리센타 충주시에 위치한 국립산림품종관리센타에 약초 견학실습을 왔습니다 이곳은 산림청 산하의 소속기관이구요 산림자원의 고품질 우량품종 생산및 보급역할을 수행하는 곳입니다 
국립장성숲체원, VR로 <b>산림</b>치유가 가능해지다,https://blog.naver.com/k-fowi?Redirect=Log&logNo=222076287387,출처산림복지 블로그기자단 기 윤혜숙 기자 코로나의 장기화로 비대면 산업이 뜨고 있습니다 가상현실에서 산림치유 프로그램을 경험할 수 있는 시범 서비스를 제공하고 있습니다 최근 공공기관의 
<b>산림</b> 속에서 힐링_금강 자연휴양림,https://blog.naver.com/macc2030?Redirect=Log&logNo=222089073520,산림 속에서 힐링하기 금강 자연휴양림 행복도시에는 산림과 교감하며 힐링할 수 있는 곳들이 많은데 그중에서도 금강 자연휴양림을 빼놓을 수 없죠  금강 자연휴양림은 수목원과 휴양림으로 구성되어 
