제목,링크,내용
건강한 <b>산림</b>생태계를 가꾸는 대한민국 최상위 포식자 담비,https://blog.naver.com/kecoprumy?Redirect=Log&logNo=222207324168,건강한 산림생태계를 가꾸는 담비를 소개합니다 담비는 도시화가 시작되기 전 우리나라에서는 전국의 담비는 산림생태계의 건강 수준을 가늠할 수 있는 지표종이자 우리나라 생태계 균형을 유지하는 데 
2021년 <b>산림</b>복지 어린이 그림 공모전 - 마스크 밖 &quot;희망의 숲&quot;,https://blog.naver.com/k-fowi?Redirect=Log&logNo=222300429208,작년 가을 진흥원에서 개최했던 산림복지 어린이 그림 공모전을 기억하시나요 아이들의 순수하고 다채로운 시선으로 그려진 멋진 작품들이 많이 나왔는데요 한국산림복지진흥원이 올해도 월 일월 
동계팔경 양평치유의숲 <b>산림</b>치유 힐링캠프,https://blog.naver.com/image114?Redirect=Log&logNo=222349054659,조선시대 선비의 산림휴양문화 풍류와 산림치유에 관한 주제로 선비들의 봄나들이 행사가 있습니다 일시  년 월 금일 장소  국립양평치유의숲양동면 황거길 월 일금 
정선군, <b>산림</b>조합과 드라이브스루 판매,https://blog.daum.net/morningnewsi/8553358,정선군 산림조합과 드라이브스루 판매 댓글  경제기업소비자    차 안에서 정선의 임산물 구입하세요 정선군이 산림조합과 함께 청정 정선에서 생산되는 건강한 먹거리인 봄철 인산물을 
경상남도수목원내의 <b>산림</b>박물관(진주 두달살기 2021.6.17),https://blog.daum.net/kyh0221/3153,경상남도수목원내의 산림박물관진주 두달살기  댓글  나의 이야기    산림과 임업에 관한 역사적 보고 및 문화향유의 장 경상남도 산림박물관은 산림과 임업에 관한 역사적 자료 전시 및 
치매 완화·예방하는 양산형 <b>산림</b>치유,https://blog.naver.com/eyangsancity?Redirect=Log&logNo=222497733093,양산형 산림치유 인지건강 증진 프로그램을 개발운영합니다 지역 치매 환자는 물론 환자가족들께서도 반기실 만한 소식인데요 환자와 가족들의 삶의 질이 더욱 향상될 수 있도록 돕는 양산형 산림치유 
은평구, 서울시 도심권 내 최초로 <b>산림</b>유역관리사업 시행,https://blog.naver.com/coreap6?Redirect=Log&logNo=222421448203,최초로 산림유역관리사업을 시행하였다고 밝혔다 해당 대상지는 계류내 전석분포 비율이 높고 계상에 토사가 많아 집중 강우 발생 시 월류의 위험성이 있어 산림의 공익생산기능을 증대할 수 있는 종합적인 
경주 <b>산림</b>환경연구원 나만 알고싶은 숨은 여행코스,https://blog.naver.com/delidea?Redirect=Log&logNo=222387422992,근데 이번 경주여행코스 에서 가장 마음에 들었던 곳이 바로 경주산림환경연구원 이라는 곳이랍니다 경주 여행 코스 짤때 전혀 생각해본 적 없는 곳인데 카페에서 괜찮다는 이야기를 듣고 경주산림연구원 
<b>산림</b>기술자 교육·훈련 비용은 사업자 부담입니다,https://blog.naver.com/trippleg?Redirect=Log&logNo=222468409944,산림기술진흥 및 관리에 관한 법률에 따라 시행 중인 산림기술자 교육훈련 제도가 시행되고 있고 많은 산림기술자들이 참여하였습니다 하지만 일부 산림기술자들이 자비로 교육비 등의 일체의 비용을 
공주 가볼만한곳 공주<b>산림</b>휴양마을 언택트 여행,https://blog.naver.com/dailytalk_hy?Redirect=Log&logNo=222218693551,공주 가볼만한곳 공주산림휴양마을 언택트 여행 앙상한 나뭇가지에 꽃망울 맺혀 이내 톡 터져 꽃 피는 거기에 산 생각까지 겹치며 오늘의 여행기 주제가 공주산림휴양마을로 자연스럽게 확정되었다 
* 나주 남평유딜라이트 카페 , 나주 <b>산림</b>자연연구소 나들이... ,https://blog.naver.com/jjo_jjin?Redirect=Log&logNo=222425975005,나주 산림 자연 연구소 연중무휴 개방 엄마께서 한번 가보자고 하셔서 갔는데 사진을 많이 산림연구소여서 정말 다양한 식물들 연구 중이더라구요 솔직히 저는 식물원 같은 느낌 생각했는데 아니었어요 
2021.05.22 [공립]금산<b>산림</b>문화타운,https://blog.naver.com/area88shin?Redirect=Log&logNo=222397298735,금산산림문화타운 대기로 넣었던 곳이 운좋게 예약을 할 수 있게되었다 입실 시간 보다 시간 금산 산림문화 타운은 옆에 계곡을 끼고 있고 야영장   곳에 휴양관도 있고 일 사용료 만원짜리 
홍릉숲 - 국립<b>산림</b>과학원,https://blog.naver.com/bizmaker?Redirect=Log&logNo=222361731774,로 간 곳이 홍릉숲 홍릉수목원 국립산림과학원 이다 가서보니 대박 하루에 볼 수 있는 곳이 아니었다 홍릉수목원으로 알려진 이곳은 국립산림과학원이다 홍릉수목원 중국굴참나무와 반송 홍릉터 
<b>산림</b>기사/산업기사-조림학(국내<b>산림</b>현황),https://blog.naver.com/redkillss?Redirect=Log&logNo=222472930366,산림기사산업기사 직무 분야 농림어업 중 직무 분야 임업 자격 종목 산림기사 적용기준  산림과 관련한 기술 이론 지식을 가지고 임업종묘 산림조성 산림공학 산림보호 임산물 생산 
[서귀포치유의숲] <b>산림</b>치유프로그램으로 내 몸의 긍정적인... ,https://blog.naver.com/seogwipo-si?Redirect=Log&logNo=222425349420,산림치유라고 들어보셨나요 산림치유는 숲에 존재하는 다양한 환경요소를 활용하여 인체의 면역력을 높이고 신체적정신적 건강을 회복시키는 활동을 말합니다산림문화휴양에 관한 법률 제 조 
한국수목원 정원관리원·국립한국농수산대학, <b>산림</b>문화 확산에... ,https://blog.naver.com/coq?Redirect=Log&logNo=222424535738,한국수목원 정원관리원이 국립한국농수산대학과 함께 산림과학 연구 발전을 통한 산림문화 확산에 적극 나선다 한국수목원 정원관리원이사장 류광수한수정은 일 국립백두대간수목원 산림환경연구동에서 
백제역사 문화 탐방과 공주<b>산림</b>휴양마을,https://blog.naver.com/july1999?Redirect=Log&logNo=222397860736,왕릉보전으로 입구가 폐쇄된 무녕왕릉의 모습 잠자리를 청하기 위해 도착한 마지작으로 도착한 공주산림휴양마을 음 계곡도 없고 시원한 바람도 불지 않고 그렇다고 체험할 시설이 많지도 않은 나에겐 
충북[제천토지/덕산면] <b>산림</b>경영/약초/유실수 재배지...임... ,https://blog.naver.com/gks6396?Redirect=Log&logNo=222455872703,위치  충북 제천시 덕산면 선고리 지목임전 면적임 평  전평 합평 용도지역  생산관리지역 도로  전기 수도 추천용도산림경영산림조합원  약초 
홍릉수목원(국립<b>산림</b>과학원) 식물이름 알아보기,https://blog.naver.com/dongnam2c?Redirect=Log&logNo=222425464283,지난  우리나라 최초의 수목원인 홍릉수목원국립산림과학원 홍릉숲 국립산림과학원 산수국 수국 노각나무 쌍떡잎식물 물레나물목 차나무과의 낙엽활엽 교목 산중턱 이상에서 자란다 높이는  
충주 산사태구간 <b>산림</b>원상복구 '녹생토10T' 시공,https://blog.naver.com/lmy6681?Redirect=Log&logNo=222424685102,산사태 산림원상복구 녹생토공사 산사태 산림원상복구 녹생토공사 충주현장은 약 현장으로 거름이 톤차기준 한대분 정도 필요합니다 그런데 충주현장이 산 중턱에 위치한 현장이라 톤차량이 
한라생태숲, ‘자연과 교감하는 <b>산림</b>교육’확대 운영,https://blog.naver.com/happyjejudo?Redirect=Log&logNo=222310682977, 월월까지 다양한 숲 체험 프로그램 운영  산림청 인가 산림교육 인증프로그램 첫 선  제주특별자치도 한라생태숲이 코로나 등으로 인해 지친 몸과 마음을 위로하고 누구나 쉽게 일상 속에서 숲과 
사회적 경제박람회.. <b>산림</b>의 사회적가치 알려,https://blog.naver.com/coq?Redirect=Log&logNo=222417519366,산림청청장 최병암은 일까지 광주시에서 열리는 제회 대한민국 사회적 경제박람회에 산림 분야 사회적 경제 기업이 참가해 산림 분야 사회적 경제에 대해 홍보를 진행한다 사회적 경제박람회는 각 
여수 흥국사 <b>산림</b>공원 불법텐트 야영행위 단속합니다...,https://blog.naver.com/jyt8919?Redirect=Log&logNo=222393570401,여수 흥국사 산림공원 여수 아이들과 물놀이 하기 좋은 장소로 손꼽히던 흥국사 산림공원 어른들은 돗자리 깔고 휴식하기 좋고 아이들은 소소하게 물고기를 잡으며 놀기좋아 여름철이면 인기가 높은곳인데 
<b>산림</b>기능사 제 2의 직업으로 정했다,https://blog.naver.com/cys990619?Redirect=Log&logNo=222271813963,무언가 대처가 필요하다고 느꼈고 조림 및 숲 가꾸기 산림보호 임업기계 등에 업무를 수행하는 산림기능사에 눈길이 갔어요 평소에도 식물을 키우며 행복을 느꼈던 저였기에 저에게 제격이라는 생각이 
[국립<b>산림</b>과학원 지금] 국내 식물 정유, 산업 소재로 개발 시동,https://blog.naver.com/kfri9612?Redirect=Log&logNo=222500169001,국내 식물 정유 산업 소재로 개발 시동 국립산림과학원 정유를 활용한 화장품 및 식의약소재 국립산림과학원은 이와 같은 글로벌 시장 변화에 전략적으로 대응하고 국내 정유의 경쟁력 향상 방법을 
영주여행 - 국립<b>산림</b>치유원과 영주호오토캠핑장,https://blog.naver.com/soopia719?Redirect=Log&logNo=222378775680,영주에 있는 국립산림치유원에 묵을 기회가 생겼다 일찍 가서 소백산자락길도 걷고 그 다음날은 자락길을 완주하지 못하고 금계중학교쪽에서 동양대 앞으로 내려와 늦은 점심요기를 하고 쉬었다가 산림치 
세종시, 농협·<b>산림</b>조합 앱 등 활용 벌초 대행 서비스 진행... ,https://blog.naver.com/coq?Redirect=Log&logNo=222491272224,농협산림조합과 협력해 비대면 벌초 서비스를 진행한다 이번 서비스는 벌초를 위한 가족 농협이나 산림조합에 문의하면 된다 농협은 인터넷 신청은 물론 올해부터 벌초 대행 
공주 가족여행 <b>산림</b>휴양마을 코로나19 날려버리자!,https://blog.naver.com/cyber_gongju?Redirect=Log&logNo=222376957040,공주 산림휴양마을 꼭 방문해보세요 도심생활에서 잠시 떠나 질 높은 자연 속 휴양 시설을 공주 산림휴양마을은 년 월 일 개장하여 자연휴양림 목재문화체험장 자생식물원 등으로 아기자기하게 
<b>산림</b>산업기사 필기 실기 필답형 인강추천,https://blog.naver.com/pkw2205?Redirect=Log&logNo=222378703674,산림산업기사 필기 실기 필답형 인강추천 비가 너무 자주 오는 거 같네요 설마 벌써부터 장마 오늘은 산에 관심 있는 분이라면 알만한 자격증 산림산업기사 시험정보 좀 알려드리려 합니다 
대전 아이랑 가볼만한 곳 국립대전숲체원 <b>산림</b>체험마당... ,https://blog.naver.com/seging?Redirect=Log&logNo=222431034189,대전 아이와 가볼만한 곳 국립대전숲체원 글 사진  박앙꼬 주차하고 둘러보는데 산림체험 마당이라는 것이 있었다 주말과 공휴일만 진행한다는 산림체험마당 숲속도서실에서 운영중인데 당일 
[귀산촌 아카데미] <b>산림</b> 복합 조성과 경영,https://blog.naver.com/iblaze?Redirect=Log&logNo=222371847727,일자  주관 한국임업진흥원 강사 예당 산양삼농원강원도 산양삼협회 강진홍 회장  산림복합경영단지 지원사업자부담 은 산림 작물 생산단지 지원사업자부담 과 달리 
월간 <b>산림</b> 2021년 1월호,https://blog.naver.com/iriver720?Redirect=Log&logNo=222204878943,월간 산림은 매달 발행하는 월간지로 여행 숲 문화 등 다양한 이야기를 접할 수 있어요 제가 지난해에 이어 올 년도 산림청 산하기관인 산림조합에서 펴내는 월간지 산림 반려식물인테리어 작가를 
남해 편백자연휴양림 <b>산림</b>복합체험센터,https://blog.naver.com/yann13?Redirect=Log&logNo=222405700326,혹시 남해편백휴양림 을 방문 하시는 분은 산림복합체험센터 는 꼭 한번 들려보시고 가시길 추천 우선 산림복합체험센터 는  관으로 준비되어 있고 주로 관에서 아이들이 놀거리가 많다 입구 로비에는 
<b>산림</b>교육전문가와 함께 배우는 숲, 치유하는 숲,https://blog.naver.com/gnfeel?Redirect=Log&logNo=222264206876,도민에게 산림 휴양 체험 기회를 제공합니다 산림휴양시설 이용자들에게 숲 해설과 여가 프로그램 등을 제공해요 코로나로 인해 도민들이 많이 힘들어 하고 있는 시점에서 산림을 통해 치유할 수 있는 
강원도 <b>산림</b>의 중요성을 알 수 있는 곳! &quot;강릉 숲사랑홍보관&quot;,https://blog.naver.com/gogw1234?Redirect=Log&logNo=222271711595,강원도 산림의 중요성을 알 수 있는 곳 강릉 숲사랑홍보관 월 일부터 월 일까지는 산불예방에 소중한 산림은 산불 피해를 입게 되면 다시 복구하는데 매우 오랜 시간이 소요돼요 따라서 산림의 
<b>산림</b>복지 어린이그림공모전(4/5~5/28) 공유,https://blog.naver.com/children98?Redirect=Log&logNo=222300208767,가져왔어요 산림복지그림공모전 공모주제 는 마스크밖 희망의 숲이네요  아아 주제를 보는 부착  산림복지 어린이그림공모전 운영사무국 우편발송 접수기간  오 서둘러야겠어요 ㅋ 
[세종여행] 금강수목원, <b>산림</b>박물관, 황토메타길,https://blog.naver.com/happyfleurs?Redirect=Log&logNo=222377644408,했던 산림박물관 에 가보기로 했어요  사진 찍기 좋아하는 엄마와 늘 함께하다 보니 예쁜 풍경을 보면 사진을 찍어달라고 해요ㅎㅎ 독사진을 요청하기도 하고요  슬슬 점심시간이 다가오는데 산림박물관 
<b>산림</b>청-국가보훈처, ‘보훈의 숲’ <b>산림</b>경영 활동 협력을 위한... ,https://blog.naver.com/coq?Redirect=Log&logNo=222439598815,산림청청장 최병암 사진 왼쪽은 일 국립대전현충원에서 국가보훈처처장 황기철 사진 오른쪽와 보훈의 숲 산림경영 활동 상호 협력을 위한 업무협약을 체결했다 산림청청장 최병암은 일 
&lt;함께해요~ 환경사랑+&gt; 산의 날 맞이 <b>산림</b>보호 꿀팁 공유 이벤트,https://blog.naver.com/kecoprumy?Redirect=Log&logNo=222102805252,월 일은 국제 연합이 년 당시를 세계 산의 해로 선언한 것을 계기로 하여 산림에 대한 국민들의 인식을 제고하고자 산림청에서 지정한 산의 날인데요 월 일이 산의 날로 지정된 이유는 우리나라 
태백시 <b>산림</b>산업 클러스터 조성, 420억 규모 지역균형뉴딜... ,https://blog.daum.net/morningnewsi/8553462,태백시 산림산업 클러스터 조성 억 규모 지역균형뉴딜 추가사업 선정 댓글  하나리포터뉴스  일 시에 따르면 폐광지역 산림자원을 활용한 산림산업 클러스터 조성 사업을 지난 월일 신청 일 
<b>산림</b>기사/산업기사-조림학(국내외<b>산림</b>현황),https://blog.naver.com/redkillss?Redirect=Log&logNo=222471474010,산림기사산업기사 직무 분야 농림어업 중 직무 분야 임업 자격 종목 산림기사 적용기준  산림과 관련한 기술 이론 지식을 가지고 임업종묘 산림조성 산림공학 산림보호 임산물 
[입장문]<b>산림</b>청의 탄소중립 계획은 <b>산림</b>생태계 파괴하는 대규모... ,https://blog.naver.com/kfemblog?Redirect=Log&logNo=222349774016,산림청의 탄소중립 계획은 산림생태계 파괴하는 대규모 벌목사업  최근 산림청 브리핑 국회 토론회에 대한 환경운동연합 입장  산림청은  탄소중립 산림부문 추진전략에 대한 환경단체의 
@ 경주 전기자전거 여행 / 시외버스터미널에서 경북<b>산림</b>환경연... ,https://blog.naver.com/herosz77?Redirect=Log&logNo=222417235146,경북산림환경연구원 이었다 교촌마을에 있는 월정교 유채꽃밭 경북산림환경연구원 경북산림환경연구원 근처 시골길 우연히 지나갔지만 알고보니 경주박물관 근처 논길 다시 교촌마을 월정교  이렇게 
나주여행 전라남도 <b>산림</b>자원연구소 도래마을,https://blog.naver.com/mizeme?Redirect=Log&logNo=222360806133,전라남도 산림자원 연구소를 찾았다가 깜놀 했답니다 논이나 물이 있는곳에서 서식하는 양서류가 따라 산림자원연구소 한바퀴 둘러 보았답니다 산림 병해충에 대한 연구를 하는 전남 산림자원연구소는 
나주 메타세콰이어 길, <b>산림</b>자원연구소 소개,https://blog.naver.com/lsy5088?Redirect=Log&logNo=222359943937,나주 메타세콰이어 길 산림자원연구소 소개 조이스터 메타세콰이어 길 하면 생각나는 곳이 담양 그 이름도 독특한 산림자원연구소 안에 위치해 있지요 이곳은 이름은 독특해도 입장료도 없는 착한 수목원 
구미 가볼만한곳, 구미 도량<b>산림</b>공원에서 시원한 하루 보내요!,https://blog.naver.com/pride_gb?Redirect=Log&logNo=222425699519,구미 가볼만한곳 구미 도량산림공원에서 시원한 하루 보내요 경상북도 구미시 도량동 산에 위치한 구미의 산책로 맛집을 담당하고 있는 구미 도량 산림공원에 다녀왔습니다 드론으로 봐도 상당히 넓고 
<b>산림</b>복지서비스이용권, “사용 후기 남기고 상품 받아가세요”,https://blog.naver.com/k-fowi?Redirect=Log&logNo=222392238950,비대면 산림복지서비스 출시 기념 이벤트 실시 산림청 한국산림복지진흥원원장은 이달 일부터 한 달간 산림복지서비스이용권 사용 후기 이벤트를 실시한다고 밝혔습니다 이번 행사는 비대면 
'<b>산림</b>문학' 2021년 여름호의 시,https://blog.daum.net/jib17/13746615,산림문학 년 여름호의 시 댓글  문학의 향기     나무처럼 이 세상 오직 한곳에 깊이   산림문학   년 여름 통권  호에서 공유하기 글 요소 저작자표시 비영리 댓글  비밀글 글쓰기
전북지역 <b>산림</b>사업 안전사고 제로 서로 힘 보태야,https://blog.naver.com/leebangheui?Redirect=Log&logNo=222399175393,전북지역 산림사업 현장에서 사고사망이 발생하지 않도록 노력하여 임업분야 재해율을 감소시키고자 개 기관이 힘을 합하기로 했다 서부지방산림청장청장 조준규은 일 안전보건공단 전북지역본부 
세계<b>산림</b>비율31% <b>산림</b>면적비율순위,https://blog.naver.com/kdw9763?Redirect=Log&logNo=222327145837,지구촌온난화 로 이상기후가 계속되는 가운데 지구촌 허파역할을 하는 산림면적이 계속 감소하는 것으로 나타나 심각해지고 있다 산림면 
공주 <b>산림</b>휴양마을 후기(2021.5.5.),https://blog.naver.com/flnalnt?Redirect=Log&logNo=222371405948,이번 달 초에 다녀온 공주 산림휴양마을 캠핑장 후기입니다 따끈따끈하게 바로바로 올려야 하지만 공주 산림휴양마을은 숲 나들이에서 예약하실 수 있습니다 국립이다 보니 사설 캠핑장에 비해 금액이 
<b>산림</b>특별사법경찰, 인천·경기 일원 <b>산림</b> 내 불법행위 집중 단속,https://blog.naver.com/coq?Redirect=Log&logNo=222405109966,산림특별사법경찰이 전자도면을 이용해 무단훼손지 여부를 확인하고 있다사진산림청 산림특별사법경찰이 국유림 내 무단훼손 현장을 확인 중이다 산림청청장 최병암은 월 일부터 월 일까지 인천 
<b>산림</b>레포츠시설조성 절차,https://blog.naver.com/bmwh2020?Redirect=Log&logNo=222420277920,산림레포츠시설조성 절차 산림레포츠란 산림 안에서 이루어지는 모험형체험형 레포츠를 말하는데 종류에는 암벽등반 산악자전거산악마라톤 산악승마산악스키래프팅 행패러글라이딩 오리엔티어링 
<b>산림</b>과학기술분야 창의인재 양성의 초석, 발명교육,https://blog.naver.com/kofpi?Redirect=Log&logNo=222078356682,산림과학기술 혁신성장을 위한 역량강화로 발명교육에 대해 소개해 드리려고 합니다   한국임업진흥원은 산림과학기술의 연구개발성과 보급 및 사업화 촉진에 노력하고 있으며 산림청 및 
<b>산림</b>사업법인 진행하기,https://blog.naver.com/maring02?Redirect=Log&logNo=222431331958,산림사업법인 진행 방법에 대해서 자세하게 알아보도록 하겠습니다 기준을 따라야 하며 기준에 따른 증빙이 반드시 가능해야 인정받습니다 산림사업법인 신규 등록 기준은 자본금 기술자 사무실로 나눌 수 
나주 <b>산림</b>자원연구소,https://blog.naver.com/tjdus_sy?Redirect=Log&logNo=222495584018,나주 나주여행지 나주가볼만한곳 산림자원연구소 두 달 전쯤 다녀온 산림자원연구소 담양에 여행갔을 때 메타세콰이어 길에 가서 사진을 찍고 싶었는데 유료여서 그냥 지나쳤던 기억이 있는데요 여기 
세종 실내 여행하기 좋은 곳, 충남<b>산림</b>박물관,https://blog.daum.net/goood33/2477,세종 실내 여행하기 좋은 곳 충남산림박물관 댓글  여행충청도여행    금강수목원열대온실  세종실내여행 충남산림박물관 금강수목원 세종시에서 추운 겨울에 실내에서 여행하기 좋은 곳으로 
<b>산림</b>경영계획서 작성하고 탄소배출권 받아가세요,https://blog.naver.com/trippleg?Redirect=Log&logNo=222382506965,산림기술사사무소 트리플는 울산광역시에 소재하고 있으면서 전국 단위의 여러 종류의 산림사업을 수행하고 있습니다 저희 사무소에서는 산림경영계획서도 작성하여 드리고 있습니다 년도 
진천 생거진천 자연휴양림의 초여름 모습...휴양림내 <b>산림</b>습지... ,https://blog.naver.com/knkim2?Redirect=Log&logNo=222420739197,생거진천 자연휴양림의 초여름 모습 특히 산림습지와 무장애 나눔길을 담아본다 휴양림 휴양림 입구 일반적인 휴양림의 구성인 산림문화휴양관 숲속의 집 어린이 놀이장 다목적운동장 야영장 등이 있고 
&lt;에코 힐링(ECO HEALING)&gt;<b>산림</b>교육 치유 전문잡지,https://blog.naver.com/7444ok?Redirect=Log&logNo=222452271665,에코 힐링 은 산림교육 치유 전문잡지다 숲은 태교에서 유아체험 청소년기 청년기 숲과 함께 걷는 장년기 산림치유의 노년기에 이르고 이어 수목장림에 이르기까지로 영원한 안식으로 가는 숲 
강화군<b>산림</b>조합 2021년 상반기 <b>산림</b>조합 상호금융 종합평가... ,https://blog.naver.com/nfcfkh?Redirect=Log&logNo=222497871243,년 상반기 상호금융 종합평가 은상 강화군산림조합 강화군산림조합조합장 권영태이 년 상반기 산림조합 상호금융 종합평가에서 은상을 수상하였습니다 상호금융 종합업적평가는 산림조합중앙회에서 
산책로 잔디공사 제천 보행로 <b>산림</b>원상복구 현장,https://blog.naver.com/lmy6681?Redirect=Log&logNo=222390908428,훼손한 산림은 원상복구 해야 하는 의무가 있습니다 그래서 법면녹화공사를 함께 진해하는데요 이번엔 충북 제천에 산책로 현장입니다 산책로 잔디공사 산림원상복구 현장 산책로 잔디공사 산림원상복구 
[<b>산림</b>치유 리포트]... 만들다, 국립<b>산림</b>치유원 치유음식연구팀,https://blog.naver.com/k-fowi?Redirect=Log&logNo=222178408565,편집실 치유음식지수로 건강한 식문화 조성 경북 영주예천에 조성된 국립산림치유원 치유음식연구팀은 치유음식 개발을 위해 산림생태텃밭 을 활용한다 산림생태텃밭은 식용약용식물의 특성을 
<b>산림</b>경영관리사 신청 및 절차,https://blog.naver.com/chunjinbin?Redirect=Log&logNo=222221755638,이전 게시물을 통해 복잡한 건축사를 통한 방법이 아닌 신고서를 통한 산림경영관리사를 건축 할 수있다는걸 알았습니다 이번엔 산림경영관리사를 건축시 절차및 관련 서류비용등에 관하여 알아보도록 
전남<b>산림</b>자원연구소, 우량종자 보급으로 탄소중립 앞장,https://blog.naver.com/youngjin6690?Redirect=Log&logNo=222414626593,기자 전남산림자원연구소가 도내 조림사업에 사용할 우량 종자 확보를 위해 종자 결실상황 등 산림사업에 수급되는 종자는 우량 묘목 생산을 위해 지정한 종자공급원채종원채종림채종임분에서 
