제목,링크,내용
<b>산림</b>조합 나무전시 판매장… 가격이 만만찮다.,https://blog.naver.com/modu114?Redirect=Log&logNo=222250475332,김해시 산림조합에서 년 새봄을 맞아 나무전시장을 개장한다는 플랜카드 광고를 보고 오늘 마침 필요한 수종과 품종을 파악하여 리스트를 가지고 갔지만 정작 찾는 것은 절반수준  김해시 산림조합 
선도<b>산림</b>경영과 풀베기사업 (모두베기 현장),https://blog.naver.com/cafcf?Redirect=Log&logNo=222491264072,천안시 산림조합입니다 오늘은 저번 포스팅에 이어서 선도산림경영과가 진행한 년풀베기사업 모두베기 현장을 작업사진위주로 소개 시켜드리려고 합니다 지난번에 소개드렸던 둘레베기는 
국립<b>산림</b>과학원(미스킴라일락),https://blog.naver.com/qwerty520?Redirect=Log&logNo=222322518407,국립산림과학원홍릉수목원  사진을 크게 보시려면 클릭하세요 낙우송  낙우송과낙우송 잎어긋나기 메타세콰이어 잎마주나기 오늘 하늘이 열렸습니다 마가목  장미과 솜양지꽃  장미과 타래붓꽃 
불암산 힐링타운 <b>산림</b>치유센터,https://blog.naver.com/dncmcons?Redirect=Log&logNo=221819417466,체험장 산림치유센터가 들러선 불암산 힐링타운 오랜만에 산책 겸 운동 삼아 서울둘레길을 이용해 다시 찾았다 눈에 띄는 것은 작년 월 말 개장 예정이었던 서울시 지자체 최초로 건립된다는 산림치유센터가 
<b>산림</b>사업 등록하자,https://blog.naver.com/maring02?Redirect=Log&logNo=222264163214,산림사업 등록 방법에 대해서 자세하게 알아보도록 하겠습니다 신규 등록을 위해서는 정해진 기준을 산림사업은 업종별로 자본금 기준을 확인해야 합니다 산림경영과 숲가꾸기 도시림 조성은 억 원 이상의 
나주 <b>산림</b>자원연구소 /  나주 나들이 추천 / 나주 데이트... ,https://blog.naver.com/dlfdntjfql?Redirect=Log&logNo=222374254534,나주 산림자원 연구소 관람료 무료 하절기 이용시간은 나주시의 산림자원연구소 관람료 무료 하절기 이용시간은 시까지입장은 시까지였던 것 같다 현지주민왈 아침 일찍오면 사람이 없어서 사진찍기 
<b>산림</b>기사 <b>산림</b>기능사 필기 실기 후기,https://blog.naver.com/gip8066?Redirect=Log&logNo=222193604232,만물정보는 산림과목이랑 무관한 학문을 했습니다 산림 기능사에 도전하게 된 것은 우연에 가깝습니다 년도 중반쯤 직장이 어렵고 힘든 상황 그만두고 어떤 업종에 종사해서 먹고 살 수 있을까 곰곰히 
<b>산림</b>치유 심화 과정 신청란(4월 30일 오전 10시부터 선착순... ,https://blog.naver.com/huyangforyou?Redirect=Log&logNo=222327186196,국립청태산자연휴양림 산림치유 심화 과정 국립 청태산자연휴양림에서는 청태산 숲에서의 활동을 통해 국민의 건강한 삶을 지원하고자 산림치유 심화과정 참가자를 모집합니다 본 게시글의 비밀댓글로 
민주지산 치유의숲-치매예방을 위한 <b>산림</b>치유프로그램,https://blog.naver.com/howkang?Redirect=Log&logNo=222429842319,치매예방을 위한 산림치유프로그램 민주지산 치유의숲  프로그램 목적  치매는 신체적 정신적 사회적 기능을 모두 파괴하는 질병입니다 쾌적한 산림기후 및 다양한 치유숲길과 더불어 
2021<b>산림</b>복지어린이그림공모전/공모전수상작/<b>산림</b>청... ,https://blog.naver.com/arnsart?Redirect=Log&logNo=222448791333,우리 소미아트 친구들이 숲을 아주 멋지게 그려서  산림복지 어린이 그림공모전에서 상을 받았답니다  산림복지 어린이 그림공모전은 마스크 밖 희망의 숲 부제 숲과 희망이 
세종시 주변산 : <b>산림</b>박물관을 원점으로 매봉(6) ~ 국사봉... ,https://blog.naver.com/jslim043?Redirect=Log&logNo=222405134312,아침 일과를 마치고 산행을 하기 위해 산림박물관으로 향한다 주차료 천원이 아까워 번 위치에 쯤 가면 처음에 왔던 로타리가 나오고 건물쪽으로 산림박물관 안내도가 있다 사진을 찍고 도로를 따라 
임산부를 위하는 마음, 숲태교와 <b>산림</b>치유,https://blog.naver.com/k-fowi?Redirect=Log&logNo=221897048866,출처산림복지 블로그기자단 기 김윤경 기자 요즘 코로나로 사회적 거리두기가 한창인데요 저 역시 임산부에게 좋은 산림치유 숲태교 국립산림치유원 이렇게 갑갑해도 제가 불평을 할 수 없는 건 저희 
서천, <b>산림</b>사업 민·관 협력형 <b>산림</b>경영 업무협약 체결,https://blog.naver.com/sinmunman?Redirect=Log&logNo=222205750931,서천군 산림사업 민관 협력형 산림경영 업무협약 체결  서천군 산림조합과 조림사업 등  사업비 억 천만 원 규모 서천군군수 노박래은 월 일 서천군 산림조합과년 민관 협력형 
정부·민간･종교단체, 파주 남북<b>산림</b>협력센터서 남북<b>산림</b>협력... ,https://blog.naver.com/coq?Redirect=Log&logNo=222323630331,산림청이 통일부 민간단체 종교계와 함께 일 경기도 파주시 탄현면 남북산림협력센터에서 탄소 중립 평화의 나무심기 행사를 개최한 가운데 이인영 통일부장관오른쪽 첫번째 최병암 산림청장왼쪽 
<b>산림</b>산업기사 학점은행제 비전공자도 15주만에 자격요건을!,https://blog.naver.com/free1a?Redirect=Log&logNo=222498518368,설명을 드리기전에 산림산업기사 학점은행제에 대한 주요 내용 및 진행사항은 학습자 상황과 여러분의 학습길라잡이 슈가쌤 인사드리겠습니다 ㅎㅎ 이번에는 산림산업기사 학점은행제를 통해 취업이나 
제주시, 올해 상반기 <b>산림</b>병해충 예찰·방제 실시,https://blog.naver.com/kohj007?Redirect=Log&logNo=222276959538,제주시 올해 상반기 산림병해충 예찰방제 실시  제주시는 병해충으로부터 제주산림을 보호하기 위해 오는 일부터 월 일까지 산림병해충 집중 예찰 
한국<b>산림</b>복지진흥원 채용 2020년 하반기 한국<b>산림</b>복지진흥원... ,https://blog.naver.com/tradepeople?Redirect=Log&logNo=222094509428,한국산림복지진흥원 채용 년 하반기 한국산림복지진흥원 신규직원 명 채용 지원기간   목 시   화 시 채용구분 공개채용급급 명 특별채용 명최대 명 응시자격 
꽃이 정원 가득 ~ 신품종 벚나무 수양겹벚나무 천안 <b>산림</b> 나무시장,https://blog.daum.net/1004namu/17183586,꽃이 정원 가득  신품종 벚나무 수양겹벚나무 천안 산림 나무시장 댓글  세종식물원    겹벚나무  산림조합  수양겹벚나무  수양벚나무  신품종 조경수  정원수 추천  조경수 추천  천안 나무시장 
[포이의 여행] 아이들과 가볼만한곳, 놀이 <b>산림</b>복지 비대면... ,https://blog.naver.com/k-fowi?Redirect=Log&logNo=222115323498,참고로 사회적 거리두기 단계 조치에 따라 현재 산림복지시설은 모두 이용이 가능해졌답니다 팔로 팔로 포이 국립산림치유원 힐링로드 마음 잇기 소백산 자락에 위치한 국립산림치유원은 여러 
[국립<b>산림</b>과학원 지금] 남북<b>산림</b>협력, 새로운 전환점이 필요하다,https://blog.naver.com/kfri9612?Redirect=Log&logNo=222492265160,남북산림협력 새로운 전환점이 필요하다 국립산림과학원 남북산림협력 방향과 한반도 환경생태 복원을 위한 논의의 장 마련 한반도국제평화포럼에서 미래 남북산림협력을 위해 함께 가야할 길 세션 
[국립<b>산림</b>과학원 지금] <b>산림</b> 미생물의 미래를 설계하다,https://blog.naver.com/kfri9612?Redirect=Log&logNo=222491120448,산림 미생물의 미래를 설계하다 국립산림과학원 산림 미생물 연구 선도를 위한 심포지엄 개최 국립산림과학원은 산림 미생물 소재 확보방안과 활용기술 개발에 관한 최신 동향을 파악하고 연구 전략을 
✈️ 도심 속 힐링공간, 천안 청수 <b>산림</b>공원에서,https://blog.naver.com/fastcheonan?Redirect=Log&logNo=221973319570,청수 산림공원 품 안으로 들어왔습니다 청수 산림공원은 청수 초등학교와 청수동 극동 차 아파트 뒤편에 자리하고 있습니다 따라서 뒷산의 역할을 톡톡히 해내고 있는 공원입니다 흔히 집 근처 가볍게 
구봉산 산책길 희양숲. 용장 <b>산림</b>공원 #광양산책길 #구봉산산책길,https://blog.naver.com/gwangyangsi?Redirect=Log&logNo=222246377283,성황 용장 산림공원으로 자연의 길 치유의 길 번뇌의 길로 아주 작은 산책코스가 만들어져 있답니다 가득한 광양 구봉산 산책길 희양숲 용장 산림공원 광양산책길 구봉산산책길 천승희 광양시 블로그 기자단
전남도, <b>산림</b>자원연구소에 비즈니스센터․종자양묘기술센터... ,https://blog.naver.com/youngjin6690?Redirect=Log&logNo=222317146168,최용진 기자 승인   산림비즈니스센터 등 조감도 강산뉴스 최용진 기자 전라남도산림자원연구소는 지역 산림바이오 산업의 기반이 될 스마트 산림바이오 혁신성장 거점사업이 
경주여행 :  <b>산림</b> 환경연구원 초록 숲길 산책해요,https://blog.naver.com/lillijy00?Redirect=Log&logNo=221986250942,경주 산림환경 연구원 최강이 백일 여행으로 이곳에 왔었에 저희 가족에게는 더욱 의미 있는곳이예요 입장료  무료  주차장  갓길 주차장 있음 관람시간  시 산림환경연구원은 메인은 
국가<b>산림</b>문화자원 남원 이백면 닭뫼마을 비보림,https://blog.naver.com/goodnamwon?Redirect=Log&logNo=222092921588,국가산림문화자원 남원 이백면 닭뫼마을 비보림 길었던 장마가 걷히고 하늘이 말갛게 좋은 날 언택트 마을이 생긴 지 년이 흘러도 여전히 기대고 싶은 남원 닭뫼마을숲은 년 전 국가산림문화자원으로 
[2021 공무원시험 특집] <b>산림</b> 기능사를 취득하여 국가직 7급... ,https://blog.naver.com/meesug2000?Redirect=Log&logNo=222213816900,업무 특성상 산림 근처에서 근무하게 되는데 이러한 근무 환경에 관심이 있는 사람이라면 전공을  국가직 급 임업직 공무원의 업무와 합격 가능성 국가직 급 임업직 공무원은 산림청 교육인적자원부 
생애주기별 맞춤형 <b>산림</b>복지서비스,https://blog.naver.com/k-fowi?Redirect=Log&logNo=221905862439,출처산림복지 블로그기자단 기 박은하 기자 축령산 산소축제와 함께하는 편백숲 힐링여행 우리는 한평생 숲과 함께 살아갑니다  한국산림복지진흥원은 국민의 건강증진과 삶의 질 향상 행복추구를 목표로 
<b>산림</b>복지바우처 신청,https://blog.naver.com/oh_eun_ju75?Redirect=Log&logNo=222503850314,소개한국산림복지진흥원  산림복지서비스이용권 지원 사업이란경제적 사회적 어려움을 가진 산림복지소외자가 산림복지서비스를 이용할 수 있도록 일정 금액의 이용권을 지원하는 
담당자, <b>산림</b>치유지도사가 선정한 국립<b>산림</b>치유원 BEST 4!,https://blog.naver.com/k-fowi?Redirect=Log&logNo=221936186257,출처산림복지 블로그기자단 기 김윤경 기자 국립산림치유원 안녕하세요 산림복지진흥원 블로그 기자단입니다 오늘은 지친 마음을 쉬기 좋은 경북 영주에 있는 국립산림치유원의 명소를 추천 받아 
<b>산림</b>공학기술자 <b>산림</b>기사 양산 임업기술훈련원 수료 했습니다.,https://blog.naver.com/gip8066?Redirect=Log&logNo=222233870331,지난 월일 부터 양산 임업기술훈련원에서 산림기사들을 상대로 산림공학 기술자 전문 자격증 과정 교육을 이주 동안 실시하여 오늘 대장정의 자격증 수료교육을 마치는 날입니다 산림공학기술자 산림기사 
공주10경:  <b>산림</b>휴양마을, 금학생태공원,https://blog.naver.com/ssdkim121?Redirect=Log&logNo=222166451922,공주산림휴양마을 안내도 주차장 생태습지 비오톱  화장실 사계절 썰매장 아랫수원지 환경성 건강센터 윗수원지 산림문화휴양관 자생식물원 야영장 숲속의 집 목재문화체험관 유아숲 
<b>산림</b>청, <b>산림</b>생태복원과 신설… <b>산림</b>생태계 복원 정책 추진,https://blog.naver.com/coq?Redirect=Log&logNo=222292513348,산림청은 산림복원정책 전담부서인 산림생태복원과를 일 자로 신설했다 산림청청장 최병암은 산림복원정책 전담부서인 산림생태복원과를 일 자로 신설했다 이날 산림청에 따르면 그동안 산림생태계 
북한 <b>산림</b> 복원프로젝트는 어떻게 진행되고 있을까요?,https://blog.naver.com/gounikorea?Redirect=Log&logNo=222197079556, 식수절을 맞이해 나무를 심고 있는 북한 주민들 사진 출처 북한의 산림 훼손 상황은 심각한 그렇다면 북한 내 산림 수준이 어떤 상황이기에 북한 당국 차원에서 큰 관심을 가지는 걸까요 이번 
최병암 <b>산림</b>청장, 한·영 간 탄소 중립 등 기후협력 ‘가속화’,https://blog.naver.com/coq?Redirect=Log&logNo=222302787848,최병암 산림청장사진 오른쪽 첫번째은 일 주한영국대사 관저에서 영국의 알록 샤마  제차 유엔기후변화협약 당사국총회 의장을 면담했다사진산림청 최병암 산림청장은 일 주한영국대사 
<b>산림</b>작업사고, 이제 안전한 개인보호장비로 지켜드리겠습니다!... ,https://blog.naver.com/kofpi?Redirect=Log&logNo=222073492353,임업기계장비 품질인증제도와 연계하여 산림작업 시 안전한 개인보호장비 선택기준에 대해서 알아보겠습니다  산림작업 안전모  산림작업 안전화  산림작업 안전장갑  산림작업복 상의  
스위스 <b>산림</b>은 내가 지킨다,https://blog.naver.com/mllehong?Redirect=Log&logNo=222460655279,스위스 산림을 지키는 보안관의 모습인데 군청색 제복에 붉은 깃털단추 포인드 푸른 하늘과 초록빛 산과 지켜보는 푸르고 깊은 눈빛까지 컬러 매칭이 참 자연스럽고 고급지네요 잘은 모르겠지만 왠지 
<b>산림</b>기사 취득 후 <b>산림</b>경영기술자 신청,https://blog.naver.com/84conan?Redirect=Log&logNo=222094356908,산림기사 취득 후 산림경영기술자를 신청하는 방법입니다 사업체 기업에 취업을 할 경우 산림경영기술자 또는 산림공학기술자 자격증 사본을 요구하는 경우가 있습니다 그래서 산림기사 자격 취득 
영주 가볼만한 곳 국립<b>산림</b>치유원 마실치유숲길 걸으며 봄마중... ,https://blog.naver.com/anjr615?Redirect=Log&logNo=222253096360,어제는 먼저 온 봄 마중을 하려고 국립산림치유원 마실치유숲길을 다녀왔습니다  국립산림치유원 경북 영주시 봉현면 테라피로   산림체험 종류  건강증진센터 수치료 센터 치유숲길 숙박 
인간과 자연의 공존을 도와주는 <b>산림</b>교육,https://blog.naver.com/k-fowi?Redirect=Log&logNo=221907831704,출처산림복지 블로그기자단 기 이난희 기자 주말이면 집 근처의 낮은 산이라도 올라갔다가 와야 이를 보다 체계적으로 올바르고 자세하게 알 수 있도록 교육을 해 주는 것이 산림교육이랍니다 
<b>산림</b>복지서비스이용권(바우처) 이렇게 사용하세요!,https://blog.naver.com/k-fowi?Redirect=Log&logNo=221560265439,출처산림복지 블로그 기자단 기 엄윤주 기자 복지는 그 뜻으로 행복한 삶을 의미하며 만족할 만한 특히나 국토의 가 산림인 우리나라에서 산림이 주는 복지는 환경오염 문제가 날로 심각해지는 요즘 
충남 <b>산림</b>자원연구소 보령사무소, 아름다운 특화임도 조성,https://blog.naver.com/sinmunman?Redirect=Log&logNo=222227713483,충남 산림자원연구소 보령사무소 아름다운 특화임도 조성  임도 순절토 시공 및 경관 특화 충남산림자원연구소 보령사무소는 재해에 안전하고 경관이 아름다운 특화임도를 조성한다고 밝혔다 우선 
[경기IN] 연천군, 장마철 <b>산림</b>피해 예방 사방사업 완료,https://blog.naver.com/dhgytjr55?Redirect=Log&logNo=222405591590,장마철 산림피해 예방 위해 사방사업 완료 사진 경기오효석 기자 연천군이 장마철 집중호우로 인한 산림피해 예방에 총력을 기울이고 있다 연천군은 사방댐 개소 계류보전 개소 등 총 개소에 
지자체와 협업을 통한 <b>산림</b>복지시설 확충,https://blog.naver.com/koreareg?Redirect=Log&logNo=222481969499,산림청과 함께 국민과 함께 함께 해서 더 큰 행복 지자체와 협업을 통한 산림복지시설 확충 이렇게 함께 했습니다 이렇게 함께 했습니다 힘을 더하니 행복이 곱해졌어요 사업 계획수립 단계부터 설계 
제주시 <b>산림</b>조합이 운영하는 가든센터 제주도 묘목시장,https://blog.naver.com/cagycagy?Redirect=Log&logNo=222266132219,그래서 어찌할까 하다가 제주시 산림조합에 가면 도움을 받을 수 있다 해서 방문했다가 인연이 되었는데 그분이 저희집 오셔서 심기 좋은 나무도 추천해주시고 하셨는데 그분이 제주시 산림조합이 운영하는 
자연과 소통하고 배우는 부산<b>산림</b>교육센터 가족숲체험에... ,https://blog.naver.com/with_pen?Redirect=Log&logNo=222037211002,옛 윤산중학교 자리에 생긴 부산산림교육센터에 다녀왔습니다 금정구 금사동에 위치한 부산산림교육센터는 주중에는 유아와 초등학생들이 단체로 이용하는 생태놀이 및 숲체험으로 주말에는 가족숲체험 
숲속의 작은집 (forest house) <b>산림</b>경영관리사 7월 23일 일상,https://blog.naver.com/hajongho?Redirect=Log&logNo=222443511980,자운리는 산림 휴양치유마을 이네요 가을에 한번 걸어볼 계획입니다 파란 하늘 모습이 이쁨니다 저멀리 숲속의 작은집 숲속작은집 진열대캐빈오프그리드산속오지홍천산림경영관리사농막산막 
‘다짜고짜 인터뷰’ 국립<b>산림</b>치유원 우상기 <b>산림</b>치유지도사,https://blog.naver.com/k-fowi?Redirect=Log&logNo=221988656440,출처산림복지 블로그기자단 기 이난희 기자 지난 일 제기 산림복지 블로그기자단으로 경북 영주시 봉현면에 자리한 국립산림치유원에서 열린 팸투어에 다녀왔습니다 산림치유 프로그램을 처음으로 
김현준교수(<b>산림</b>자원학과) 2021 KCA우수전문인 어워즈 수상,https://blog.naver.com/yeschonnam?Redirect=Log&logNo=222310857439,김현준 교수산림자원학과는 연구분야를 산림생장 및 측정분야에서 생태계 단위로까지 확장함으로써 생태계 단위에서 일어나는 기후변화나 다양한 현상을 임목 단위에서의 반응과 함께 연구했다 또한 
<b>산림</b>기능사 취득하여 취미를 직업으로,https://blog.naver.com/boboshan?Redirect=Log&logNo=222168257939,그로인해 관련 자격증을 찾아보았고 산림기능사 라는 것을 알게 되어 큰 고민 없이 도전하게 되었어요 산림기능사는 주로 산림과 관련한 전문이론을 갖고 숲 가꾸기 산림보호 등등 산림생산에 관한 업무를 
괴산군의 성불산<b>산림</b>휴양단지가 숙박료를 인하합니다!,https://blog.naver.com/goesan-gun?Redirect=Log&logNo=222015675244,충북 괴산지역 대표 휴양림인 성불산산림휴양단지가 숙박료를 한시적으로 인하해 운영됩니다 코로나 사태가 장기화하면서 침체된 지역경제에 활력을 불어넣고 여가 및 산림복지서비스 기회 확대를 
[영상] VLOG│국립<b>산림</b>치유원 1박2일 가족 여행 (수치유센터... ,https://blog.naver.com/k-fowi?Redirect=Log&logNo=222173000265,출처산림복지 블로그기자단 기 장하나 기자 국립산림치유원 박일 가족 여행  국립산림치유원에 하루 있다가 가면 년을 더 산다 두 번 오면 년을 더 산다 코로나 시대의 부모님 효도 여행 어디로 
하반기 <b>산림</b> 및 환경 분야 공공일자리 확대,https://blog.naver.com/gnfeel?Redirect=Log&logNo=222032308609,산림병해충방제작업단 등 개 사업 개 공공일자리 마련 취업취약계층 코로나로 실직폐업을 경험한 자 등 우선 선발 경상남도도지사 김경수는 하반기 산림 및 환경 분야 개 사업에 공공일자리 개를 
코로나19 팬데믹 시대 속 숲이 전해주는 삶, 인니 <b>산림</b> 사진... ,https://blog.naver.com/coq?Redirect=Log&logNo=222308448165,사진산림청 청년부 등금상 맹그로브 숲 청년부 등은상 우리의 희망 일반부 등대상 아침기운 일반부 등금상 대학캠퍼스와 주변 일반부 등은상 맹그로브 돌보기 산림청청장 최병암은 
바다로 떠나는 <b>산림</b>치유 당일치기 힐링여행,https://blog.naver.com/yesworker?Redirect=Log&logNo=222154501775,산림치유는 산에서만 해야 되나요 한창 산림치유 수업의 열기가 고조되던 시간 교실 귀퉁에서 손을 번쩍들어 올린 용감한 한 소년의 입에서 나오는 힘차고 열정이 넘치는 질문으로 우리 모두는 한 바탕 
온라인으로 국민 2,160명과 <b>산림</b>건강식 나눴다!,https://blog.daum.net/kfs4079/17215478,온라인으로 국민 명과 산림건강식 나눴다 댓글  읽는 산림청숲     산림  산림복지  산림복지서비스  산림청  비대면 산림건강식 나눔 행사 온포유 성황리 개최  산림청은 
<b>산림</b>청, 겨울철 <b>산림</b> 내 야영·취사 특별단속,https://blog.naver.com/coq?Redirect=Log&logNo=222235351102,인제군 곰배령사진산림청 강원 인제군 곰배령 산림유전자원보호구역 산림청청장 박종호은 산림생태계 훼손방지와 안전사고 예방을 위해 월 말까지 산림유전자원보호구역과 백두대간보호구역내 야영 
남북<b>산림</b>협력센터 준공, 남북관계 발전의 마중물 역할 기대,https://blog.naver.com/nuacmail?Redirect=Log&logNo=221995848958,경기 파주시에 위치한 남북산림협력센터  사진  남북산림협력센터 제공 우리나라에는 유독 산이 많습니다 그리고 모든 산은 푸른 숲으로 뒤덮여있죠 하지만 푸른 숲을 향유한 역사가 오래지 않았다는 
<b>산림</b>청, ‘<b>산림</b>과학기술 국민 참여 아이디어 공모전’ 개최,https://blog.naver.com/coq?Redirect=Log&logNo=222295038679,산림청청장 최병암은 한국임업진흥원원장 이강오과 함께 일부터 월 까지 산림과학기술 연구과제 발굴을 위한 제회 산림과학기술 국민 참여 아이디어 공모전을 개최한다 산림과학기술 국민 
진안임업훈련원에 <b>산림</b>기사 2차 작업형 실기 특강 다녀왔어요.,https://blog.naver.com/sinjong3?Redirect=Log&logNo=222034315147,산림기사 차 작업형 실기시험 어떻게 준비하셔요 저는 진안임업훈련원에 박일 산림기사 차 실기 작업형 특강을 듣고 왔어요 지난 월일 산림기사 차 필기시험을 마치고 월 일 합격차 발표 후 월 일 
<b>산림</b>기사 응시자격 까다로운 편일까?,https://blog.naver.com/magician_e?Redirect=Log&logNo=222447266881,이렇듯 나무와 숲 산림을 즐기며 기분도 풀리고 다시 시작해도 좋을 것 같은 기운도 느낄 수 있습니다 위와 같이 우리의 마음까지 치유하여 주는 숲을 관리하는 국가기술자격이 있습니다 산림기사가 그 
너무 값싼 나무시세, 정선군<b>산림</b>조합 나무전시판매장의 묘목값.,https://blog.naver.com/lkl7383?Redirect=Log&logNo=222294048423,나무심기를 생각하니 마침 정선군산림조합의 나무전시 판매장이 식목일 전에 열려서 월 중순까지 명칭은 굉장히 길어서 산림조합 임산물유통센터    뭐 길지만 여름철 주말에 매일 들르던 범바윗골 
천안시 <b>산림</b>조합 강의,https://blog.naver.com/kang591115?Redirect=Log&logNo=222442512931,천안시 산림조합 농임산물 포장디자인 강의 오늘 오전에 천안시 산림조합에서 농임산물 포장디자인 교육을 진행했습니다 집에서 그리 먼거리도 아니고 오랜만에 충청도에서 강의를 진행하게 되었답니다 
최병암 <b>산림</b>청장, 유엔 기후변화협약 국제 행사서 공동협력 제안,https://blog.naver.com/coq?Redirect=Log&logNo=222312256018,최병암 산림청장은 일현지 시각 오후 시 분 오는 월 영국 글래스고에서 열리는 제차 유엔기후변화협약 당사국 총회 를 앞두고 의장국인 영국이 개최하는 산림농업과 상품무역 대화 
