제목,링크,내용
<b>커피</b> - 나무위키,https://namu.wiki/w/%EC%BB%A4%ED%94%BC,    일반적으로 커피 열매커피체리의 씨앗인 커피 콩 혹은 그 씨앗을 볶은 뒤 갈아서 물에 우려내서 만드는 음료 커피나무 의 열매 그 열매 속의 씨앗 씨앗의 껍질을 벗기고 말린 생두 생두를 볶은 
<b>커피</b>-<b>커피</b>/차/음료-주방/푸드 바보사랑,https://www.babosarang.co.kr/product/product_cate_list.php?snNum=xwzvxwfvxwGD, 하이드로 더치커피 콜드브루 원두커피 하이드로 더치커피 콜드브루 원두커피  팩 하이드로 더치커피 콜드브루 원두커피  팩 하이드로 더치커피 콜드브루 원두커피  팩
<b>커피</b>빈,https://www.coffeebeankorea.com/,      커피빈코리아                                                       
<b>커피</b> - <b>커피</b>존 공식쇼핑몰,http://coffeezone.kr/goods/goods_list.php?cateCd=001,추천상품 커피존 페가수스 블렌드  원 원 커피존 레오 블렌드  원 원 포르테 캡슐커피 종 모음 골드 다크 프리미엄 콜롬비아 클래식 원 원 커피 상품  개 추천순 
빽다방 메뉴 목록 <b>커피</b>,https://paikdabang.com/menu/menu_coffee/,커피 뉴 크롭 원두를 사용하여 더욱더 신선한 커피 메뉴를 만나보세요 신메뉴 커피 음료 아이스크림디저트 빽스치노 추천메뉴 원조커피  달달연유라떼  빽 라떼  
카테고리 &gt; <b>커피</b>, 스타벅스,http://starbucks.ssg.com/disp/category.ssg?dispCtgId=6000154718,  개입원 개 원두커피  스타벅스 네스프레소 하우스 블렌드원 당원 개 원두커피   개입원 개당원 개 원두커피 새벽배송 
<b>커피</b> – 백괴사전, 너희 모두의 백과사전,https://www.uncyclopedia.kr/wiki/%EC%BB%A4%ED%94%BC,코피 혹은 커피콩국물는의 어른들이 즐겨 마시는 기호품 중 하나로 먹을 커피를 어른들이 다 마시고 있는 중이라고 한다 그래서 그리고 초딩들은 절대로 커피를 마시지 않게 되었다으로 유명한 
알라딘: <b>커피</b>,https://www.aladin.co.kr/home/wcoffeemain.aspx,좋은 커피입니다오렌지의 산미 파인애플의 단맛 얼그레이의 은은한 향이 좋은 커피입니다 레드와인의 산미 초콜릿의 단맛 바닐라빈의 은은한향이 좋은 커피입니다 초콜릿의 단맛 오렌지의 산미 견과류의 
<b>커피</b> | Starbucks Coffee Korea,https://www.starbucks.co.kr/coffee/product_list.do,분류 보기 스타벅스 원두 전체 상품보기 블론드 로스트 미디엄 로스트 다크 로스트 플레이버 리저브 원두 스타벅스 비아 스타벅스 오리가미 상세분류 블론드 로스트 미디엄 로스트 다크 로스트 플레이버 리저브 원두
<b>커피</b> 머신 | 세코와 필립스 - 필립스코리아,https://www.philips.co.kr/c-m-ho/coffee,필립스 커피 머신을 만나 보세요  고객 지원 정보 커피 머신 소개를 통해 꼭 맞는 필립스 커피 메이커를 찾으실 수 있습니다
온라인 <b>커피</b> 플랫폼, 더컵,https://www.the-cup.co.kr/,카페 창업의 모든 정보를 담은 온라인 커피 플랫폼 
스타벅스 1 페이지 | 오늘의<b>커피</b>,https://todaycoffee.kr/list/proofshot/1,카충ㅎ     댓글 어이없네요 레니    댓글 슈크림라떼와 삼일절카드 레니    댓글 삼일절굿즈 사게 줄섰어용 레니    댓글 별받고왔어용 
<b>커피</b>리브레,https://coffeelibre.kr/,세계적인 스페셜티 커피 브랜드 지속가능한 발전관계를 위한 직거래  커피 착한커피
여러분의 정원에 <b>커피</b> 찌꺼기를 활용해야 할 이유가 있습니다 - 팁과 요령,https://www.tipsandtrickskorea.com/%EC%A7%91%EA%B3%BC%EC%A0%95%EC%9B%90/%EC%BB%A4%ED%94%BC-%EC%B0%8C%EA%BA%BC%EA%B8%B0%EC%A0%95%EC%9B%90/,봄날이 되면 우리는 바깥에 앉아 햇볕을 즐기고자 합니다 여러분이 정원에서 많은 시간을 보낸다면 아마도 그 정원을 더욱 아름답고 예쁘게 가꾸고 싶을 것입니다 정원의 식물을 조금이라도 더 빠르게 자라게 할 수
<b>커피</b>메뉴 | 스트릿츄러스,http://www.streetchurros.co.kr/hm_board/menu/gallery.php?code=hm_menu&cate=menu4,회사소개 프랜차이즈 메뉴 매장 커뮤니티 인사제도 메뉴 커피 스트릿츄러스 메뉴 건강과 행복은 같다는 믿음을 바탕으로 신선한 원재료를 사용하여 매일 매일 각 매장에서 직접 정성껏 만들고 있습니다 매장 
COFFEEBAY,https://www.coffeebay.com/,커피전문점 창업 프랜차이즈 카페 창업절차 커피 아카데미 이벤트 메뉴 전국매장 안내
<b>커피</b> - 리브레 위키,https://librewiki.net/wiki/%EC%BB%A4%ED%94%BC,전 세계적으로 가장 많이 소비되는 음료 중 하나커피란 커피 열매의 씨앗인 커피 빈을 볶아서 뜨거운 물에 내린 음료이다 어원은 힘을 뜻하는 아랍어 까흐와  이다 커피가 인간의 음료로 
마시그래이 | <b>커피</b>,https://www.masigray.com:5021/Menu/List.asp?s_cate=0,메뉴 차별화된  브랜드 마시그래이   커피  커피 신메뉴 커피 음료 디저트 상품 아메리카노 아메리카노 카푸치노 카페라떼 카페라떼 바닐라라떼 바닐라라떼 카라멜라떼 
오리지널 &amp; 버츄오 <b>커피</b> 주문 | 캡슐<b>커피</b> | 네스프레소,https://www.nespresso.com/kr/ko/order/capsules,다양한 종류의 네스프레소 커피 캡슐 각각의 커피가 가진 개성과 특별한 아로마를 만나보세요 모두 다른 맛과 향을 가진 커피 속에서 고객님께 잘 맞는 커피를 찾아보세요
<b>커피</b> 1 페이지 &gt; 매머드<b>커피</b> - MAMMOTH COFFEE,http://www.mmthcoffee.com/bbs/board.php?bo_table=ex_coffee,커피 매머드익스프레스의 다양한 음료와 푸드를 즐겨보세요 토피넛 샷 라떼 바닐라 라떼
<b>커피</b> 주문 ㅣ 네스프레소 프로페셔널,https://www.nespresso.com/pro/kr/ko/order/capsules,다양한 종류의 네스프레소 커피 캡슐 각각의 커피가 가진 개성과 특별한 아로마를 만나보세요
<b>커피</b> - 포르테<b>커피</b> 쇼핑몰,https://www.coffeeforte.com/goods/catalog?code=0002,싱글 커피포르테 에스프레소 종 캡슐을 한팩에 컬렉션팩 묵직한 바디감과 입안 가득 고소한 맛을 느낄 포르테커피의 캡슐커피 종 모음 큐업시리즈는 주문 후 로스팅 되는 제품입니다 큐업시리즈는 주문 후 
<b>커피</b> - 배스킨라빈스,https://www.baskinrobbins.co.kr/menu/list.php?top=D,아메리카노 아메리카노 카페브리즈 구매 아이스 아메리카노 아메리카노 카페브리즈 구매 아메리카노  아메리카노 구매 아이스 아메리카노 아이스 아메리카노 구매 에스프레소 아포가토 에스프레소 
<b>커피</b> - 우주라이크<b>커피</b>,http://www.wouldulike.co.kr/default/product/product_1.php?tit=03&sub=01&com_board_category_code=c1, 커피 음료 스무디프라페 디저트 시즌메뉴
<b>커피</b> – 카페게이트,https://cafegate.co.kr/%EC%B9%B4%ED%8E%98%EA%B2%8C%EC%9D%B4%ED%8A%B8-%EC%BB%A4%ED%94%BC/,대부분의 커피는 에스프레소 샷이 기본으로 깊고 진한 풍미의 커피를 만들고 있습니다 크림아메리카노 깊고 진한 맛을 위해  사이즈로 제공하여 마지막 한 모금까지 맛있고 향긋한 커피를 즐기실 수 있습니다
<b>커피</b>,http://cl.ncclick.co.kr/TagClick.asp?tagkwd=%uCEE4%uD53C&ac=MPK_kukinews_371, 
<b>커피</b> 1 페이지 &gt; 매머드<b>커피</b> - MAMMOTH COFFEE,http://www.mmthcoffee.com/bbs/board.php?bo_table=mm_coffee,커피 매머드커피의 다양한 음료와 푸드를 즐겨보세요 코코넛 사이공 라떼 카페 모카
<b>커피</b>스미스,http://coffeesmith.co.kr/,커피 전문 프랜차이즈 메뉴소개 가맹점현황 창업상담 등 안내
<b>커피</b>프린스 1호점 | GO! MBC,http://program.imbc.com/coffeeprince, 드라마 커피프린스 호점 방영기간     프로그램 메뉴 다시보기  다시보기  아쉬움 만큼 사랑이 되는 커피  다시보기  사랑도 커피처럼 잠시 
#<b>커피</b> 해시태그 • Instagram 사진 및 동영상,https://www.instagram.com/explore/tags/%EC%BB%A4%ED%94%BC/,게시물 만개  커피 해시태그가 표시된  사진 및 동영상 보기
<b>커피</b> | 드롱기 공식 사이트,https://www.delonghi.com/ko-kr/products/coffee,맞는 커피머신을 찾아보세요  원두에서 커피까지 당신을 위한 완벽함이 월 전자동 커피머신 출시 드롱기 구름치노 출시 드롱기가 처음으로 선보이는 우유 
아이러브<b>커피</b> - 홈 | Facebook,https://www.facebook.com/ilovecoffeemobile,아이러브커피 좋아하는 사람 명  이야기하고 있는 사람들 명 아이러브커피 공식 팬 페이지 입니다 아이러브커피의 다양한 소식들을 확인해보세요
<b>커피</b> 18725 - 무료 다운로드 - illustAC,https://ac-illust.com/ko/clip-art/18725/%EC%BB%A4%ED%94%BC,무료 커피 이미지를 다운로드하세요 최고의 무료 커피 콩 벡터 사진 및 이미지
<b>커피</b> - 도소매 원두<b>커피</b> 전문 쇼핑몰 스미스바니,https://www.smithbarneycoffee.com/goods/goods_list.php?cateCd=008,      월요일금요일      점심시간      토일요일 공휴일 휴무   경기도 고양시 일산동구 장진천길번길   
<b>커피</b>커퍼,http://cupper.kr/,커피커퍼 소개 커퍼 커피박물관 외부 사업 쇼핑몰 등 안내
<b>커피</b>명가 – 꿈, 한 잔의 <b>커피</b>, 그리고 밝은 생각,https://myungga.com/,핸드드립 커피전문점 국가별 커피소개 원두 커피머신 추출용품 등 판매 매장 안내
사단법인 한국 <b>커피</b>협회,https://www.kca-coffee.org/,바리스타자격시험티마스터자격시험커피지도사로스트마스터워터소물리에향미평가사국가대표선발전학술및교육
강릉<b>커피</b>축제,https://www.coffeefestival.net/,강릉커피축제 커피도시 강릉 커피별
<b>커피</b> - <b>커피</b>온리,https://www.coffee900.com/menu/menu.html?sca=C,신제품 시그니쳐 커피 온리밀크 티에이드 스무디 디저트 아메리카노  카페라떼   막심커피   더블카카오라떼    바닐라라떼  
<b>커피</b> 1 페이지 | 텐퍼센트<b>커피</b>,http://www.tenpercentcoffee.com/bbs/board.php?bo_table=sub2_2,시즌신메뉴 커피 음료티 아이스크림디저트  커피 돌체콜드브루라떼 플랫화이트 달고나 카페라떼 밀크카라멜 라떼 콜드브루라떼 말차카페라떼 아인슈페너 아이스크림라떼 돌체라떼 
만랩<b>커피</b>,https://www.10000lab.com/,만랩커피
아이러브<b>커피</b> - PATI Games,https://www.patigames.com/games/3,할아버지가 물려주신 커피숍 꽃미남 건물주 가브리엘 신메뉴 개발을 도와주는 절친 소설가 제이 할아버지의 비서실장 차도녀 케이트와 함께 커피숍을 운영하고 키워가는 이야기입니다
오늘의<b>커피</b>,https://todaycoffee.kr/,오늘의커피 오커  스벅케이알 커피를 좋아하는 사람들의 모임 스타벅스 오늘의커피 블루보틀 원두 커피 커피 이용팁 및 각종 정보 공유
<b>커피</b> 94344 - 무료 다운로드 - illustAC,https://ac-illust.com/ko/clip-art/94344/%EC%BB%A4%ED%94%BC,무료 커피 이미지를 다운로드하세요 최고의 무료 커피 벡터 사진 및 이미지
모모스<b>커피</b>-Specialty for All,http://momos.co.kr/,산지 직거래 스페셜티 커피의 대표 브랜드
송성봉<b>커피</b>- 당신의<b>커피</b>라이프를위한,http://sccoffee.kr/,스페셜티 커피 전문 로스팅 회사 원두커피 싱글오리진 커피 드립백
메뉴 - 하삼동<b>커피</b>,https://www.hasamdong.com/16,메뉴 안내  하삼동에서 행복한 커피 한잔 하삼동은 고급원두를 사용하여 매일 직접 로스팅을 합니다 전체 메뉴 시그니처 커 피 라떼버블티 스무디 주스에이드 티 디져트  커피샷이 
<b>커피</b> 17748 - 무료 다운로드 - illustAC,https://ac-illust.com/ko/clip-art/17748/%EC%BB%A4%ED%94%BC,무료 커피 이미지를 다운로드하세요 최고의 무료 음료 벡터 사진 및 이미지
<b>커피</b> 21753 - 무료 다운로드 - illustAC,https://ac-illust.com/ko/clip-art/21753/%EC%BB%A4%ED%94%BC,무료 커피 이미지를 다운로드하세요 최고의 무료 뜨거운 커피 벡터 사진 및 이미지
<b>커피</b> 10g, 원두 60알의 '비밀 공식' - 조선닷컴 인포그래픽스 - 인터랙티브 &gt; 라이프,http://thestory.chosun.com/site/data/html_dir/2011/09/16/2011091601010.html,커피의 본능은 유혹 진한 향기는 와인보다 달콤하고 부드러운 맛은 키스보다 황홀하다 악마처럼 검고 지옥처럼 뜨거우며 사랑처럼 달콤하다 
MENU 메뉴안내, 매장위치, 이벤트, 가맹점개설, 공지사항 composecoffee.com - 컴포즈<b>커피</b> 공식 홈페이지,https://composecoffee.com/index.php?mid=board_koTk88&category=185,  전체 커피 더치커피 논커피 라떼 주스 스무디 티 에이드 프라페 밀크쉐이크 사이드메뉴 목록     
서울<b>커피</b>엑스포,http://www.coffeexpo.co.kr/,커피 원두부터 머신 장비 디저트가 한자리에 국내 최대 규모 커피 전문 전시회 서울커피엑스포
커넥츠<b>커피</b>,https://connectscoffee.com/,스페셜티 커피 농장 직거래 커피 맛있는원두가 있는 곳
<b>커피</b> – BOOKTABLE,https://booktable.kr/product-category/%EA%B0%80%EC%A0%95-%EC%82%B4%EB%A6%BC/%EC%9A%94%EB%A6%AC/%EC%B0%A8-%EC%88%A0-%EC%9D%8C%EB%A3%8C/%EC%BB%A4%ED%94%BC/,루디 커피의 세계 세계의 커피 세트스펙트럼총서 루디 커피의 세계 세계의 커피  스펙트럼총서 루디 커피의 세계 세계의 커피
송도<b>커피</b>,https://songdocoffee.com/,스페셜티 커피원두 정기배송커피교육  커피송도커피커피교육커피
감성<b>커피</b>,http://www.xn--439as41bv4jv9f.com/,감성카페빅사이즈 아메리카노국대급바리스타티마스터커피생활속커피즐거운 커피생활감성커피
직장인 소개팅 - <b>커피</b>한잔,https://withcoffee.app/companies/major,커피한잔은 회사 이메일로 인증을 하고 가입하는 블라인드 데이트 어플 이에요 대 소개팅을 원하시는 직장인 분이라면 커피한잔에 잘 오셨습니다
회현<b>커피</b>,http://h-coffee.co.kr/,회현커피 커피와 인연을 맺은지 벌써 년 속초 커피벨트를 시작으로 고성 삼척 강릉 익산 커피벨트를 거처 지금은 회현커피와 회현커피 를 운영하고 있습니다 회현커피 좋은 생두를 찾아 확보하는 일
<b>커피</b>로드/<b>커피</b>말고,https://coffeelord.com/,네스프레소 호환 캡슐커피 커피말고 캡슐티 드립백 커피 싱글오리진 블렌딩 종 국내제조의 신선함을 느껴보세요  가능 바리스타클래식 프로 공식 수입원    
<b>커피</b>의 향긋한 블로그,https://blog.naver.com/673400,약 천 명의 구독자를 보유한 커피의 향긋한 블로그의 블로그 약  건의 게시물이 있습니다 다양한 게임 정보를 전달하는 커피의 향긋한 블로그입니다  마인크래프트 리그오브레전드
<b>커피</b> 64939 - 무료 다운로드 - photoAC,https://photo-ac.com/ko/photo/64939/%EC%BB%A4%ED%94%BC,무료 커피 사진을 다운로드하세요 최고의 무료 커피 이미지와 사진
<b>커피</b> 106434 - 무료 다운로드 - illustAC,https://ac-illust.com/ko/clip-art/106434/%EC%BB%A4%ED%94%BC,무료 커피 이미지를 다운로드하세요 최고의 무료 커피 벡터 사진 및 이미지
<b>커피</b> 트래블 150팩 | 캡슐<b>커피</b> | 네스프레소,https://www.nespresso.com/kr/ko/order/capsules/original/travel-150-coffee-assortment,커피 트래블 팩은 아메리카 아프리카 아시아 등 각각의 원산지 고유의 개성을 지닌 커피들로 구성되어 있으며 커피 한 모금을 마실 때 마다 각 커피가 가진 깊고 풍부한 아로마를 느낄 수 있습니다 인도 
<b>커피</b>한잔,https://blog.naver.com/my1002,약 천 명의 구독자를 보유한 커피한잔의 블로그 약 천 건의 게시물이 있습니다  블로그년차 오늘은 또 어떤 재미난 일이
오리지널 | <b>커피</b> 캡슐 | 네스프레소,https://www.nespresso.com/kr/ko/original-coffee-capsules,네스프레소 오리지널 캡슐과 함께 클래식한 에스프레소 커피 경험을 즐겨보세요 각각의 커피가 가진 고유한 개성의 맛과 아로마를 확인하여 가장 잘 맞는 커피를 찾아보세요
<b>커피</b>라는 행복 맥심 - YouTube,https://www.youtube.com/channel/UCbyV_HczPmqn2LthdcBIl2Q,약 만 명의 구독자를 보유한 커피라는 행복 맥심의 유튜브 약  개의 동영상이 있습니다
이 블로그의 <b>커피</b> 원두 보관 방법,https://digestiblecoffee.tistory.com/157,이런저런 커피 원두 보관 방법을 탐구한 끝에 찾아낸 상온 보관법과 냉동 보관법을 열 달 가까이 사용했습니다 보관 방법에 변화를 줄 필요도 느끼지 못했고요 이 정도면 안정화가 되었다는 생각이 들어 정리하
<b>커피</b>전문점 브랜드별 <b>커피</b> 컵 사이즈 비교 - coffee4m,https://coffee4m.com/%EC%BB%A4%ED%94%BC%EC%A0%84%EB%AC%B8%EC%A0%90-%EC%BB%A4%ED%94%BC-%EC%BB%B5-%EC%82%AC%EC%9D%B4%EC%A6%88/,커피전문점인 스타벅스 투썸플레이스 메가커피 이디야 커피빈 빽다방 할리스 파스쿠찌 폴바셋 그리고 엔제리너스에서 사용하고 있는 커피 컵 사이즈를 비교합니다 부피와 부피의 단위에 대한 설명까지
프롬하츠<b>커피</b>,https://www.fromheartscoffee.com/,프롬하츠커피 공식 홈페이지 메뉴 매장 이벤트 및 채용 정보 등 제공
<b>커피</b> - 공차,https://www.gong-cha.co.kr/brand/menu/product.php?c=001011,음료 공차의 다양한 음료를 소개합니다 메뉴 음료 시즌 메뉴 베스트 콤비네이션 오리지널 티 밀크티 브라운슈가 과일믹스 스무디 커피 커피 아메리카노 카페라떼 바닐라 카페라떼 모카 카페라떼
<b>커피</b>관련용품 - <b>커피</b>박물관 카페뮤제오,https://www.caffemuseo.co.kr/shop/list.asp?ca1=accessary&pagenum=8,커피관련용품     리스 드립스케일  화이트 원   본막 미니오크통소  원  누보 그라인더 원형 청소용솔네츄럴 우드 원  
<b>커피</b> 찌꺼기 활용 꿀팁 14가지 - 더 팁 The Tip,https://www.thetip.kr/coffee-residue-uses/,음료 커피 이른 아침 향긋한 내음과 함께 잠을 깨우고 일에 치인 늦저녁 정신이 번쩍 들게 하는 커피는 현대인의 일상에 필수 아이템으로 자리잡았습니다 이제는 종류별 원산지별로 다양한 원두커피를 
<b>커피</b> 찌꺼기의 놀라운 활용법 4 - 코메디닷컴,http://kormedi.com/1316820/%EC%BB%A4%ED%94%BC-%EC%B0%8C%EA%BA%BC%EA%B8%B0%EC%9D%98-%EB%86%80%EB%9D%BC%EC%9A%B4-%ED%99%9C%EC%9A%A9%EB%B2%95-4/,커피를 적당히 마시면 건강에 좋다는 연구가 여럿이다 커피를 내리고 난 원두 찌꺼기는 대개 커피숍 흡연 구역의 재떨이에 들어가곤 한다 더 유용한 쓰임새는 없을까 영국 가디언이 활용법을 정리했다 비누
<b>커피</b>구매 - 이츠이츠-베트남<b>커피</b> 공식몰,https://m.itsits.co.kr/_sub/coffee.html,이츠이츠소개 커피구매 맛보고구매하자 이벤트박스 쿠폰서랍 리얼후기 마이홈카페 행운팡팡 가맹점 안내 커피구매 그곳에 갈수 없다면 이츠이츠 베트남 커피
이디야<b>커피</b> 공식 블로그,https://blog.naver.com/ediya-coffee,약 천 명의 구독자를 보유한이디야커피의 블로그 약  건의 게시물이 있습니다 좋은 커피를 드리고 싶은 진심을 담아낸 이디야커피 공식 블로그입니다 
<b>커피</b>랩,http://www.acup.co.kr/, 커피랩의 모든 제품 사진과 컨텐츠는 저작권의 보호를 받습니다 상호 커피랩  대표 김병우  광주광역시 광산구 임방울대로 도천동층  대표전화   사업자등록번호   통신판매 신고번호 제 
<b>커피</b>팟 COFFEEPOT,https://coffeepot.me/,쉽고 재밌는 해외 비즈 뉴스레터   월 일 남은 음식 공유 앱이 풀고 있는 문제  올리오라는 앱  서브스택의 실행  인스타카트 업데이트 샷 추가  월 일 올버즈의 지속가능한   란 무엇인가  한발 더 양보한 애플  월  
<b>커피</b>/음료/차 | Amway Korea - 한국암웨이,https://www.amway.co.kr/shop/one-for-one/drink/c/drink,문화와 자연을 향유할 수 있는 암웨이 커피음료차를 만나보세요
<b>커피</b> - Stardew Valley Wiki,https://ko.stardewvalleywiki.com/%EC%BB%A4%ED%94%BC,커피는 술통에 커피콩 개를 넣어서 만드는 먹을 수 있는 장인 제작품입니다 주점에서 골드에 구매할 수도 있습니다
<b>커피</b>로드 <b>커피</b>머신,https://coffeelord.com/index.html?var=GoodList&varTopNo=25&large_number2=124,커피로드커피머신 간편하게 캡슐커피의 맛과 향을 추출합니다
빽다방 ::: <b>커피</b>이야기,https://paikdabang.com/about/story/,커피를 머금었을 때 입안을 감싸는 실키함이 편안한 에프터를 선사합니다 추천 메뉴  빽 라떼 브라질 원두 특유의 고소한 풍미와 바디감이 신선한 우유와 만나 최상의 밸런스를 이룹니다
게이샤는 <b>커피</b> 맛도 모르는 돈 많은 아시아인의 <b>커피</b>일까? : 사회일반 : 사회 : 뉴스 : 한겨레,https://www.hani.co.kr/arti/society/society_general/970912.html,토요판 서필훈의 얼굴 있는 커피 파나마 게이샤 커피  베스트 오브 파나마 위 게이샤 일반 스페셜티보다 배 이상 비싸상류층 소유한 대농장 중심 생산 실제 소농들은 큰 위험 감수해야 게이샤 마케팅이
아브라함<b>커피</b>,http://ljy877.cafe24.com/,여러분의 행커 쇼핑몰 아브라함커피  이디오피아 시다모  디카페인 부드러운 산미와 다양한 향미를 보존한 디카페인 커피 원 특가할인 아이레아 브루잉머신 업소용 반자동 브루잉 머신 원 원 우간다 주쿠카 보라 워시드 구수하고 바디 
마실<b>커피</b>,https://masil.lifeapp.kr/,마실나와서 마실커피 커피음료전문점
<b>커피</b> 상품리스트 | 이미지 사용조건이 까다롭지 않은,https://www.sk5.co.kr/shop/list.php?ca_id=0a27,음료 커피맥주전통차주스팥빙수화채음료술칵테일 테이크아웃아이스커피 원 테이크아웃아이스카페모카 원 핫초코 원 모카캐러멜라떼 원 아이스헤이즐넛커피  
Suan Coffee,https://www.suancoffee.com/,검색원두  싱글 오리진 원두  블렌드 드립 백 콜드 브루 캡슐 커피 선물 세트 납품 정보 재료의 수안커피 주소  부산광역시 동래구 충렬대로번길  사업자번호   대표 
하루 <b>커피</b> 2~3잔, 코로나 감염 위험 낮춰 - 아시아경제,https://www.asiae.co.kr/article/2021071208082817761,커피를 하루 최소 잔만 마셔도 코로나에 걸릴 확률이  정도 낮아진다는 연구결과가 나왔다 미국 일리노이주 소재 노스웨스턴대학의 연구진은 최근 발간된 국제 영양학 저널 뉴트리언츠
블랙로드<b>커피</b>,https://blackroad.kr/,다양한 커피를 탐험합니다   알림뒤로  커피탐험원두구매 탐험가이드 사이트 로고 로그인 위젯 문구 로그인 위젯 문구 로그인 위젯 문구   사이트 로고   키트  바로가기 바로가기 바로가기    |  
<b>커피</b> 혜택 - VIP 라운지,https://mlounge.bugs.co.kr/list?category=1,책으로 하는 모든 활동이 이루어지는 공간 대구의 감성 충전 힐링 공간에서 책과 함께 달콤한 휴식을 답답한 일상에서 벗어나 책과 함께 커피 한 잔의 여유를 느껴보세요 닥치는 대로 끌리는 대로 오직 재미있게
<b>커피</b> 캡슐 찾기 &amp; 캡슐 종류 추천 | 네스프레소 <b>커피</b> 이야기 | 네스프레소 코리아,https://www.nespresso.com/kr/ko/grands-crus-coffee-range#!/by-range,    네스프레소 커피 커피의 기원 커피의 여정 내게 맞는 커피 찾기 최상의 커피 경험 최상의 커피 경험 네스프레소와 함께 단 한번의 터치로 최고의 커피를 만나보세요 다양한 네스프레소 
먼셀<b>커피</b>,http://munsellcoffee.com/,최고 전문 로스터들이 로스팅한 스페셜 티
달걀에 <b>커피</b> 한잔… 괜찮은 아침 식사 7가지 - 코메디닷컴,http://kormedi.com/1209996/%EB%8B%AC%EA%B1%80%EC%97%90-%EC%BB%A4%ED%94%BC-%ED%95%9C%EC%9E%94-%EA%B4%9C%EC%B0%AE%EC%9D%80-%EC%95%84%EC%B9%A8-%EC%8B%9D%EC%82%AC-7%EA%B0%80%EC%A7%80/,장기간의 의학적 연구결과 커피는 부작용보다는 효능이 훨씬 많은 카페인 음료로 나타났다 하루에 커피는 정신을 맑게 하고 집중력을 높일 뿐만 아니라 심장질환과 대장암 등 암 발병 위험을 낮추며 
필기 접수 - 한국<b>커피</b>바리스타협회,https://www.caea.or.kr/pc/i_html/c/01.php, 커피관련 경력자 및 기타 자격 취득자는 본원 인증 필수입니다 평일 시 이후 주말공휴일 경우 문의한 날짜 기준으로 적용됩니다
