제목,링크,내용
TEN PERCENT - 텐퍼센트<b>커피</b>,http://www.tenpercentcoffee.com/sub01/sub1_1.php,자체공장에서 직배송하여 마진을 최소화 하였습니다 점주에겐 미래를 향한 기회를 제공하고 소비자에겐 고품질 커피에 대한 경험과 만족을 제공하고 우리는 커피인으로서 전문자의 자긍심을 지키고자 합니다
<b>커피</b>의 항산화 물질 클로로겐산. 건강한 <b>커피</b>생활 - coffee4m,https://coffee4m.com/%EC%BB%A4%ED%94%BC-%ED%95%AD%EC%82%B0%ED%99%94-%EB%AC%BC%EC%A7%88-%ED%81%B4%EB%A1%9C%EB%A1%9C%EA%B2%90%EC%82%B0/,커피에 들어 있는 성분 중 건강에 이로운 대표적인 성분은 항산화 물질 클로로겐산입니다 이 포스팅에서는 이 커피의 항산화 물질 중 하나인 클로로겐산이 무엇인지 건강에는 어떠한 이로운 점이 있는지 그리고
센터<b>커피</b> | 서울숲 맛집·카페 - 망고플레이트,http://www.mangoplate.com/restaurants/Nel5gICwJ98Y,센터커피의 리뷰 사진 특색 주소 전화번호 영업시간 등의 정보를 망고플레이트에서 확인해보세요
<b>커피</b> | 무료 클립 아트 | illustAC,https://ac-illust.com/ko/clip-art/765785/%EC%BB%A4%ED%94%BC,의  만 개가 넘는 무료 벡터 클립 아트 및 일러스트레이션 라이브러리에서 커피 음료 컵 머그컵 카페에 대한 무료 이미지를 다운로드하십시오
<b>커피</b>머신3 | 신혼부부 집들이 선물 추천템, <b>커피</b> 머신 추천 8!,https://alivingtime.com/coffeemachinerecommend/,가지 커피 머신 종류 별로 커피 머신 추천을 해드리겠습니다 커피메이커 전자동 커피 머신 반자동 커피 머신 캡슐 커피머신 마다 어떤 제품이 요즘 인기가 있는지 궁금하지 않으신가요 또한 어떤 특징이 있는지
[<b>커피</b>라는 행복, 맥심] 맥심과 나의 겨울 이야기,http://www.happymaxim.co.kr/index.asp,맥심커피와 함께했던 당신만의 특별한 겨울 이야기를 들려주세요스메그 커피포트 한정판 맥심커피 옥스포드 블록 등 총 분께 푸짐한 경품을 드립니다
하이드로 더치<b>커피</b> 콜드브루 10+10+5 외 - 옥션,http://itempage3.auction.co.kr/DetailView.aspx?ItemNo=B487523824, 하이드로 더치커피 콜드브루  외  구매  남은수량 개    원 원 마트 쿨세일   쿠폰받으러가기 출발일 확인 불가  택배 택배  무료배송 스마일클럽 최대  
<b>커피</b>로드 블렌딩,https://coffeelord.com/index.html?var=GoodList&varTopNo=25&large_number2=131,커피로드블렌딩 한국인 입맛에 맞게 블렌딩한 다양한 제품을 만나보세요
<b>커피</b> 많이 마시면 골다공증? (연구) - 코메디닷컴,http://kormedi.com/1349942/%EC%BB%A4%ED%94%BC-%EB%A7%8E%EC%9D%B4-%EB%A7%88%EC%8B%9C%EB%A9%B4-%EA%B3%A8%EB%8B%A4%EA%B3%B5%EC%A6%9D-%EC%97%B0%EA%B5%AC/,하루에 커피를 석 잔 넘게 마시는 사람들이 귀 기울여야 할 연구 결과가 나왔다 카페인 섭취가 과하면 골다공증에 걸릴 위험이 커진다는 것 호주의 사우스오스트레일리아대 의대 등 연구진은 건강한 성인 명을
<b>커피</b>에 넣으면 안 되는, 최악의 4가지 - 코메디닷컴,http://kormedi.com/1215694/%EC%BB%A4%ED%94%BC%EC%97%90-%EB%84%A3%EC%9C%BC%EB%A9%B4-%EC%95%88-%EB%90%98%EB%8A%94-%EC%B5%9C%EC%95%85%EC%9D%98-4%EA%B0%80%EC%A7%80/,커피를 좋아하는 것은 확실히 나쁜 일은 아니다 커피는 기억력과 기분 심장 건강을 증강시키고 당뇨병 위험을 낮춘다 문제는 당분이 많이 들어간 인공의 유독성 첨가제다 바리스타들도 굿을 외치며 이런
흰옷 <b>커피</b>자국 어떻게 없앨까? <b>커피</b> 얼룩 제거 방법 알아보기 &lt; 생활문화 &lt; 라이프 &lt; 기사본문 - 문화뉴스,http://www.mhns.co.kr/news/articleView.html?idxno=356429,문화뉴스  오지현 기자 한국인의 커피 사랑은 세계 어느 나라에 뒤지지 않을 만큼 뜨겁다 길거리를 조금만 걸어봐도 곳곳에 있는 커피 판매점들이 들어서 있고 매일 아침과 점심시간이 되면 언제나 사람들로
에스프레소 – 백미당 | 百味堂,https://1964baekmidang.com/menu/%EC%97%90%EC%8A%A4%ED%94%84%EB%A0%88%EC%86%8C/,라떼가 맛있는 백미당 산지별 유기농 원두의 특징을 조화롭게 살린  블렌드와 유기농 우유에 대한 전문성을 바탕으로 개발된 백미당만의 커피입니다
과학이 밝혀낸 <b>커피</b>의 효능 11가지 - 코메디닷컴,http://kormedi.com/1219204/%EA%B3%BC%ED%95%99%EC%9D%B4-%EB%B0%9D%ED%98%80%EB%82%B8-%EC%BB%A4%ED%94%BC%EC%9D%98-%ED%9A%A8%EB%8A%A5-11%EA%B0%80%EC%A7%80/,매일 커피를 마시면 어떤 영양학적 효과가 있을까 미국의 질의응답 사이트인 쿠오라에서 이 질문에 대해 독특한 통찰력을 가진 사람들이 답한 것들이 각종 통신망 등을 통해 퍼지고 있다 여러
러쉬 컵 오 <b>커피</b> 130g/325g - 러쉬코리아(LUSH KOREA),https://www.lush.co.kr/goods/goods_view.php?goodsNo=167,잠 든 피부를 깨우는 마법 컵 오 커피 
<b>커피</b> Archives - 블록인프레스,https://blockinpress.com/archives/tag/%EC%BB%A4%ED%94%BC,커피 원두의 공급망을 추적한다 일현지시간 암호화폐 전문 매체 코인텔레그래프에 따르면 스먹커는 콜롬비아 커피 원두의 앞으로 스먹커의  커피 소비자들은 모바일 
달리는 <b>커피</b>는? | 달리는<b>커피</b>,http://www.dalcu.co.kr/bbs/content.php?co_id=about, 달리는 커피는 넘어지지 않는 노하우 가맹점을 위해 달리다 성공창업을 향해 달리다 새소식  매장안내 달커스피디 위와 같이 개인정보를 수집이용하는데 동의합니다 상호  주달리는커피코리아 대표  윤은총  
충주<b>커피</b>나무펜션,http://coffeetreeps.kr/,충주펜션 제천펜션 월악산 덕주사 독채펜션 카라반 커피나무펜션 카페 편의점
<b>커피</b>랑도서관 - 홈 | Facebook,https://www.facebook.com/coffeelaonlibrary,커피랑도서관 서울 좋아하는 사람 명  이야기하고 있는 사람들 명 비전을 품고 기도하고 공부하라 품격있게 공부하는 영국형 도서관 커피랑도서관입니다 카페 개방형파티션형고시형스터디룸까지
버츄오 | <b>커피</b> 캡슐 | 네스프레소,https://www.nespresso.com/kr/ko/vertuo-coffee-capsules,혁신적인 센트리퓨전 회전 추출이 만드는 풍성한 크레마와 깊은 바디감의 커피를 가지 사이즈의 큰 컵으로 즐겨보세요
<b>커피</b> 부럽지 않다…뇌를 깨우는 음료들 - 코메디닷컴,http://kormedi.com/1332927/%EC%BB%A4%ED%94%BC-%EB%B6%80%EB%9F%BD%EC%A7%80-%EC%95%8A%EB%8B%A4%EB%87%8C-%EA%B9%A8%EC%9A%B0%EB%8A%94-%EC%9D%8C%EB%A3%8C%EB%93%A4/,뇌를 활성화시키는 대표적인 음료로는 커피가 꼽힌다 한 설문 조사에 따르면 미국인 중 는 매일 커피를 마시는 것으로 나타났다 커피에 포함된 카페인은 뇌에 각성 효과를 주면서 집중력을 높이는 데 도움을 준다
<b>커피</b> 그라인더 추천 인기순위 원두 분쇄기 2021 | 화이트리뷰,https://whitepen.co.kr/%EC%BB%A4%ED%94%BC-%EA%B7%B8%EB%9D%BC%EC%9D%B8%EB%8D%94-%EC%B6%94%EC%B2%9C/,커피 그라인더 추천 인기순위 가성비 원두 분쇄기 전동 그라인더 및 멧돌 타입의 커피 머신 만원대 내외에서 구매할 수 있는 최고의 가정용 제품들을 확인해보시고 한번 맛들이면 바깥에서 커피를 사먹을 수 없다는
900+개의 <b>커피</b> 아이디어 | <b>커피</b>, <b>커피</b> 인용구, <b>커피</b> 디스펜서,https://www.pinterest.com/pomaker/%EC%BB%A4%ED%94%BC/,    에서 명이 팔로우한 님의 커피 보드를 살펴보세요 커피 커피 인용구 커피 디스펜서에 관한 아이디어를 더 확인해 보세요
<b>커피</b>/베이킹용품 | 코스트코 코리아,https://www.costco.co.kr/HomeKitchen/Kitchen-Accessories/Coffe-AccessoriesBakeware/c/cos_2.5.2,정렬       원 아소부 뉴 푸어 오버 커피메이   상품 비교하기 원 아소부 뉴 콜드브루 커피   카트에 담기 상품 비교하기 원 칼리타 커피 
종류별 <b>커피</b>를 찾아보세요 | 스타벅스® <b>커피</b> 앳 홈,https://www.starbucksathome.com/kr/our-coffees,스타벅스  블론드 에스프레소 홀빈 스타벅스  블론드 로스트 본 사이트의 쿠키에 대하여 우리의 사이트는 쿠키와 기타 기술을 사용하여 우리와 우리의 파트너가 사용자를 기억하고 사용자의 우리 사이트 
아이러브<b>커피</b>N 공식카페,https://cafe.naver.com/coffeenmobile,약 만 명의 회원을 보유한 아이러브커피 공식카페 열매단계 등급입니다 처음하는 카페 프랜차이즈 아이러브커피
<b>커피</b> 사이즈 뜻, Grande(그란데), Venti(벤티) / 스타벅스 - [영어단어풀이#5],https://hanpuri.com/86,커피 사이즈 때문에 당황하신 적 없으신가요 사이즈를 몰라서 또는 영어로 써있었지만 영어 단어 같지 않아서 발음도 제대로 못한적은 없으신가요 우리에게 익숙한 스몰 미디엄 라지 레귤러 빅 등등 이런
알라딘 <b>커피</b> - 알라딘모바일,https://www.aladin.co.kr/m/main.aspx?tab=coffee,에티오피아 예가체프 레코 딸기 자스민 꿀 드립백 에티오피아 예가체프 레코 딸기 자스민 꿀 엘살바도르 엘 보르보욘 복숭아 코코넛 볶은 아몬드 드립백 엘살바도르 엘 보르보욘 복숭아 코코넛 볶은 아몬드 
